title,news,img-url,category,summery,opinion
South Korea's burned out millennials choose YouTube over Samsung,"
SEOUL (Reuters) - Yoon Chang-hyunâs parents told him to get his sanity checked when he quit his secure job as a researcher at Samsung Electronics Co in 2015 to start his own YouTube channel.
The 65 million won (44,271 pounds) a year salary - triple South Koreaâs average entry level wage - plus top-notch healthcare and other benefits offered by the worldâs biggest smartphone and memory chip maker was the envy of many college graduates.
But burned out and disillusioned by repeated night shifts, narrowing opportunities for promotion and skyrocketing property prices that have pushed home ownership out of reach, the then 32-year old Yoon gave it all up in favour of an uncertain career as an internet content provider.

Yoon is among a growing wave of South Korean millennials ditching stable white collar jobs, even as unemployment spikes and millions of others still fight to get into the powerful, family-controlled conglomerates known as chaebol.
Some young Koreans are also moving out of city for farming or taking blue collar jobs abroad, shunning their societyâs traditional measures of success - well-paid office work, raising a family and buying an apartment.
âI got asked a lot if I had gone crazy,â Yoon said. âBut Iâd quit again if I go back. My bosses didnât look happy. They were overworked, lonely...â
Yoon now runs a YouTube channel about pursuing dream jobs and is supporting himself from his savings.

Samsung Electronics declined to comment for this article.
Chaebols such as Samsung and Hyundai powered South Koreaâs dramatic rise from the ashes of the 1950-53 war into Asiaâs fourth-largest economy in less than a generation. Well-paid, secure jobs provided a gateway to the middle-class for many baby boomers.
But with economic growth stagnating and competition from lower cost producers weighing on wages, even milliennials who graduated from top universities and secured chaebol jobs say they are less inclined to try to fulfil societyâs expectations.
Similar issues among younger workers are being seen globally. However, South Koreaâs strict hierarchical corporate culture and oversupply of college graduates with homogeneous skills make the problem worse, says Ban Ga-woon, a labour market researcher at state-run Korea Research Institute for Vocational Education & Training.

South Koreans had the shortest job tenure among member countries in the Organisation for Economic Co-operation and Development (OECD) as of 2012, just 6.6 years compared to the average of 9.4 years and 11.5 years in neighbouring Japan.
The same survey also showed barely 55 percent of South Koreans were satisfied with their jobs, the lowest rate in the OECD.
This January, âquitting jobsâ appeared on the nationâs top 10 new year resolution list on major social media sites.

âDONâT TELL THE BOSSâ

Some workers are even going back to school to learn how to do just that.
A small three-classroom campus in southern Seoul, named âSchool of Quitting Jobsâ, has attracted over 7,000 attendees since opening in 2016, founder Jang Su-han told Reuters.
The 34-year-old Jang, who himself quit Samsung Electronics in 2015 to launch the school, said it now offers about 50 courses, including classes on how-to-YouTube, manage an identity crisis, and how to brainstorm a Plan B.
The schoolâs rules are displayed at its entrance: âDonât tell your bosses, say nothing even if you run into a colleague, and never get caught until your graduation.â

âThere is strong demand for identity-related courses, as so many of us were too busy with cram schools to seriously think about what we want to do when were teenagers,â he said.
To be sure, the lure of a prestigious chaebol job remains strong, especially with the country mired in its worst job slump since 2009 and youth joblessness near a record high.
Samsung Electronics is still the most desired workplace for graduates as of 2019, a survey of 1,040 job seekers by Saramin, a job portal, showed in February.
However, many entering the workforce are much less willing to accept the long hours or mandatory drinking sessions synonymous with the countryâs hierarchical, cutthroat corporate life, says Duncan Harrison, country head of London-based recruitment agency Robert Walters Plc.
âThe mindset of people entering the workforce is very different from past generations,â Harrison said.


YOUTUBER, SPORTS STAR, CLEANER

Among elementary school students, YouTube creator is now the fifth-ranked dream job, behind being a sports star, school teacher, doctor or a chef, a 2018 government poll showed.
Some are choosing a simpler life in the country.
Between 2013 and 2017, South Korea saw a 24 percent increase in the number of households who ditched city life for farming - more than 12,000 in total.
And in the face of dwindling opportunities at home, nearly 5,800 people also went abroad for jobs last year using government-subsidized programmes, more than tripling from 2013, according to government data.
Others left without support or new jobs lined up.
Plant engineer Cho Seung-duk bought one-way tickets to Australia in December with his wife and two kids.
âI donât think my son could get jobs like mine in South Korea,â said 37 year-old Cho, who moved from Hyundai Engineering & Construction to another top construction firm in 2015 before he emigrated.
âI will probably clean offices in Brisbane, but thatâs ok.â",https://img.dunyanews.tv/news/2019/April/04-01-19/news_big_images/484879_83951877.jpg,business,"However, many entering the workforce are much less willing to accept the long hours or mandatory drinking sessions synonymous with the countrys hierarchical, cutthroat corporate life, says Duncan Harrison, country head of London-based recruitment agency Robert Walters Plc.",positive
"Power-hitting a concern for Pakistan, says Mickey Arthur","
LAHORE (Agencies) - Mickey Arthur, the Pakistan coach, has cited one area of concern for Pakistan at the ICC Menâs Cricket World Cup 2019: the lack of power-hitting.
Pakistan were blanked 5-0 against Australia in the United Arab Emirates, and despite a couple of individual performances, their batting was by and large found wanting. When batting first, they failed to press home the advantage, and when chasing, they struggled to take it down to the wire, even losing by 80 runs in the decisive third one-day international.
There were plenty of centuries â two each from Haris Sohail and Mohammad Rizwan, and one from Abid Ali â but as filled as they were with strokes, there was no muscle and power. Arthur was left longing for that.
âThatÂ s one of our areas of concern,"" said Arthur. âWe have to make sure that we get our guys to bat in those positions as best as they can. ThatÂ s the reason we used Faheem Ashraf in two games. He has done hell of a work in that regard and we wanted to give him more batting time. We have worked really hard with Imad Wasim in that role.
âHasan [Ali] can hit the ball long distances. Shadab [Khan] has worked extremely hard on that aspect of his game. Shoaib Malik and Mohammad Hafeez have worked consistently on their power-hitting. But it is an area that is a worry, and we have to work extremely hard to rectify it.â
The series was a test of Pakistanâs bench strength, and despite the loss, it did throw up some interesting talking points ahead of the World Cup, fitness being the top-most among them.
âIÂ ve already asked our skill coaches to give me what they think is necessary for our players. That might be working on death bowling, on variations or bowling slower balls,â he said. âPower-hitting is the one on which we need to work constantly. IÂ ve asked the skill coaches to give me those plans and we will start implementing in the next couple of days.
""Plus, we need our players to have optimum fitness levels. We saw the difference in the field between our normal players, the guys with whom weÂ ve worked for two years, and the players who have just came to our system. The gap is massive, we canÂ t have that happen ever again.â
Pakistanâs preparations for the World Cup arenât done yet. They head to England later this month, where they will play a solitary Twenty20 International and five ODIs. Arthur said this would be the âbest-prepared squad thatâs ever left Pakistanâ for the World Cup.
Â ",https://img.dunyanews.tv/news/2019/April/04-04-19/news_big_images/485332_80692966.jpg,Cricket,"But it is an area that is a worry, and we have to work extremely hard to rectify it.
The series was a test of Pakistans bench strength, and despite the loss, it did throw up some interesting talking points ahead of the World Cup, fitness being the top-most among them.",positive
New Zealand name experienced World Cup squad,"
WELLINGTON (AFP) - New Zealand opted for experience in a 15-man squad named Wednesday for this yearÂ s cricket World Cup, with rookie Tom BlundellÂ s inclusion as back-up wicketkeeper the only real surprise.
The Blacks Caps hope to shed their tag as valiant losers and claim the title after exiting in the semi-finals six times and suffering a heavy defeat to Australia in their only appearance in the final four years ago.
Coach Gary Stead said the Kane Williamson-led Black Caps had repeatedly proved itself at the top level and he was confident the consistency would shine through at the tournament in England and Wales.
""WeÂ ve got a squad here of 15 players that we think can give us a really, really good chance of going far into the tournament,"" he said.
""If we play close to our potential, then hopefully we can do New Zealand proud.""
Wellington keeper Blundell was selected after Tim Siefert, the regular back-up to first-choice gloveman Tom Latham, broke his finger in a domestic match last month.
While Blundell, who has two Test caps, will likely make his one-day international debut at the tournament, his role will be marginal if Latham stays fit.
Mitchell Santner will be the New ZealanderÂ s primary spinner, with Ish Sodhi edging Todd Astle to claim the second slow bowling position.
The pace attack comprises Tim Southee, Trent Boult, Lockie Ferguson and Matt Henry, while Jimmy Neesham and Colin de Grandhomme add allround options.
Henry Nicholls is set to open the batting with veteran Martin Guptill after displacing Colin Munro at the top of the order, although Munro will make the trip as batting cover.
Williamson and Ross Taylor, in his fourth World Cup campaign, complete a battle-hardened batting line up.
Williamson, Taylor and Guptill have collectively amassed 526 ODI appearances between them.
Guptill and Taylor have not confirmed their post-tournament plans but will most likely be looking to exit cricketÂ s biggest stage on a high.
The Black Caps will open their campaign against Sri Lanka in Cardiff on June 1.
New Zealand:
Kane Williamson (capt), Tom Blundell, Trent Boult, Colin de Grandhomme, Lockie Ferguson, Martin Guptill, Matt Henry, Tom Latham, Colin Munro, Jimmy Neesham, Henry Nicholls, Mitchell Santner, Ish Sodhi, Tim Southee, Ross Taylor.",https://img.dunyanews.tv/news/2019/April/04-03-19/news_big_images/485166_27401109.jpg,Cricket,"
WELLINGTON (AFP) - New Zealand opted for experience in a 15-man squad named Wednesday for this year s cricket World Cup, with rookie Tom Blundell s inclusion as back-up wicketkeeper the only real surprise.",positive
Pakistan cricket team to depart for England on April 23,"
LAHORE (APP) - Pakistan cricket team will depart for England on April 23 to participate in the World Cup one day cricket tournament, being played in England and Wales from May 31.
âPak team will play England in a series of practice and international matches, before entering the World Cup 2019 against the West Indies on May 31 at Trent Bridge,â said a spokesman for the PCB here on Tuesday.
As per the ICC regulations, all participating sides have to submit their 15-player World Cup squads by 31 April but can make changes until 22 May without needing the ICCâs approval. Post 23 May, all player replacements will have to be approved by the Event Technical Committee, he said.
Following is the Pakistan cricket teamâs schedule of England:

Series v England

23 April â Departure for England
27 April â v Kent (50-over practice match) (d)
29 April â v Northamptonshire (50-over match) (d)
01 May â v Leicestershire (T20 match) (d/n)
05 May â v England (only T20I), Cardiff (d)
08 May â 1st ODI v England, The Oval (d)
11 May â 2nd ODI v England, Hampshire (d)
14 May â 3rd ODI v England, Bristol (d)
17 May â 4th ODI v England, Trent Bridge (d)
19 May â 5th ODI v England, Leeds (d)

ICC Cricket World Cup 2019 schedule:

24 May â v Afghanistan (warm-up), Bristol (d)
26 May â v Bangladesh (warm-up), Cardiff (d)
31 May â v Windies, Trent Bridge (d)
3 June â v England, Trent Bridge (d)
7 June â v Sri Lanka, Bristol (d)
12 June â v Australia, Taunton (d)
16 June â v India, Old Trafford (d)
23 June â v South Africa, Lordâs (d)
26 June â v New Zealand, Edgbaston (d)
29 June â v Afghanistan, Headingley (d)
5 July â v Bangladesh, Lordâs (d/n)
Â ",https://img.dunyanews.tv/news/2019/April/04-03-19/news_big_images/485160_39365788.jpg,Cricket,"Pak team will play England in a series of practice and international matches, before entering the World Cup 2019 against the West Indies on May 31 at Trent Bridge, said a spokesman for the PCB here on Tuesday.",positive
'I just want to prove it to myself' â Jason Roy opens up on Test ambitions,"
LONDON (Agencies) - Could EnglandÂ s ODI opener Jason Roy be the answer to their top-order struggles in Test cricket? His list of achievements in white-ball cricket is long, and growing by the day. He holds the record for Englandâs highest ODI score â 180 v Australia â and has shared in their highest ODI partnership, an unbeaten 256 with Alex Hales v Sri Lanka in 2016.
He has opened for England in ODIs more often than anyone else since the last Menâs Cricket World Cup, and no one has played more than his 73 ODIs for England without playing at least one Test match.
Following the retirement of Sir Alastair Cook, and with England having struggled even before his departure to find suitable candidates at the top of the order. Since Andrew Strauss retired in 2012, they have tried 13 men in the position. None have lasted more than 20 Tests in the role, or made more than 1,000 runs from the top two.
With the Ashes approaching, RoyÂ s name has floated towards the top of many peopleâs lists, searching for someone comfortable in the international arena and setting the tone of a contest. His first-class record, averaging 46.45 since the start of 2014, also marks him out as a Test candidate. Heâs feeling comfortable with the attention.
âThere are people that want me to play, people that donât want me to play,â Roy said to Sky Sports. âI just want to play to prove it to myself really. To see where Iâm at and to see if I can actually do it. You never know what is going to happen but I just want to put the right stepping stones in and make sure that IÂ m selected, that is the first process.â
One man who knows more opening in Test cricket and Jason Roy than most is former England opener and Surrey director of cricket Alec Stewart, who has emphatically backed his chargeâs Test chances.
âHe is someone who wants to play Test cricket,â Stewart told Sky Sports. âHe is such a talent that I believe can play all forms of the game. I said two years ago that he is good enough to play Test match cricket. He has to have a good World Cup and if he does that, I reckon his name will be near enough at the top of the list to play in that Ashes series.â
Roy has rarely opened in first-class cricket, but Stewart thinks his experience in ODIs should stand him in good stead.
âJason is opening in one-day international cricket. Twenty20 and Test cricket are miles apart, but in the first 10 or 15 overs of 50-over cricket you still have to respect that new ball,â he told BT Sport. âI donât see it as a big issue for him and heâd cope with the stepping stone up to Test cricket.
âThe Australia attack is a challenging attack, but Jasonâs method is a solid one. Heâs a good stroke player and a good hitter of the ball, but he can defend well too, which you have to be able to do.â
Â ",https://img.dunyanews.tv/news/2019/April/04-03-19/news_big_images/485159_37655554.jpg,Cricket,"You never know what is going to happen but I just want to put the right stepping stones in and make sure that I m selected, that is the first process.
One man who knows more opening in Test cricket and Jason Roy than most is former England opener and Surrey director of cricket Alec Stewart, who has emphatically backed his charges Test chances.",neutral
Royal backdrop for Cricket World Cup launch party,"
LONDON (AFP) - The launch for this yearâs cricket World Cup in England will take place on The Mall in central London, organizers hoping for a 4,000 sell-out crowd said on Tuesday.
The Mall which links Buckingham Palace to Trafalgar Square will host the party on May 29, the eve of the opening game between England and South Africa, featuring ""music, dance and some of the biggest names in sport"", according to the organizers.
""The opening party will capture the very essence of what makes this tournament so special and will be hugely exciting for the fans that are lucky enough to attend,"" said World Cup managing director Steve Elworthy.
""The Mall, with Buckingham Palace in the background, is synonymous with some of the biggest events held in the UK and is instantly recognizable to everyone around the globe.
""It will be a fitting celebration of a World Cup, cricket and sport with diversity at its core,"" added the 54-year-old former South Africa bowler.
Tickets for the launch party for the tournament which runs from May 30 to July 14 will be allocated in a free ballot which opens on Thursday.

Â ",https://img.dunyanews.tv/news/2019/April/04-02-19/news_big_images/485149_96524081.jpg,Cricket,"The Mall which links Buckingham Palace to Trafalgar Square will host the party on May 29, the eve of the opening game between England and South Africa, featuring ""music, dance and some of the biggest names in sport"", according to the organizers.",positive
Imad Wasim makes huge gains in ODI rankings after Australia series,"
DUBAI (Web Desk) â Pakistan all-rounder Imad Wasim has made huge gains in the MRF Tyres ICC Menâs ODI Player Rankings after scoring 141 runs in the series against Australia and taking three wickets.
The left-hander, who led his side in the last two matches after Shoaib Malik had to withdraw due to an injury, has gained 16 places to reach 68th among batsmen, advanced seven places to reach 37th in the list of bowlers and moved from 16th to joint-sixth among all-rounders along with West Indies captain Jason Holder.
Others to advance for Pakistan include Haris Sohail (up 33 places to 58th) and Mohammad Rizwan (up 45 places to 101st) among batsmen and Yasir Shah (up four places to 62nd) and Faheem Ashraf (up nine places to 70th) among bowlers.
Australia captain Aaron Finch has moved into the top 10 of the ODI rankings after a superb run in the series against Pakistan which his side won 5-0 to bolster its confidence just two months before the ICC Menâs Cricket World Cup 2019.
The 32-year-oldâs player of the series effort of 451 runs, with two centuries and at an average of 112.75, has seen him gain 12 slots to reach joint-ninth position, even as his other team-mates too made important gains in the list of batsmen with memorable efforts in the five-match series in the United Arab Emirates.
Finchâs opening partner Usman Khawaja has gained six slots to reach 19th position after scoring 272 runs in the series while Glenn Maxwell has advanced 10 places to reach 23rd place with 258 runs. Shaun Marsh has gained three slots to reach 44th after an aggregate of 182 runs.
Among their bowlers, leg-spinner Adam Zampa (up from 49th to 45th) and fast bowler Nathan Coulter-Nile (up from 60th to 49th) have reaped the rewards of taking seven wickets each in the series while Jhye Richardson (up from 47th to 38th) is another one to move up.
There has been no change of positions in the MRF Tyres ICC Menâs ODI Team Rankings but Australia have increased the gap over Pakistan from one to 11 points.













Source: www.icc-cricket.comÂ ",https://img.dunyanews.tv/news/2019/April/04-02-19/news_big_images/485105_47316452.jpg,Cricket,"The left-hander, who led his side in the last two matches after Shoaib Malik had to withdraw due to an injury, has gained 16 places to reach 68th among batsmen, advanced seven places to reach 37th in the list of bowlers and moved from 16th to joint-sixth among all-rounders along with West Indies captain Jason Holder.",negative
No compromise on fitness levels for World Cup: Mickey Arthur,"
LAHORE (Dunya News) â Pakistan cricket team head coach Mickey Arthur said there is no room for compromise on the levels of fitness for the 2019 World Cup, and affirmed that senior players are fit and ready to participate in the mega event.
Mickey Arthur held a press conference in Lahore on Tuesday (today). The head coach said Pakistan will play 11 matches in England before the World Cup and the Green Shirts will train hard in those conditions.
âPakistan displayed wonderful performance in England during the 2017 Champions Trophy, and the team are capable to compete in all situations.â
âInclusion of new players in team is a positive step. The defeat in one-day international series against Australia was disappointing but it was a good opportunity for youngsters to prove their talent.
âRookies Abid Ali and Mohammad Hasnain have impressed a lot and want to perform for the country. Mohammad Amir is very skillful bowler.
âUmar Akmal is a competent player and puts efforts to do well for the team. Chief selector Inzamam-ul-Haq picks good players.âÂ ",https://img.dunyanews.tv/news/2019/April/04-02-19/news_big_images/485078_11678539.jpg,Cricket,"
LAHORE (Dunya News)  Pakistan cricket team head coach Mickey Arthur said there is no room for compromise on the levels of fitness for the 2019 World Cup, and affirmed that senior players are fit and ready to participate in the mega event.",positive
Pakistan cricketers reach Lahore after whitewash by Australia,"
LAHORE (Dunya News) â Pakistan cricketers Tuesday reached Lahore after being whitewashed by Australia in the one-day international (ODI) series held in the United Arab Emirates (UAE).
Mohammad Amir, Umar Akmal, Imam-ul-Haq, Abid Ali, head coach Mickey Arthur arrived at the Allama Iqbal International Airport along with team officials and departed without talking to media.

Read also:Â Umar Akmal fined for âlate night-outâ

The Green Shirts were brushed aside by the Kangaroos in the five-match ODI series. The young Pakistan team failed to perform in the absence of regular skipper Sarfraz Ahmed who was rested for the series.
Shoaib Malik was appointed as the stand-in captain but he also missed the last two games owing to ribs injury. Imad Wasim led the Green Shirts in last two ODIs.Â ",https://img.dunyanews.tv/news/2019/April/04-02-19/news_big_images/485050_57326887.jpg,Cricket,"Read also: Umar Akmal fined for late night-out

The Green Shirts were brushed aside by the Kangaroos in the five-match ODI series.",positive
