title,news,img-url,category,summery,opinion
Grammy-nominated US rapper Nipsey Hussle shot dead: reports,"
WASHINGTON (AFP) - Grammy-nominated rapper Nipsey Hussle was shot dead in the US city of Los Angeles on Sunday, US media reported.
A Los Angeles police department spokesman could not confirm the deceased victimâs name, but told AFP that a shooting on Sunday afternoon had killed one person and wounded two others.
The shooter is still at large, the spokesman said.
Just hours earlier, Hussle -- a 33-year-old whose youth was intertwined with Los Angeles gang culture -- tweeted: ""Having strong enemies is a blessing.""
The rapper was mourned by big names in the music industry.
""Gone 2 soon,"" rapper Snoop Dogg posted on Instagram. ""Iâm so sad right now Iâll just reflect on the good times we had.""
Singer Rihanna also mourned Hussleâs passing, writing on Instagram: ""This doesnât make any sense! My spirit is shaken by this!""
""Iâm so sorry this happened to you,"" she said.
Long part of the underground rap circuit, Hussle struggled to find fame but began selling his own mixtapes, which hip-hop royalty Jay-Z once bought 100 of for $100 each.
He was nominated for Best Rap Album for ""Victory Lap,"" his first formal album that finally dropped in February 2018 after six years of teasing, but lost out to rapâs woman of the moment Cardi B.Â ",https://img.dunyanews.tv/news/2019/April/04-01-19/news_big_images/484869_16421675.jpg,entertainment,"Just hours earlier, Hussle -- a 33-year-old whose youth was intertwined with Los Angeles gang culture -- tweeted: ""Having strong enemies is a blessing.""",positive
"Disney's 'Dumbo' soars, sort of, to top N.American ticket sales","
LOS ANGELES (AFP) - DisneyÂ s new live-action film ""Dumbo"" took flight over the weekend but didnÂ t quite make the expected altitude, taking in an estimated $45 million in North American theaters, industry watcher Exhibitor Relations reported Sunday.
Analysts expected the movie, Tim BurtonÂ s live-action remake of the 1941 classic about a small elephant with huge and magical ears, to take in at least $50 million in its opening three-day weekend, according to Variety. The film had a $170 million production budget.
With a cast including Colin Farrell, Michael Keaton, Eva Green and Danny DeVito, ""Dumbo"" may yet catch on overseas, where it has taken in $71 million. The last Burton/Disney live-action  collaboration, ""Alice in Wonderland,"" earned $1.02 billion worldwide.
""Dumbo"" pushed last weekendÂ s box office leader, ""Us,"" down to second place but the Universal horror film still brought in a respectable $33.6 million. Written and directed by Jordan Peele, ""Us"" stars Lupita NyongÂ o and Winston Duke as a couple frighteningly confronted by their doppelgangers.
In third spot was another Disney film, ""Captain Marvel,"" which had North American ticket sales of $20.5 million, pushing its cumulative worldwide total to just under $1 billion. Oscar winner Brie Larson stars as a former fighter pilot with superpowers.
LionsgateÂ s ""Five Feet Apart,"" featuring Haley Lu Richardson and Cole Sprouse as a pair of enamored teens who must keep their distance as they deal with cystic fibrosis, came in fourth at $6.3 million.
Fifth place went to new release ""Unplanned"" from Christian production company Pure Flix, at $6.1 million -- a shade over its $6 million production budget. Ashley Bratcher stars in the true story of a young Planned Parenthood employee who becomes an anti-abortion activist.
Â ",https://img.dunyanews.tv/news/2019/April/04-01-19/news_big_images/484840_49926402.jpg,entertainment,"Analysts expected the movie, Tim Burton s live-action remake of the 1941 classic about a small elephant with huge and magical ears, to take in at least $50 million in its opening three-day weekend, according to Variety.",positive
Play charts epic rise and fall of Lehman Brothers,"
NEW YORK (AFP) - For one month only, the original Lehman Brothers have returned to New York City, and they have lots to say about the virtues and vices of American capitalism.
Henry, Emanuel and Mayer Lehman are at the center of ""The Lehman Trilogy,"" a play that chronicles how a trio of Jewish immigrant brothers from Germany and their sons grew Lehman Brothers from a tiny cotton broker in Alabama into global financial juggernaut.
The firm survived the Civil War, the 1929 stock market crash and other crises before imploding spectacularly in 2008 to spark the global financial crisis.
The play, which debuted in Paris in 2013 and has played in various incarnations throughout Europe, made its US premiere this week at the Park Avenue Armory in a production originally presented at the National Theatre in London.
The venue is only blocks away from where Mayer and Emanuel lived and walkable from the firmâs midtown headquarters when it went under.
The Oscar- and Tony-winning director Sam Mendes, who was living in New York in 2008, made tweaks in light of the audience.
""In London, it felt slightly broader and more comic and here it is still full of mischief and wit,"" Mendes said in a panel discussion at the Armory.
""But it feels weâre closer to the bone here, and that means you have to take it a little bit more seriously and you need to be careful how you articulate things.""

Three-man show

In a twist, the English-language adaptation features just three actors who take on the personas of the brothers and also play their sons, clients, rivals and wives in the more than three-hour show.
The brothers did business by the handshake and were driven by an abstract hope to make a better life, rather than ""rows and rows of zeroes,"" as Emanuelâs son, Philip Lehman, says at one point.
The continual presence of Henry, Emanuel and Mayer ""holds 1844 all the time... even as the story moves through to 2008,"" said Ben Power, who adapted the script from a 400-page text by Italian playwright and author Stefano Massini.
Versions of the play have run as long as 10 hours with much bigger casts, said Power, who sees a logic in the interest among Europeans in Lehman.
""Itâs a story about European immigrants coming to this country and building something,"" Power said. ""Sometimes it takes an outsider to show you yourself.""

âMerchants of moneyâ

The Lehman saga begins with the arrival in New York in 1844 of the eldest brother Hayum Lehmann, whose name is quickly changed to Henry Lehman before he moves to Montgomery Alabama and opens a general store.
Following the arrival of the younger brothers, they establish ""Lehman Brothers"" in 1850, which evolves into a cotton broker, a business that grows dramatically after Emanuel relocates to New York and markets the commodity to clothing manufacturers.
The firm moves into other commodities and then goes on to finance the national railroad system and the Panama Canal. Its funds also help propel new industries, including air travel, department stores and entertainment, financing the studio that made ""King Kong"" and ""Gone with the Wind.""
Throughout, the Lehman men demonstrate a knack for sussing out an unfilled or unarticulated need that they quickly meet in ways that both anticipate and create the future.
Their efforts help make the United States a superpower, but as the sons of the founders emerge -- American-born men with more distance from the familyâs old-world graciousness and religious faith -- they push the business in new and riskier directions.
""We are merchants of money,"" Philip Lehman tells his father and uncle Mayer as he is seizing control of the company. ""We use money to make more money.""
Reckless speculation creates a bubble that ends with the 1929 crash -- an event that portends 2008 and which is marked in the play with the chilling accounts of young stock brokers who jumped off buildings or shot themselves in the head.
In another fateful moment, Philipâs son Bobbie, the last family member to lead the bank, hires Lewis Glucksman in 1965 to establish a trading division that is housed separately from Lehmanâs headquarters.
""I do the dirty work down in the gutter,"" Glucksman tells Bobbie Lehman. ""A trading division will make you millions in a day, but you wonât be able to show it off in your living room.""
Bobbie later visits Glucksmanâs operation with Paul Mazur, an elderly Lehman partner who serves as a kind of stand-in for the original brothers and is horrified and terrified by what he sees.
""The play tries to chart the way that human beings lose control of the things they create,"" Power said.
""There was a nobility at the beginning. These structures were created in part to make money, but in part to do good,"" Power said. ""It went disastrously wrong and weâre still living with the consequences.""",https://img.dunyanews.tv/news/2019/March/03-31-19/news_big_images/484769_17976178.jpg,entertainment,"""Its a story about European immigrants coming to this country and building something,"" Power said.",positive
Meera stuns everyone with new film poster,"
(Web Desk) - Meera has thrown a curve ball at her fans waiting for her movie Baji, who will first see her now on the silver screen in her new upcoming delight Sohni Mahiwal.
According to media reports, the epic love story, shot some time back got delayed due to work schedule clash.
Muammar Rana, will be seen in the avatar of Mahiwal. The tragic folk love story is all about the budding romance and the opposition they faced from society.
Excitedly, Meera posted a picture of the movie poster from her Instagram account.



Â 

Â 
Â 


Â 




View this post on Instagram

Â 


Â 
Â 
Â 


Â 
Â 


Â 
Â 
Â 



Â 
Â 


Â 

 
The movie is all set to be released on April 5.",https://img.dunyanews.tv/news/2019/March/03-30-19/news_big_images/484724_12155719.jpg,entertainment,"According to media reports, the epic love story, shot some time back got delayed due to work schedule clash.",neutral
First woman to win 'Afghan Star' TV show to fight Taliban with music,"
KABUL (AFP) - The first woman to win the Afghan version of American Idol says she will fight the Taliban with her music, embracing a victory rich in symbolism as her country faces an uncertain future.
Zahra Elham won the 14th edition of Afghan Star last week, after male contestants took the prize in the hugely popular televised singing competition 13 years in a row.
Elham, from Afghanistanâs ethnic Hazara minority, enchanted audiences with her high-pitched, raspy voice, performing Hazara and Persian folk music in traditional loose, colourful Afghan dresses and heels.
The result made international headlines at a time when many women in the deeply patriarchal country fear their hard-won rights may come under threat as Washington, seeking a way out of the war, holds talks with the Taliban.
Elham, who spoke to AFP in an interview at private television channel Tolo, which produces Afghan Star, appeared taken aback by her new fame more than a week on -- but determined to use it to inspire other girls.
""I was very proud of myself but at the same time shocked to be the first woman to win the contest,"" the young woman in her early 20s said, her hair elegantly covered with an olive green scarf, visibly still uncomfortable with a camera.
No one sings in her family, she said. She was inspired to compete after watching YouTube videos of idols such as Aryana Sayeed, an Afghan pop singer and social media star often likened to Kim Kardashian -- a characterisation that in conservative Afghanistan is a bold, deeply political one.
When asked if she, like Sayeed, is now a role model for Afghanistanâs young women, Elhamâs response underscored the importance of her new platform in a country where women are largely absent from public spaces.
""Yes, my voice is important for the women of Afghanistan,"" she replied bluntly.
""Other girls will get courage and sing, like I have been following Aryana Sayeed ... when I saw a girl like Aryana Sayeed I thought to myself, âIf she can, so can I. She has two hands and two legs, as do Iâ.""

âMake my future brightâÂ 


Despite her passion, Elham, who is also a Justin Bieber and Maher Zain fan, says she has no intention of going in to politics.
But if the Taliban return to some semblance of power in Afghanistan, she says, ""I will fight with my music, because I want to make my life music and singing"".
The Taliban used their strict interpretation of Islam to ban music and force women behind closed doors and beneath burkas during their austere rule of Afghanistan from 1996 until they were ousted in 2001.
Since then they have waged an increasingly bloody insurgency against the Afghan government and US-led international troops.
Now, as talks with the US progress, fears are sharp in Kabul that Washington may rush to exit, paving the way for the Taliban to return to some semblance of power in Afghanistan.
Young women, keenly aware of how their gender were suppressed under Taliban rule -- and still facing steep restrictions in Afghanistan today -- are among the most vocal in warning they will not compromise their rights if the insurgents return.
For now, however, Elham says her victory is a matter of pride -- and that she remains focused on her music, with plans to learn the guitar and make more video clips of herself performing.
""I see my future in music, and I can make my future bright with singing,"" she says.Â ",https://img.dunyanews.tv/news/2019/March/03-30-19/news_big_images/484696_34272527.jpg,entertainment,"
KABUL (AFP) - The first woman to win the Afghan version of American Idol says she will fight the Taliban with her music, embracing a victory rich in symbolism as her country faces an uncertain future.",positive
Japan Display to supply OLED screens for Apple Watch,"
TOKYO (Reuters) - Japan Display Inc will begin to supply organic light-emitting diode (OLED) screens for the Apple Watch later this year, two sources said, a breakthrough for the cash-strapped company whose late shift to OLED has cost it orders from Apple.
The supply deal would mark Japan Displayâs foray into the OLED display market, the two sources familiar with the matter said, declining to be identified because they are not authorized to speak to the media.
A spokesman for Japan Display said he could not comment on specific customers.
Japan Displayâs mainstay liquid crystal display (LCD) business has been slumping due to Apple Incâs recent shift away from LCD, and disappointing sales of the iPhone XR, the only LCD model in Appleâs 2018 line-up.
The OLED display market is dominated by Samsung Electronics unit Samsung Display and LG Display, with Chinese players quickly catching up. OLED displays are generally thinner and allow more flexibility than LCD screens.
Samsung Display is currently the exclusive supplier of OLED panels for iPhones, while LG Display provides a majority of panels for the Apple Watch.
Hiroshi Hayase, senior director at IHS Markit, said it is a positive step for Japan Display, but added that the company would face a tough road ahead.Â ",https://img.dunyanews.tv/news/2019/April/04-03-19/news_big_images/485326_47821565.jpg,Technology,"
TOKYO (Reuters) - Japan Display Inc will begin to supply organic light-emitting diode (OLED) screens for the Apple Watch later this year, two sources said, a breakthrough for the cash-strapped company whose late shift to OLED has cost it orders from Apple.",positive
South Korea to launch world's first national 5G networks,"
SEOUL (AFP) - South Korea launches the worldâs first fully-fledged 5G mobile networks Friday, a transformational leap that already has superpowers sparring for control of an innovation that could potentially change the day-to-day lives of billions of people.
The superfast communications heralded by fifth-generation wireless technology will ultimately underpin everything from toasters to telephones; from electric cars to power grids.
But while the South has won the race to be first to provide the user experience, that is only one part of a wider battle that has pitted the United States against China and ensnared giants including Huawei.
Hyper-wired South Korea has long had a reputation for technical prowess, and Seoul has made the 5G rollout a priority as it seeks to stimulate stuttering economic growth.
The system will bring smartphones near-instantaneous connectivity -- 20 times faster than existing 4G -- allowing users to download entire movies in less than a second.
In the same way that 3G enabled widespread mobile web access and 4G made new applications work ranging from social media to Uber, 5G will herald a new level of connectivity, empowered by speed.
It is crucial for the future development of devices ranging from self-driving vehicles that send data traffic to one another in real time, industrial robots, drones and other elements of the Internet of Things.
That makes it a vital part of the infrastructure of tomorrow, and the 5G standard is expected to bring about $565 billion in global economic benefits by 2034, according to the London-based Global System for Mobile Communications, an industry alliance.
Â 
âOne million devicesâ
Â 
Â 
But the implications have pitted Washington against Beijing in an increasingly bitter standoff.
The US has pressed its allies and major economies to avoid 5G solutions from Chinese-owned telecom giant Huawei, citing security risks that technological backdoors could give Beijing access to 5G-connected utilities and other components.
But Chinese firms dominate 5G technology.
Huawei, the global leader, has registered 1,529 5G patents, according to data analysis firm IPlytics.
Combined with manufacturers ZTE and Oppo, plus the China Academy of Telecommunications Technology, Chinese entities own a total of 3,400 patents, it says -- more than a third of the total.
South Korea comes next, with its companies holding 2,051 patents.
In contrast, US firms have 1,368 altogether, IPlytics said -- 29 fewer than Finlandâs Nokia alone.
All three of South Koreaâs mobile operators go live with their 5G services on Friday.
""5Gâs hyper speed can connect one million devices within a one square kilometer zone simultaneously,"" KT said in a report.
Neither KT nor SK Telecom use Huawei technology in their 5G networks, but it is a supplier to LG UPlus, the three companies told AFP.
On the same day, Samsung Electronics will release the Galaxy S10 5G, the worldâs first available smartphone using the technology, and rival phone maker LG follows with the V50s two weeks later.
Â 
- Cost barrier -
More than three million South Koreans will switch to 5G by the end of this year, predicted KT vice-president Lee Pil-jae.
Until now, no mobile networks have offered nationwide 5G access. In the US, hotspots in a few selected cities have offered 5G speeds but over Wi-Fi only, while Qatari firm Ooredoo says it offers 5G services in and around Doha -- but does not have devices available to use them.
US network carrier Verizon will launch fifth-generation services for mobile users in Chicago and Minneapolis next week, with more than 30 cities due to follow this year.
Japan is also expected to roll out a limited deployment in 2019 before full services start in time for next yearâs Tokyo Olympics.
Cost is likely to be a barrier for user uptake initially, analysts say, as the cheapest version of the new Galaxy handset will be priced at 1.39 million won ($1,200).
""While there are many cheap 4G smartphones under $300, Samsungâs 5G phones are well over $1,000, which could be a major minus point for cost-savvy consumers,"" a KT representative told AFP.
None of South KoreaÂ s three network operators would say how much they have invested in 5G -- but SeoulÂ s economy minister Hong Nam-ki put it at least $2.6 billion this year alone.
""If 5G is fully implemented,"" he said, ""it will greatly improve peopleâs lives"".
Â ",https://img.dunyanews.tv/news/2019/April/04-03-19/news_big_images/485263_41387118.jpg,Technology,"The US has pressed its allies and major economies to avoid 5G solutions from Chinese-owned telecom giant Huawei, citing security risks that technological backdoors could give Beijing access to 5G-connected utilities and other components.",negative
New Gmail feature will let users schedule emails,"
(Web Desk) â Googleâs e-mail service Gmail has turned 15 and to celebrate the tech giant has introduced a new feature of scheduling emails for sending them at a particular time.
""Just write your email as you normally would, then schedule it to arrive in your recipientâs inbox at a later date and time,"" Google said in a blog post.
Hereâs how to do it:
Firstly, users need to actually wait for the feature to roll out fully which should happen in the coming days. Google said it started rolling out the feature on Monday but it could take up to a couple weeks to reach everyone.
Users do not need to install any software upgrades to get new features in G Suite. Instead, features appear in usersâ accounts automatically.
Once users have received the update, when it comes to hitting send on an e-mail, you will notice that you can click on a little arrow on the right side of the blue ""Send"" button and then hit ""Schedule send"".
In the mobile app, tap the three dots in the top right corner to bring up the menu which allows you to schedule messages.
From there, users can just choose the date and time you want it to drop into the recipientâs inbox.
Scheduled messages will appear in a ""Scheduled"" folder while queued to be sent.
For some reason, Google thinks this has something to do with respecting peopleâs digital wellness but at any rate, itâs a welcome feature.
Until now, users had to rely on third-party Chrome extensions to schedule your messages or compose an email in draft mode and then go in a hit send at the desired time.
But now users will be able to more easily schedule emails to be sent at any time of day or night.
The company has also improved its Smart Compose technology that guesses what we want to write and pre-empts us with suggestions to speed the whole thing up. Google says it has made the technology work to be more personalised to the user and their writing style.
So hopefully Google can figure out that I am far less liberal with my exclamation marks than it seems to be.
On mobile, Google is also bringing Smart Compose to Android and iOS, no longer making it exclusive to its own Pixel 3 smartphone.",https://img.dunyanews.tv/news/2019/April/04-03-19/news_big_images/485199_12557744.jpg,Technology,"Until now, users had to rely on third-party Chrome extensions to schedule your messages or compose an email in draft mode and then go in a hit send at the desired time.",negative
