title,news,img-url,category,summery,opinion
Yemen rebels deny UN access to food aid: pro-govt source,"
DUBAI (AFP) - Yemeni rebels blocked the UN from accessing vital food aid near the flashpoint port city of Hodeida, a pro-government source said Tuesday.
More than 100 workers were denied access to the Red Sea mills warehouse, said a source in the Saudi-led coalition fighting on the side of the Yemeni government.
""Unfortunately, the Huthi (rebels) have decided to once again renege on a previous commitment, denying the team access to the mills,"" the source told AFP.
In February, a team from the UNÂ s World Food Programme visited the Red Sea mills warehouse for the first time since September, when they became inaccessible due to the conflict between pro-government forces and the Iran-aligned Huthi rebels.
The WFP said laboratory tests confirmed the wheat had been infested with insects and had to be fumigated to feed million of people.
WFP spokesman Herve Verhoosel told AFP Tuesday the mission planned by the UN agency to the Red Sea mills was postponed due to ""security reasons"".
Before the UN lost access in September the Red Sea mills held 51,000 tonnes of grain, which was enough to feed more than 3.7 million people for a month.
This comes after an agreement was struck in Sweden in February, in which Yemeni rivals agreed to redeploy their fighters outside the ports and away from areas that are key to the humanitarian relief effort.
The ports are in the rebel-held west of the country, and the agreement especially set out free access to the Red Sea mills warehouses, under control of the Saudi-backed government forces.
YemenÂ s war escalated in March 2015, when a Saudi-backed coalition intervened against the Iran-aligned Huthi rebels.
Since then, the conflict has killed around 10,000 people -- most of them civilians -- and has left more than 60,000 wounded, according to the World Health Organization.
Â ",https://img.dunyanews.tv/news/2019/April/04-03-19/news_big_images/485173_65887731.jpg,world,"More than 100 workers were denied access to the Red Sea mills warehouse, said a source in the Saudi-led coalition fighting on the side of the Yemeni government.",positive
Red Cross wants to send IS children back,"
NEW YORK (AFP) - The International Red Cross wants hundreds of children of foreign fighters from the Islamic State group in Syria to be allowed to return to their countries of origin and possibly be reunited with family there, the ICRC president said Tuesday.
The children are living without their parents at the Al-Hol camp in northeastern Syria that holds between 80,000 and 100,000 people displaced in the assault by US-backed forces against the last IS holdout.
About 10,000 foreign women and children with ties to IS foreign fighters are held in a separate area of the camp, with children under 12 accounting for two-thirds of this group.
""Our priority is to proactively look to bring kids back to their country of origin where there are hopefully still family if there are unaccompanied,"" Peter Maurer, president of the International Committee for the Red Cross (ICRC), told reporters.
Foreigners at Al-Hol camp are from some 30 to 40 countries.
Once the identity of the children is established, the Red Cross will notify governments and see if there is family in those countries ""to which we can send the kids back"", Maurer told reporters.
He did not have a specific figure for the number of children without their parents at Al-Hol camp, but estimated that there were ""certainly hundreds, maybe more.""
With the collapse of the last IS bastion in Syria last month, several governments have been grappling with the problem of what to do with captured jihadist fighters from their country, the women who married them and their children.
The ICRC president complained that governments were showing little interest in tackling the problem of foreign nationals linked to IS, limiting their response to offering emergency assistance.
""ThatÂ s not really the big issue,"" said Maurer. ""The big issue will be: how do we find a system which deals with the different categories of people, which tries to identify who is a victim, to look at individual cases,"" he said.
France last month took in five orphans, but it has a case-by-case approach to the return of the children.
Â ",https://img.dunyanews.tv/news/2019/April/04-03-19/news_big_images/485172_83078053.jpg,world,"
NEW YORK (AFP) - The International Red Cross wants hundreds of children of foreign fighters from the Islamic State group in Syria to be allowed to return to their countries of origin and possibly be reunited with family there, the ICRC president said Tuesday.",positive
"Floods hit 40,000 displaced people in northwest Syria: UN","
BEIRUT (AFP) - More than 40,000 displaced people in northwestern Syria have seen their camps flooded by heavy rains in the past three days, a United Nations spokesman said Tuesday.
Around 14 camps were affected in the northwestern province of Idlib, David Swanson of the UN Office for the Coordination of Humanitarian Affairs told AFP.
The Idlib region, controlled by SyriaÂ s former Al-Qaeda affiliate, is home to more than 3 million people -- more than half of them displaced by the countryÂ s eight-year war.
Civil defence workers known as the White Helmets have been working to save people and their scant belongings from the rising muddy waters.
""For the second day in a row, White Helmets... continue to respond to the catastrophic situation in the northern Syria camps,"" they said on Twitter late Monday.
One video posted by the group on Sunday showed brown water cascading out of a flooded tent.
In another published the same day, civil defence workers clung on to a rope as they waded through a brown torrent above knee level.
The downpour has affected tens of thousands of civilians, displaced persons, crops and livestock in Idlib, as well as in the Aleppo and Hasakeh provinces since Saturday, Swanson said.
In Aleppo province, tents were destroyed in several camps for the displaced and a hospital in the countryside had to shut down due to the flooding.
SyriaÂ s war has killed more than 370,000 people and displaced millions since starting in 2011 with the brutal repression of anti-government protests.
Tens of thousands of displaced Syrians in the north of the country depend on handouts from humanitarian aid groups, including food, blankets and heating fuel for the winter months.
Â ",https://img.dunyanews.tv/news/2019/April/04-03-19/news_big_images/485171_56109058.jpg,world,"
BEIRUT (AFP) - More than 40,000 displaced people in northwestern Syria have seen their camps flooded by heavy rains in the past three days, a United Nations spokesman said Tuesday.",positive
"Britain, France, Germany seek full UN report of Iran missile activity","
UNITED NATIONS (AFP) - Britain, France and Germany are accusing Iran of developing missile technology, following recent activities, that they said was inconsistent with a UN resolution, and are calling for a full UN report, according to a letter released Tuesday.
The European trio cited IranÂ s launch of a space vehicle and the unveiling of two new ballistic missiles in February as forming ""part of trend of increased activity inconsistent"" with the resolution, according to the letter sent to UN Secretary General Antonio Guterres.
UN Security Council Resolution 2231 -- adopted just after the 2015 nuclear deal -- calls on Iran ""not to undertake any activity related to ballistic missiles designed to be capable of delivering nuclear weapons.""
Tehran insists that its missile program is defensive and that it has no intention of developing a nuclear capability.
The three countries asked Guterres to ""report fully and throughly on Iranian ballistic missile activity"" in his next report, which is expected in June.
The letter from the European countries, which are signatories to the nuclear deal along with the United States and Russia, came nearly a month after the United States made a similar appeal to the council, saying it was time to bring back tougher international restrictions on Tehran.
President Donald Trump pulled the United States out of the nuclear accord in May last year and reimposed sanctions on Iran, citing concerns about missile development among its reasons.
At a council meeting in December, US Secretary of State Mike Pompeo called for tighter restrictions on Iran to curb its missile program but Russia flatly asserted that there was no proof that IranÂ s missiles can carry a nuclear payload.
The European countries said the Safir space launch vehicle used for a satellite blastoff on February 6 is based on two other missiles and uses technology closely related to the development of long-range and intercontinental ballistic missiles.
On February 7, the Iranian Islamic Revolutionary Guards unveiled the Dezful surface-to-surface missile which they claimed had a range of 1,000 kilometers, according to the letter sent on March 25.
During a public display in Tehran on February 4, Iran revealed a variant of the Khorramshahr ballistic missile that the letter said was ""potentially an intermediate-range ballistic missile.""
Iran reined in most of its nuclear program under the landmark nuclear deal with major powers but has kept up development of its ballistic missile technology.
Â ",https://img.dunyanews.tv/news/2019/April/04-03-19/news_big_images/485170_25225879.jpg,world,"At a council meeting in December, US Secretary of State Mike Pompeo called for tighter restrictions on Iran to curb its missile program but Russia flatly asserted that there was no proof that Iran s missiles can carry a nuclear payload.",positive
British PM seeks new Brexit delay to approve deal,"
LONDON (AFP) - Prime Minister Theresa May said Tuesday she would ask the EU to delay Brexit again to avoid Britain crashing out of the bloc next week, signalling she could accept a closer relationship with Europe to break months of political deadlock.
After more than seven hours of talks with her ministers, May said she would request a delay that was ""as short as possible and which ends when we pass a deal"" through the British parliament.
In a move which enraged the Brexit-supporting wing of her Conservative Party, she also offered to work with the leader of the main opposition Labour Party, Jeremy Corbyn, who favours closer ties with the European Union.
""This is a decisive moment in the story of these islands. And it requires national unity to deliver the national interest,"" May said in a televised address.
Corbyn responded saying he was ""very happy"" to meet.
Brussels has set Britain an April 12 deadline to either pass the divorce deal it agreed with May four months ago, settle on an alternative, or leave the EU without an agreement.
In reality, the deadline is even closer as the EU has called an emergency leaders summit for April 10.
EU president Donald Tusk responded cautiously to MayÂ s statement, saying: ""Even if, after today, we donÂ t know what the end result will be, let us be patient.""
Britain voted by 52 to 48 percent to leave the EU in the 2016 referendum. However, the exit process has only exacerbated divisions among the public and politicians, including MayÂ s cabinet.
Her statement follows weeks of turmoil.
MPs have rejected MayÂ s divorce deal three times, but after seizing control of the process, were unable to come up with their own plan.
May said she was ""taking action to break the logjam"".
She noted calls in her own party for Britain simply to end its 46-year-old membership of the bloc without any agreement with the EU, but she said that ""leaving with a deal is the best solution"".
May said she believed her existing deal was still necessary for an orderly Brexit, but offered to talk to Labour about a new plan for future trade ties.
Corbyn has called for a new customs union with the EU and close alignment to the blocÂ s single market, two things that until now, May has strongly opposed.
""I recognise my responsibility,"" Corbyn said, stressing that the most important issue was ""to make sure we donÂ t crash out of the EU next week with no deal"".
Corbyn said any new proposals could be voted on by parliament ""early next week"".
If May and Corbyn could agree on a plan that MPs supported, the prime minister said she hoped to take it to the April 10 Brussels summit.
If not, she promised to allow MPs to direct what she does, expressing hope that Britain could still leave with a deal before May 22, so it did not have to take part in European Parliament elections.
The political chaos has already forced May to ask the EU to postpone the original Brexit date of March 29, but European leaders have warned they will not delay Brexit indefinitely.
French President Emmanuel Macron said Tuesday that while he was ""open"" to a lengthy delay on certain conditions, it was ""neither a certainty nor automatic"".
The EUÂ s chief Brexit negotiator, Michel Barnier, warned that the other 27 EU nations were prepared for a ""no deal"" situation, and ""it becomes day after day more likely"".
The EU has repeatedly refused to renegotiate the Brexit divorce deal it agreed with May last November after almost two years of negotiations but has said it could revise the accompanying political declaration on future relations.
""What we need to focus on is our future relationship with the EU,"" May said of her talks with Corbyn.
Key Conservative Brexit-backers slammed MayÂ s move.
Former foreign secretary Boris Johnson said it was ""very disappointing"" that Corbyn was being given a key role in the Brexit process.
Jacob Rees-Mogg MP suggested the Labour leader could undermined the referendum.
""Getting the support of a known Marxist is not likely to instil confidence in Conservatives,"" he said.
Â ",https://img.dunyanews.tv/news/2019/April/04-03-19/news_big_images/485169_13410571.jpg,world,"
LONDON (AFP) - Prime Minister Theresa May said Tuesday she would ask the EU to delay Brexit again to avoid Britain crashing out of the bloc next week, signalling she could accept a closer relationship with Europe to break months of political deadlock.",negative
Algeria's President Bouteflika resigns: state TV,"
ALGIERS (AFP) - AlgeriaÂ s ailing leader Abdelaziz Bouteflika submitted his resignation with immediate effect, state television said Tuesday, ceding power in the face of massive street protests after two decades at the helm.
Bouteflika ""officially advised the Constitutional Council of the end of his term of office as President of the Republic"" from Tuesday, said a news ticker on the public broadcaster.
Long accused of clinging to power, Bouteflika has come under mounting pressure to step down since his decision to seek a fifth term despite rarely being seen in public after suffering a stroke in 2013.
The 82-year-old, who uses a wheelchair, said last month he would pull out of the bid for another term, and on Monday his office said he would resign before his mandate expires at the end of the month.
The moves failed to satisfy protesters who feared a ploy to extend his rule, with hundreds of students taking to the streets earlier on Tuesday.
The news of his resignation ends 20 years of rule, with the veteran of the independence struggle finally losing his grip after weeks of massive street protests and the loss of support from key loyalists.
Car horns sounded in the street as small crowds of people began gathering to celebrate in Algiers.
AlgeriaÂ s constitution says that once the president officially resigns the speaker of the upper house of parliament would act as interim leader for up to 90 days during which a presidential election must be organised.
The resignation came hours after the military demanded impeachment proceedings be launched against Bouteflika immediately as it dismissed the announcement he would resign before his mandate expires.
Armed forces chief Ahmed Gaid Salah called for ""the immediate application of the constitutional procedure for removing the head of state from power"", in a defence ministry statement after a meeting of top brass.
The statement said the army considered an announcement from the presidency on Monday that Bouteflika would resign by the end of his term on April 28 as invalid because it did not come from the president himself.
""Any decision taken outside the constitutional framework is considered null and void,"" the general said.
Without naming anyone, Gaid Salah criticised ""the stubbornness, the procrastination and the deviousness of certain individuals who are trying to make the crisis last and make it more complex with the only concern being their narrow personal interests"".
He said the armyÂ s ""sole ambition"" was to ""protect the people from a handful of (other) people who have unduly taken over the wealth of the Algerian people"".
A long-time Bouteflika ally, the general last week called on the president to resign or be declared unfit to rule, becoming one of the first of his faithful supporters to abandon him.
On Monday, the presidency said in a statement that Bouteflika would resign ""before April 28, 2019"", after ""important decisions"" were taken, without specifying when these moves would occur.
The veteran leader would take ""steps to ensure state institutions continue to function during the transition period"", it said in the brief statement that was carried by the official APS news agency.
That announcement was greeted by little sign of euphoria as people insisted that the whole ruling establishment must go.
BouteflikaÂ s resignation would not ""change anything"", psychology student Meriem Medjdoub said as she marched in central Algiers earlier Tuesday with around 1,000 protesters.
""We are demanding a radical change,"" she told AFP.
As rumours swirled of frantic behind-the-scenes manoeuvring, prosecutors on Monday announced they had banned corruption suspects from leaving Algeria after launching graft probes against unnamed individuals.
The authorities did not say who was being targeted by probes into corruption and illegal money transfers abroad, but they followed the arrest of the presidentÂ s key backer, businessman tycoon Ali Haddad.
Haddad, who Forbes magazine describes as one of AlgeriaÂ s wealthiest entrepreneurs, was detained at the weekend at a border post with neighbouring Tunisia.
Bouteflika had named a new government on Sunday, made up mainly of technocrats under recently appointed premier Noureddine Bedoui.
The administration -- supposed to steer the country towards transition -- included General Gaid Salah remaining in his position as deputy defence minister.
Among the other key Bouteflika backers is his younger brother and special adviser Said, who was frequently cited in the past as a likely successor to the president.
Discreet and rarely seen in public, Said Bouteflika has exerted increasing influence behind the scenes as his brotherÂ s health woes worsened, but the presidentÂ s resignation could take away much of his power.
Â ",https://img.dunyanews.tv/news/2019/April/04-03-19/news_big_images/485168_32599516.jpg,world,The statement said the army considered an announcement from the presidency on Monday that Bouteflika would resign by the end of his term on April 28 as invalid because it did not come from the president himself.,neutral
Pentagon expects Turkey to buy US missile system,"
WASHINGTON (AFP) - US Acting Defense Secretary Patrick Shanahan said Tuesday he was confident that Turkey would drop its plan to purchase the Russian S-400 missile defense system and buy the US Patriot system instead.
A day after Washington put a freeze on its joint F-35 fighter jet program with Turkey in protest to the S-400 deal, Shanahan said he expects Ankara to opt for the Patriot missiles.
That would then allow the F-35 program to continue, he confirmed.
""IÂ ve had a number of conversations with Defense Minister (Hulusi) Akar and I really think weÂ ll resolve this situation with our strategic partners,"" he said.
""I am very confident in the Patriot proposal that weÂ ve delivered to Turkey, its availability, its pricing, and very importantly, the industrial participation that comes along with the Patriot system.""
Asked if that meant he expects Turkey will buy the Patriot system, Shanahan replied: ""I expect weÂ ll solve the problem so that they have the right defense equipment in terms of Patriots and F-35s.""
As for the F-35s planned for Turkey, he said: ""I expect them to be delivered.""
On Monday, the Pentagon said it was halting all deliveries and joint work with Turkey on the F-35 if Ankara insisted on buying the S-400 system from Russia, a move which has alarmed TurkeyÂ s NATO allies.
The tough step came after months of warnings from Washington that TurkeyÂ s adoption of Russian missile technology alongside US fighter jets would pose a threat to the F-35 technology and endanger Western defenses.
""Pending an unequivocal Turkish decision to forgo delivery of the S-400, deliveries and activities associated with the stand-up of TurkeyÂ s F-35 operational capability have been suspended while our dialogue on this important matter continues with Turkey,"" the Pentagon said in a statement.
Later, Marine Corps General Joe Dunford, chairman of the Joint Chiefs of Staff, reiterated that the US had made Turkey a ""very good offer"" on the Patriot system.
""The S-400 and the F-35, weÂ ve made it very clear those are incompatible systems,"" Dunford said. ""But weÂ re still working our way through this. And I hope we can come up with an arrangement with Turkey.""
""So we havenÂ t given up yet is the bottom line.""
The purchase of a Russian system is highly unusual for a member of the North Atlantic Treaty Organization, the Western alliance forged to counter the Soviet Union.
But Dunford maintained that the US-Turkey relationship is solid.
""I have every confidence and I spent a lot of time, as you know, with our Turkish allies, and I have every confidence that our areas of convergence are far more than any areas of divergence in the Turkish relationship,"" he said.
The US suspension announcement came two days before foreign ministers from NATOÂ s 29 members were due in Washington to celebrate the 70th anniversary of the alliance.
Last week, Foreign Minister Mevlut Cavusoglu met in Turkey with his Russian counterpart, Sergei Lavrov, and insisted that the S-400 purchase would go ahead.
Â ",https://img.dunyanews.tv/news/2019/April/04-03-19/news_big_images/485167_61765802.jpg,world,"
WASHINGTON (AFP) - US Acting Defense Secretary Patrick Shanahan said Tuesday he was confident that Turkey would drop its plan to purchase the Russian S-400 missile defense system and buy the US Patriot system instead.",neutral
Trump administration steps up threats to 'shut down' Mexico border,"
WASHINGTON (AFP) - The Trump administration stepped up its threat to close down the US-Mexico border on Tuesday, warning both Congress and Central American governments to take action to stem the flow of migrants into the country.
""The presidentâs not threatening. Heâs taking his job as the commander in chief very seriously in terms of protecting the American people,"" White House spokeswoman Sarah Sanders said.
Closing the border is ""not our first choice,"" she said. However, she added, ""Maybe that itâs the best decision.""
Department of Homeland Security Secretary Kirstjen Nielsen cut short an official trip to Europe to return for meetings early Tuesday on the border crisis.
And DHS officials said border crossing times were already lengthening as they divert staff to areas between official ports to deal with tens of thousands of migrant families crossing illegally into the country.
A senior Homeland Security official, who declined to be named, told reporters that a definitive solution on border closures had not been made yet.
""The bottom line is all options are on the table right now,"" he said.
""We are in a full blown emergency,"" he said.
""The volume of vulnerable populations thatâs arriving is unsustainable. The humanitarian situation cannot be ignored and the security situation cannot be ignored.""
On Saturday Trump said in a tweet that he was prepared to shut border crossings to force Mexico to halt the flood of migrants fleeing poverty and violence in Central America.
Officials said the number being detained for crossing the border illegally has reached near 100,000 a month, mostly from Honduras, Guatemala and El Salvador.
""Mexico must use its very strong immigration laws to stop the many thousands of people trying to get into the USA. Our detention areas are maxed out & we will take no more illegals. Next step is to close the Border!""
The warning stirred fears across border populations who cross legally daily for business, family visits and other reasons.
But it also shook US and Mexican industry, which depend heavily on the open border for trade in everything from farm goods to auto parts.
Delays for incoming traffic at key ports mounted Monday, hitting three hours at Brownsville, Texas, as port staff was diverted to dealing with migrants.
DHS says that besides getting Mexico to block the transit of migrant caravans to the border, Congress should take immediate action to give border officials the power to forcibly repatriate Central American illegal immigrants, including children who arrived alone, back to their countries.
Â ",https://img.dunyanews.tv/news/2019/April/04-02-19/news_big_images/485157_54446649.jpg,world,"
WASHINGTON (AFP) - The Trump administration stepped up its threat to close down the US-Mexico border on Tuesday, warning both Congress and Central American governments to take action to stem the flow of migrants into the country.",positive
