title,news,img-url,category,summery,opinion
Simon Taufel points out grave error in giving extra run to England against NZ in WC final,"Five-time ICC umpire of the year award-winning Australian umpire Simon Taufel has pointed out a grave error for awarding six runs to England instead of five in the final of World Cup 2019. Taufel, who is currently a part of the MCC’s laws sub-committee that makes the rules governing cricket, told an Australian based news channel that England should have been awarded five runs, not six. “It’s a clear mistake.. it’s an error of judgment,” Taufel said. “They (England) should have been awarded five runs, not six.” Taufel was considered among the best umpires of his time, he also said that tail-ender Adil Rashid should have been on strike for the penultimate delivery of the innings instead of Stokes. It all happened on the fourth delivery of the over when England needed 9 runs to win. Guptill’s threw from the deep hit straight on the willow of Ben Stokes, which went for a boundary. As per law 19.8, pertaining to “Overthrow or wilful act of fielder”, If the boundary results from an overthrow or from the wilful act of a fielder, the runs scored shall be any runs for penalties awarded to either side, and the allowance for the boundary, and the runs completed by the batsmen, together with the run in progress if they had already crossed at the instant of the throw or act.” ",https://www.newsone.tv/wp-content/uploads/2019/07/icc.jpg,World Cup 2019,"“They (England) should have been awarded five runs, not six.” Taufel was considered among the best umpires of his time, he also said that tail-ender Adil Rashid should have been on strike for the penultimate delivery of the innings instead of Stokes.",neutral
Simon Taufel points out grave error in giving extra run to England against NZ in WC final,"Five-time ICC umpire of the year award-winning Australian umpire Simon Taufel has pointed out a grave error for awarding six runs to England instead of five in the final of World Cup 2019. Taufel, who is currently a part of the MCC’s laws sub-committee that makes the rules governing cricket, told an Australian based news channel that England should have been awarded five runs, not six. “It’s a clear mistake.. it’s an error of judgment,” Taufel said. “They (England) should have been awarded five runs, not six.” Taufel was considered among the best umpires of his time, he also said that tail-ender Adil Rashid should have been on strike for the penultimate delivery of the innings instead of Stokes. It all happened on the fourth delivery of the over when England needed 9 runs to win. Guptill’s threw from the deep hit straight on the willow of Ben Stokes, which went for a boundary. As per law 19.8, pertaining to “Overthrow or wilful act of fielder”, If the boundary results from an overthrow or from the wilful act of a fielder, the runs scored shall be any runs for penalties awarded to either side, and the allowance for the boundary, and the runs completed by the batsmen, together with the run in progress if they had already crossed at the instant of the throw or act.” ",https://www.newsone.tv/wp-content/uploads/2019/07/icc.jpg,World Cup 2019,"“They (England) should have been awarded five runs, not six.” Taufel was considered among the best umpires of his time, he also said that tail-ender Adil Rashid should have been on strike for the penultimate delivery of the innings instead of Stokes.",neutral
Luck smiles on England as Eoin Morgan lifts World Cup trophy for first time,"LONDON: England made history on Sunday by winning the World Cup 2019 after a thrilling super over at the home of cricket, Lord’s. The underdog New Zealand equalized the total (15 runs) but the Eoin Morgan’s team had its name on the trophy due to scoring more boundaries in their batting innings. Needing to surpass New Zealand´s 241-8 to win the World Cup for the first time, England ended on 241 all out after Mark Wood was run out off the final ball. England was looking to Ben Stokes and Jos Buttler (59) to take them home after New Zealand sparked a top-order collapse but after a 110 runs crucial partnership Butler’s wicket gave a much-needed breakthrough to Willamson. Fergusson and Neesham took three wickets each, while Henry, and Grandhomme picked one wicket each. Three-times losing finalists England were in trouble at 86-4, chasing a target of 242, when Stokes and Buttler joined forces. But with 10 overs left, the host nation had recovered to 170-4, needing a further 72 runs for victory against 2015 runners-up New Zealand, also looking for a maiden World Cup win. Left-handed batsman Stokes, born in Christchurch, New Zealand, but brought up in England, was 43 not out and Buttler 42 not out. Earlier, fast bowler, Liam Plunkett dismissed New Zealand captain and star batsman Kane Williamson for just 30 before removing established opener Henry Nicholls for an innings-best 55 in a return of 3-42 from his 10 overs. Chris Woakes followed up with 3-37 as New Zealand finished on 241-8. New Zealand successfully defended a total of 239 in their shock semi-final win over India, when they reduced one of the world´s strongest batting line-up to 24-4. And Trent Boult almost struck with the first ball of England´s chase when he appealed for lbw against Jason Roy but South African umpire Marais Erasmus´s original not out the decision was upheld. Roy, who made a blistering 85 in a comfortable semi-final win over reigning champions Australia, got England going with a straight-driven four off Matt Henry. Roy and Jonny Bairstow, by average the best opening pair in one-day international history, had posted four consecutive century stands coming into the final. Early breakthrough
But New Zealand got the breakthrough they needed when Henry induced Roy, on 17, to edge a full-length delivery that just carried to wicketkeeper Tom Latham. That left England , who thrashed New Zealand by 119 runs in a group match, 28-1 in the sixth over. New batsman Joe Root never looked comfortable while making seven off 30 balls and was caught behind to leave England 59-2. Bairstow had enjoyed a huge reprieve on 18 when Colin de Grandhomme dropped a routine caught-and-bowled chance but fast bowler Lockie Ferguson got him to play on for 36. Jimmy Neesham took a wicket with his first ball, with England captain Eoin Morgan falling for just nine when an uppercut was brilliantly caught low down by Ferguson running in from deep point. But Stokes and Buttler revived England with some well-struck boundaries. Williamson chose to bat after winning the toss in overcast conditions and on a green pitch but opener Martin Guptill, the leading run-scorer at the 2015 World Cup, was lbw to Woakes for 19. That left number three Williamson, who started the match with 548 runs in the tournament at an average of 91.33, having to mount yet another rescue mission. But after putting on 74 for the second wicket with Nicholls, he fell when he edged a rising cross-seamer from Plunkett to wicketkeeper Buttler. New Zealand found themselves 118-3 when Plunkett struck for the second time in 14 balls. Nicholls, who had completed a 71-ball fifty, was out for 55 when he played on after being cramped for room by a Plunkett delivery that curved back into him and veteran Ross Taylor could only manage 15 before falling lbw to Mark Wood. Latham defiantly hit Wood for six but his valuable 47 off 56 balls ended when he chipped a low Woakes full toss to mid-off.
AFP ",https://www.newsone.tv/wp-content/uploads/2019/07/eng-1-1.jpg,World Cup 2019,"Needing to surpass New Zealand´s 241-8 to win the World Cup for the first time, England ended on 241 all out after Mark Wood was run out off the final ball.",neutral
World Cup Final: New Zealand sets a mild target of 242 runs for England,"LONDON: New Zealand, in World Cup 2019 finale on Sunday, set a mild target of 242 runs for host England here at Lord’s, London. Henry Nicholls, with 55 runs, and Tom Latham with 47 runs remained the only Kiwi top scorers of the day. Followed by skipper Kane Williamson with 30 runs. Chris Woakes and Liam Plunkett dismissed three Englishmen each while Jofra Archer and Mark Wood both took one wicket each. When England exited the 2015 edition with an embarrassing defeat by Bangladesh, few were tipping them as potential champions in four years’ time. As England captain Eoin Morgan put it, “If you had offered us the position to play in a final the day after we were knocked out of the 2015 World Cup, I would have laughed at you.” One person not laughing was Andrew Strauss, the former England director of cricket. Drafted into the newly created role, Strauss set about an overhaul that saw the former England captain appoint Australia’s Trevor Bayliss as coach, and place greater emphasis on white-ball cricket. The worth of all that work showed when Morgan’s men, now top of the one-day international rankings, thrashed reigning champions Australia by eight wickets in the semi-final at Edgbaston on Thursday. Many of the elements that made England the pre-tournament favourites were on show in Birmingham. Pacemen Jofra Archer and Chris Woakes reduced Australia to 14-3, leg-spinner Adil Rashid took wickets in the middle and the dynamic duo of Jason Roy and Jonny Bairstow — statistically the most successful opening pair in ODI history — launched the run chase with a blistering century partnership. ‘Fearless’ cricket  The challenge for England is to embrace the hype surrounding Sunday’s fixture without letting it inhibit them from playing their brand of “fearless” cricket. By reaching the final, England have guaranteed an international match will be shown live on free-to-air television in Britain for the first time since the iconic 2005 Ashes series — a chance to inspire a new generation. “I think Sunday’s not a day to shy away from, it’s a day to look forward to,” said Morgan, an outrider in English cricket in becoming an ODI specialist when the steely Dubliner realised his Test career had stalled. It is perhaps appropriate that England are facing New Zealand in a final between two sides who have yet to win the World Cup. For it was the Black Caps who showed England how to play the modern one-day game at the 2015 edition in Wellington four years ago. They shot out England for just 123 and then overhauled that total in a mere 12.2 overs. “It was as close to rock-bottom as I’ve been”, said Morgan. “Certainly as a captain and as a player, being beaten off the park like that was humiliating.” England gained a measure of revenge with a 119-run thrashing of New Zealand in a group-stage match earlier in this World Cup. But that is unlikely to count for much on Sunday. All tournament long, the same comment has been made about New Zealand — they boast a well-balanced attack led by left-arm quick Trent Boult but are over-reliant on captain Kane Williamson and fellow senior batsman Ross Taylor for their runs. The polite Kiwis have responded by continuing to “scrap”, in the phrase of fast bowler Lockie Ferguson, their way to wins as demonstrated by their dramatic 18-run semi-final victory over India. Boult and Matt Henry reduced one of the world’s most powerful top orders to 5-3, before left-arm spinner Mitchell Santner, aided by superb fielding, backed them up after Williamson and Taylor had made battling fifties on a tricky pitch. While many members of the home side were not even born when England made the last of three losing appearances in a World Cup final in 1992, the Black Caps have the experience of their heavy defeat by co-hosts Australia in the climax of the 2015 edition in Melbourne to call on. “I’d be lying if I said we weren’t a bit overawed by the change of scenery,” said Taylor as he looked back to New Zealand’s first and only match on Australian soil in that tournament. “I think we know what to expect, the pressures that come with it, we’ve been there before. You just have to enjoy it, it’s the ‘Home of Cricket’, I can’t think of a better place to play a final.” New Zealand (Playing XI): Martin Guptill, Henry Nicholls, Kane Williamson(c), Ross Taylor, James Neesham, Tom Latham(w), Colin de Grandhomme, Mitchell Santner, Matt Henry, Trent Boult, Lockie Ferguson England (Playing XI): Jason Roy, Jonny Bairstow, Joe Root, Eoin Morgan(c), Ben Stokes, Jos Buttler(w), Chris Woakes, Liam Plunkett, Jofra Archer, Adil Rashid, Mark Wood With input from AFP. ",https://www.newsone.tv/wp-content/uploads/2019/07/New-Zealand-England.jpg,World Cup 2019,"“Certainly as a captain and as a player, being beaten off the park like that was humiliating.” England gained a measure of revenge with a 119-run thrashing of New Zealand in a group-stage match earlier in this World Cup.",neutral
World Cup Final: New Zealand opted to bat first against England,"LONDON: New Zealand, in the final match of World Cup 2019 on Sunday, opted to bat first against England here at Lord’s, London. When England exited the 2015 edition with an embarrassing defeat by Bangladesh, few were tipping them as potential champions in four years’ time. As England captain Eoin Morgan put it, “If you had offered us the position to play in a final the day after we were knocked out of the 2015 World Cup, I would have laughed at you.” One person not laughing was Andrew Strauss, the former England director of cricket. Drafted into the newly created role, Strauss set about an overhaul that saw the former England captain appoint Australia’s Trevor Bayliss as coach, and place greater emphasis on white-ball cricket. The worth of all that work showed when Morgan’s men, now top of the one-day international rankings, thrashed reigning champions Australia by eight wickets in the semi-final at Edgbaston on Thursday. Many of the elements that made England the pre-tournament favourites were on show in Birmingham. Pacemen Jofra Archer and Chris Woakes reduced Australia to 14-3, leg-spinner Adil Rashid took wickets in the middle and the dynamic duo of Jason Roy and Jonny Bairstow — statistically the most successful opening pair in ODI history — launched the run chase with a blistering century partnership. ‘Fearless’ cricket  The challenge for England is to embrace the hype surrounding Sunday’s fixture without letting it inhibit them from playing their brand of “fearless” cricket. By reaching the final, England have guaranteed an international match will be shown live on free-to-air television in Britain for the first time since the iconic 2005 Ashes series — a chance to inspire a new generation. “I think Sunday’s not a day to shy away from, it’s a day to look forward to,” said Morgan, an outrider in English cricket in becoming an ODI specialist when the steely Dubliner realised his Test career had stalled. It is perhaps appropriate that England are facing New Zealand in a final between two sides who have yet to win the World Cup. For it was the Black Caps who showed England how to play the modern one-day game at the 2015 edition in Wellington four years ago. They shot out England for just 123 and then overhauled that total in a mere 12.2 overs. “It was as close to rock-bottom as I’ve been”, said Morgan. “Certainly as a captain and as a player, being beaten off the park like that was humiliating.” England gained a measure of revenge with a 119-run thrashing of New Zealand in a group-stage match earlier in this World Cup. But that is unlikely to count for much on Sunday. All tournament long, the same comment has been made about New Zealand — they boast a well-balanced attack led by left-arm quick Trent Boult but are over-reliant on captain Kane Williamson and fellow senior batsman Ross Taylor for their runs. The polite Kiwis have responded by continuing to “scrap”, in the phrase of fast bowler Lockie Ferguson, their way to wins as demonstrated by their dramatic 18-run semi-final victory over India. Boult and Matt Henry reduced one of the world’s most powerful top orders to 5-3, before left-arm spinner Mitchell Santner, aided by superb fielding, backed them up after Williamson and Taylor had made battling fifties on a tricky pitch. While many members of the home side were not even born when England made the last of three losing appearances in a World Cup final in 1992, the Black Caps have the experience of their heavy defeat by co-hosts Australia in the climax of the 2015 edition in Melbourne to call on. “I’d be lying if I said we weren’t a bit overawed by the change of scenery,” said Taylor as he looked back to New Zealand’s first and only match on Australian soil in that tournament. “I think we know what to expect, the pressures that come with it, we’ve been there before. You just have to enjoy it, it’s the ‘Home of Cricket’, I can’t think of a better place to play a final.” New Zealand (Playing XI): Martin Guptill, Henry Nicholls, Kane Williamson(c), Ross Taylor, James Neesham, Tom Latham(w), Colin de Grandhomme, Mitchell Santner, Matt Henry, Trent Boult, Lockie Ferguson England (Playing XI): Jason Roy, Jonny Bairstow, Joe Root, Eoin Morgan(c), Ben Stokes, Jos Buttler(w), Chris Woakes, Liam Plunkett, Jofra Archer, Adil Rashid, Mark Wood AFP. ",https://www.newsone.tv/wp-content/uploads/2019/07/NZ-ENG.jpg,World Cup 2019,"“Certainly as a captain and as a player, being beaten off the park like that was humiliating.” England gained a measure of revenge with a 119-run thrashing of New Zealand in a group-stage match earlier in this World Cup.",neutral
"World Cup Final: England, New Zealand clash to claim golden trophy today","LONDON: England face New Zealand in the World Cup final today knowing years of planning come down to a single day at Lord’s. When England exited the 2015 edition with an embarrassing defeat by Bangladesh, few were tipping them as potential champions in four years’ time. As England captain Eoin Morgan put it, “If you had offered us the position to play in a final the day after we were knocked out of the 2015 World Cup, I would have laughed at you.” One person not laughing was Andrew Strauss, the former England director of cricket. Drafted into the newly created role, Strauss set about an overhaul that saw the former England captain appoint Australia’s Trevor Bayliss as coach, and place greater emphasis on white-ball cricket. The worth of all that work showed when Morgan’s men, now top of the one-day international rankings, thrashed reigning champions Australia by eight wickets in the semi-final at Edgbaston on Thursday. Many of the elements that made England the pre-tournament favourites were on show in Birmingham. Pacemen Jofra Archer and Chris Woakes reduced Australia to 14-3, leg-spinner Adil Rashid took wickets in the middle and the dynamic duo of Jason Roy and Jonny Bairstow — statistically the most successful opening pair in ODI history — launched the run chase with a blistering century partnership. ‘Fearless’ cricket  The challenge for England is to embrace the hype surrounding Sunday’s fixture without letting it inhibit them from playing their brand of “fearless” cricket. By reaching the final, England have guaranteed an international match will be shown live on free-to-air television in Britain for the first time since the iconic 2005 Ashes series — a chance to inspire a new generation. “I think Sunday’s not a day to shy away from, it’s a day to look forward to,” said Morgan, an outrider in English cricket in becoming an ODI specialist when the steely Dubliner realised his Test career had stalled. It is perhaps appropriate that England are facing New Zealand in a final between two sides who have yet to win the World Cup. For it was the Black Caps who showed England how to play the modern one-day game at the 2015 edition in Wellington four years ago. They shot out England for just 123 and then overhauled that total in a mere 12.2 overs. “It was as close to rock-bottom as I’ve been”, said Morgan. “Certainly as a captain and as a player, being beaten off the park like that was humiliating.” England gained a measure of revenge with a 119-run thrashing of New Zealand in a group-stage match earlier in this World Cup. But that is unlikely to count for much on Sunday. All tournament long, the same comment has been made about New Zealand — they boast a well-balanced attack led by left-arm quick Trent Boult but are over-reliant on captain Kane Williamson and fellow senior batsman Ross Taylor for their runs. The polite Kiwis have responded by continuing to “scrap”, in the phrase of fast bowler Lockie Ferguson, their way to wins as demonstrated by their dramatic 18-run semi-final victory over India. Boult and Matt Henry reduced one of the world’s most powerful top orders to 5-3, before left-arm spinner Mitchell Santner, aided by superb fielding, backed them up after Williamson and Taylor had made battling fifties on a tricky pitch. While many members of the home side were not even born when England made the last of three losing appearances in a World Cup final in 1992, the Black Caps have the experience of their heavy defeat by co-hosts Australia in the climax of the 2015 edition in Melbourne to call on. “I’d be lying if I said we weren’t a bit overawed by the change of scenery,” said Taylor as he looked back to New Zealand’s first and only match on Australian soil in that tournament. “I think we know what to expect, the pressures that come with it, we’ve been there before. You just have to enjoy it, it’s the ‘Home of Cricket’, I can’t think of a better place to play a final.” AFP. ",https://www.newsone.tv/wp-content/uploads/2019/07/NZvENG.png,World Cup 2019,"“Certainly as a captain and as a player, being beaten off the park like that was humiliating.” England gained a measure of revenge with a 119-run thrashing of New Zealand in a group-stage match earlier in this World Cup.",neutral
Jason Roy cleared to play World Cup final despite umpire outburst,"BIRMINGHAM: England star Jason Roy has been cleared to play in Sunday’s World Cup final against New Zealand despite showing dissent at an umpire’s decision while helping the hosts book their place in the showpiece match. The Surrey opener had made 85 to set England well on their way to an eventual eight-wicket against Australia in Thursday’s semi-final at Edgbaston when he was given out caught behind down the legside off fast bowler Pat Cummins by Sri Lankan umpire Kumar Dharmasena. Roy requested a review but England had already squandered their lone review of the innings with an unsuccessful attempt to overturn fellow opener Jonny Bairstow´s lbw dismissal for 34. Nevertheless, Dharmasena confusingly and incorrectly signalled for a review, with Australia pointing out the official’s mistake. Roy, his arms spread wide, clearly believed Dharmasena should have signalled a wide delivery instead and the furious batsman had to be ushered away from the crease by square leg umpire Marais Erasmus. Eventually, a clearly unhappy Roy, whose tirade prompted television broadcasters to apologise for his foul language, made his way back to the pavilion, with England 147 for two in the 20th over. Roy, who admitted the offence, was fined 30 per cent of his match fee for breaching that section of the International Cricket Council’s code of conduct that prohibits showing dissent at an umpire’s decision. The 28-year-old also received two demerit points from match referee Ranjan Madugalle, taking his tally for the tournament to three following a one-point penalty he received for an audible obscenity after dropping a catch in a group-stage match against Pakistan. But match bans only kick in when a player collects four demerit points in total leaving Roy, a key figure in Eoin Morgan’s side, available to feature as England bid to win the World Cup for the first time. AFP  ",https://www.newsone.tv/wp-content/uploads/2019/07/jason-roy.jpg,World Cup 2019,"The 28-year-old also received two demerit points from match referee Ranjan Madugalle, taking his tally for the tournament to three following a one-point penalty he received for an audible obscenity after dropping a catch in a group-stage match against Pakistan.",neutral
