title,news,img-url,category,summery,opinionEngland makes into final of World Cup after 27 years by thrashing Aussies,"BIRMINGHAM: England beat Australia in second Semi- final to make their place into World Cup final after the wait of 27 years. Last time they made into finals playing against Imran Khan led Pakistan team in 1992 where they suffered defeat. Eoin Morgan´s side ended Australia´s bid to retain the World Cup in ruthless fashion at Edgbaston, dismissing their old rivals for 223 and then powering to victory in 32.1 overs thanks to Jason Roy´s blistering 85. England will head to Lord´s bidding to win the 50-over World Cup for the first time, with 2015 runners-up New Zealand, who they thrashed by 119 runs in the group stage, standing between Morgan´s men and the trophy. England, who were in the semi-finals for the first time since 1992, have lost all three of their World Cup finals. The most recent of those painful defeats came in 1992 when Graham Gooch´s side were beaten by Pakistan, while Australia in 1987 and the West Indies in 1979 have also denied England in the final. Australia´s first-ever World Cup semi-final defeat, after seven previous victories at this stage, shattered the five-time champions´ hopes of reaching the final for the sixth time in the past seven editions. While Australia lick their wounds before facing England in the Ashes next month, the progress of Morgan´s team comes after a four-year overhaul. England´s woeful first-round exit at the 2015 World Cup prompted a root-and-branch reform of their approach to one-day internationals for a side that had long placed Test success above all other considerations. Australian coach Trevor Bayliss was drafted in, sparking an impressive transformation that has seen England climb to number one in the ODI rankings and move to within touching distance of World Cup glory. AFP  ",https://www.newsone.tv/wp-content/uploads/2019/07/eng-1.jpg,World Cup 2019,BIRMINGHAM: England beat Australia in second Semi- final to make their place into World Cup final after the wait of 27 years.,neutral
World Cup Semi-Final: England restricts Australia to 223 runs,"BIRMINGHAM: Host England, on Thursday, restricted Australia to 223 runs in the second semi-final here at Edgbaston, Birmingham. Steve Smith, with 83 runs, and Alex Carey, with 46 runs remained the only top scorers on the Kangaroo side. Chris Woakes and Adil Rashid both dismissed three Englishmen while Jofra Archer and Mark Wood got two and one wicket respectively. Australia, in the second semi-final clash, opted to bat first against England here at Edgbaston, Birmingham on Thursday. Four years of planning will be put on the line for England when they face holders Australia in a blockbuster World Cup semi-final at Edgbaston today. England’s woeful first-round exit at the 2015 edition prompted a complete rethink of their approach to one-day internationals for a side that had long placed Test success above all other considerations. Australian coach Trevor Bayliss was drafted in with the aim of guiding their bid for a first World Cup title. The transformation has been impressive, with England climbing to number one in the ODI rankings under the astute captaincy of Eoin Morgan. Their rise to the summit has been based on dynamic run-scoring, with in-form openers Jason Roy and Jonny Bairstow leading the way. But the stakes for hosts England are higher than simply the winning of a match that would see them into a final against New Zealand at Lord´s on Sunday. Host broadcaster Sky has said it will allow the final to be shown on free-to-air television in Britain — but only if England are involved in the showpiece match. It would be the first time since 2005 that a major England men’s home match had emerged from behind a UK television paywall, with cricket having a chance to reconnect with a ‘lost’ audience in its birthplace. But Morgan urged England to avoid being overawed by the scale of the task confronting them in Birmingham. “Sometimes I’m guilty of it, you can lose sight of the position you´re in and the fact you´re living your dream,” Morgan said on Wednesday. Australia, however, have never lost any of their seven previous World Cup semi-finals — although they did tie with South Africa at Edgbaston 20 years ago before advancing into the final thanks to their superior net run-rate from the preceding ‘Super Six’ stage. England had won 10 of their last 11 ODIs against Australia prior to the World Cup. But that counted for nothing when Australia landed a psychological blow in the group stage, beating Ashes rivals England by 64 runs at Lord´s last month. Australia left-arm quicks Jason Behrendorff and Mitchell Starc shared nine wickets between them in a match where Australia captain Aaron Finch made 100 after surviving a testing opening from England´s fast bowlers. ‘Different team’ Roy, however, was missing with a torn hamstring and since his return, England have secured crucial wins over India and New Zealand that took them into the semi-finals. “We’re probably more confident than we were three games ago, we’re a different team,” Morgan said. “It feels like we´re back to the team we are.” Meanwhile, Australia, who have not won in any format at Edgbaston since the 2001 Ashes Test, suffered a surprise 10-run defeat by South Africa at Old Trafford in their final group game. England, as well as finding a way to cope with Starc, will have to contain the run-scoring threat of a powerful Australian top order. David Warner has scored 638 runs this tournament following the left-handed opener’s return to international cricket after a 12-month ban for his role in a ball-tampering scandal in South Africa. But they will be without Usman Khawaja after the batsman suffered a tournament-ending hamstring injury against South Africa, while speculation about Glenn Maxwell’s place intensified when the struggling all-rounder did not attend training on Wednesday. “It’s a purely optional training session, you’re reading a bit too much into it,” said Finch on Wednesday when asked about Maxwell, who has scored just 155 runs in nine innings. Australia are bidding for a sixth World Cup title, having won four of the last five editions. “We’re full of confidence going into this game, but England have been front runners in one-day cricket for the last four years,” said opener Finch. “It will come down to whoever holds their nerve and whoever holds their half-chances.” With input from AFP. ",https://www.newsone.tv/wp-content/uploads/2019/07/Eng-Aus-Carey.jpg,World Cup 2019,"“It feels like we´re back to the team we are.” Meanwhile, Australia, who have not won in any format at Edgbaston since the 2001 Ashes Test, suffered a surprise 10-run defeat by South Africa at Old Trafford in their final group game.",neutral
World Cup Semi-Final: Australia opted to bat first against England,"BIRMINGHAM: Australia, in the second semi-final clash, opted to bat first against England here at Edgbaston, Birmingham on Thursday. Four years of planning will be put on the line for England when they face holders Australia in a blockbuster World Cup semi-final at Edgbaston today. England’s woeful first-round exit at the 2015 edition prompted a complete rethink of their approach to one-day internationals for a side that had long placed Test success above all other considerations. Australian coach Trevor Bayliss was drafted in with the aim of guiding their bid for a first World Cup title. The transformation has been impressive, with England climbing to number one in the ODI rankings under the astute captaincy of Eoin Morgan. Their rise to the summit has been based on dynamic run-scoring, with in-form openers Jason Roy and Jonny Bairstow leading the way. But the stakes for hosts England are higher than simply the winning of a match that would see them into a final against New Zealand at Lord´s on Sunday. Host broadcaster Sky has said it will allow the final to be shown on free-to-air television in Britain — but only if England are involved in the showpiece match. It would be the first time since 2005 that a major England men’s home match had emerged from behind a UK television paywall, with cricket having a chance to reconnect with a ‘lost’ audience in its birthplace. But Morgan urged England to avoid being overawed by the scale of the task confronting them in Birmingham. “Sometimes I’m guilty of it, you can lose sight of the position you´re in and the fact you´re living your dream,” Morgan said on Wednesday. Australia, however, have never lost any of their seven previous World Cup semi-finals — although they did tie with South Africa at Edgbaston 20 years ago before advancing into the final thanks to their superior net run-rate from the preceding ‘Super Six’ stage. England had won 10 of their last 11 ODIs against Australia prior to the World Cup. But that counted for nothing when Australia landed a psychological blow in the group stage, beating Ashes rivals England by 64 runs at Lord´s last month. Australia left-arm quicks Jason Behrendorff and Mitchell Starc shared nine wickets between them in a match where Australia captain Aaron Finch made 100 after surviving a testing opening from England´s fast bowlers. ‘Different team’ Roy, however, was missing with a torn hamstring and since his return, England have secured crucial wins over India and New Zealand that took them into the semi-finals. “We’re probably more confident than we were three games ago, we’re a different team,” Morgan said. “It feels like we´re back to the team we are.” Meanwhile, Australia, who have not won in any format at Edgbaston since the 2001 Ashes Test, suffered a surprise 10-run defeat by South Africa at Old Trafford in their final group game. England, as well as finding a way to cope with Starc, will have to contain the run-scoring threat of a powerful Australian top order. David Warner has scored 638 runs this tournament following the left-handed opener’s return to international cricket after a 12-month ban for his role in a ball-tampering scandal in South Africa. But they will be without Usman Khawaja after the batsman suffered a tournament-ending hamstring injury against South Africa, while speculation about Glenn Maxwell’s place intensified when the struggling all-rounder did not attend training on Wednesday. “It’s a purely optional training session, you’re reading a bit too much into it,” said Finch on Wednesday when asked about Maxwell, who has scored just 155 runs in nine innings. Australia are bidding for a sixth World Cup title, having won four of the last five editions. “We’re full of confidence going into this game, but England have been front runners in one-day cricket for the last four years,” said opener Finch. “It will come down to whoever holds their nerve and whoever holds their half-chances.” AFP. ",https://www.newsone.tv/wp-content/uploads/2019/07/ENG-AUS-toss.jpg,World Cup 2019,"“It feels like we´re back to the team we are.” Meanwhile, Australia, who have not won in any format at Edgbaston since the 2001 Ashes Test, suffered a surprise 10-run defeat by South Africa at Old Trafford in their final group game.",neutral
"World Cup: England, Australia clash in second semi-final today","BIRMINGHAM: Four years of planning will be put on the line for England when they face holders Australia in a blockbuster World Cup semi-final at Edgbaston today. England’s woeful first-round exit at the 2015 edition prompted a complete rethink of their approach to one-day internationals for a side that had long placed Test success above all other considerations. Australian coach Trevor Bayliss was drafted in with the aim of guiding their bid for a first World Cup title. The transformation has been impressive, with England climbing to number one in the ODI rankings under the astute captaincy of Eoin Morgan. Their rise to the summit has been based on dynamic run-scoring, with in-form openers Jason Roy and Jonny Bairstow leading the way. But the stakes for hosts England are higher than simply the winning of a match that would see them into a final against New Zealand at Lord´s on Sunday. Host broadcaster Sky has said it will allow the final to be shown on free-to-air television in Britain — but only if England are involved in the showpiece match. It would be the first time since 2005 that a major England men’s home match had emerged from behind a UK television paywall, with cricket having a chance to reconnect with a ‘lost’ audience in its birthplace. But Morgan urged England to avoid being overawed by the scale of the task confronting them in Birmingham. “Sometimes I’m guilty of it, you can lose sight of the position you´re in and the fact you´re living your dream,” Morgan said on Wednesday. Australia, however, have never lost any of their seven previous World Cup semi-finals — although they did tie with South Africa at Edgbaston 20 years ago before advancing into the final thanks to their superior net run-rate from the preceding ‘Super Six’ stage. England had won 10 of their last 11 ODIs against Australia prior to the World Cup. But that counted for nothing when Australia landed a psychological blow in the group stage, beating Ashes rivals England by 64 runs at Lord´s last month. Australia left-arm quicks Jason Behrendorff and Mitchell Starc shared nine wickets between them in a match where Australia captain Aaron Finch made 100 after surviving a testing opening from England´s fast bowlers. ‘Different team’ Roy, however, was missing with a torn hamstring and since his return, England have secured crucial wins over India and New Zealand that took them into the semi-finals. “We’re probably more confident than we were three games ago, we’re a different team,” Morgan said. “It feels like we´re back to the team we are.” Meanwhile, Australia, who have not won in any format at Edgbaston since the 2001 Ashes Test, suffered a surprise 10-run defeat by South Africa at Old Trafford in their final group game. England, as well as finding a way to cope with Starc, will have to contain the run-scoring threat of a powerful Australian top order. David Warner has scored 638 runs this tournament following the left-handed opener’s return to international cricket after a 12-month ban for his role in a ball-tampering scandal in South Africa. But they will be without Usman Khawaja after the batsman suffered a tournament-ending hamstring injury against South Africa, while speculation about Glenn Maxwell’s place intensified when the struggling all-rounder did not attend training on Wednesday. “It’s a purely optional training session, you’re reading a bit too much into it,” said Finch on Wednesday when asked about Maxwell, who has scored just 155 runs in nine innings. Australia are bidding for a sixth World Cup title, having won four of the last five editions. “We’re full of confidence going into this game, but England have been front runners in one-day cricket for the last four years,” said opener Finch. “It will come down to whoever holds their nerve and whoever holds their half-chances.” AFP. ",https://www.newsone.tv/wp-content/uploads/2019/07/England-Australia.jpg,World Cup 2019,"“It feels like we´re back to the team we are.” Meanwhile, Australia, who have not won in any format at Edgbaston since the 2001 Ashes Test, suffered a surprise 10-run defeat by South Africa at Old Trafford in their final group game.",neutral
All favorite India knocked out from the World Cup as New Zealand makes into final,"All-favorite India knocked out from the World Cup as New Zealand beat the Virat Kohli side by 18 runs to make a place at World Cup final match— to be played at Lords, this Sunday. A nail-biting fight to the finish saw New Zealand’s disciplined bowling and fielding outclassing tournament favourites India by 18 runs on Wednesday and advancing to the final of the Cricket World Cup 2019. A 116-run partnership between former skipper MS Dhoni (49) and Ravindera Jadeja (77) troubled New Zealand in the middle overs the Old Trafford Stadium in Manchester, but fine death bowling and a spectacular display of fielding gave the Kiwis the last laugh. AFP  ",https://www.newsone.tv/wp-content/uploads/2019/07/Ind.jpg,World Cup 2019,"All-favorite India knocked out from the World Cup as New Zealand beat the Virat Kohli side by 18 runs to make a place at World Cup final match— to be played at Lords, this Sunday.",neutral
New Zealand sets target of 240 runs for India to chase,MANCHESTER: New Zealand set the target of 240 runs for the Indian team to chase here in the first semi-final being played at Leeds to make into the final of World Cup 2019– this Sunday.  The match was resumed after a day wash due to rain as according to International Cricket Council (ICC) rules a day is reserved if the semi-final match is washed out.  ,https://www.newsone.tv/wp-content/uploads/2019/07/india-vs-new-zealand.jpg,World Cup 2019,The match was resumed after a day wash due to rain as according to International Cricket Council (ICC) rules a day is reserved if the semi-final match is washed out.,neutral
"World Cup: Semi-final to resume today between India, New Zealand","MANCHESTER: The semi-final clash between New Zealand and India will resume on Wednesday after rain halted the match on Tuesday with Kiwis scoring 211 with 5 wickets down. Kane Williamson and Ross Taylor scored 67 runs while Indian bowlers all got one wicket each. After weeks of close encounters and edge of the seat thrillers, India will take on New Zealand in the first semi-final of the World Cup at Old Trafford in Manchester on Tuesday. Today’s contest will be a repeat of the semi-finals of the 2008 ICC Under-19 World Cup in which a Virat Kohli-led India defeated a Kane Williamson-captained New Zealand in Kuala Lumpur. India, whose group match against 2015 runners-up New Zealand was washed out, have suffered just one defeat at this World Cup so far, against England, and ended on top of the 10-team group stage, making them strong favourites to beat the Black Caps. The Kiwis who were deemed favourites at the start of the tournament kicked off their World Cup campaign on a high, but suffered defeats and only qualified for the semi-finals in fourth place on the basis of net run-rate. They lost their last three games — against Pakistan, holders Australia and England. For New Zealand, skipper Williamson has been in fine form, making match-winning hundreds against South Africa and the West Indies. But the rest of the top order have had a largely forgettable World Cup, with the Black Caps losing 13 wickets in the powerplay at just 23.38 each — the worst record in the competition. Williamson’s 481 tournament runs represent nearly 29 per cent of New Zealand’s total at this World Cup. On the other hand, India’s success at this World Cup has been built on the heavy scoring of a Rohit Sharma-led batting top order. Sharma became the first batsman to score five centuries in a single World Cup when he made 103 in a seven-wicket win over Sri Lanka at Headingley on Saturday, while fast bowler Jasprit Bumrah has been the spearhead of a well-balanced bowling attack. ",https://www.newsone.tv/wp-content/uploads/2019/07/INDIA.jpg,World Cup 2019,"India, whose group match against 2015 runners-up New Zealand was washed out, have suffered just one defeat at this World Cup so far, against England, and ended on top of the 10-team group stage, making them strong favourites to beat the Black Caps.",neutral
1992 vs 2019 World Cup: Memes played crucial part in keeping hopes alive for Pakistani fans,"BY: Maryam Qureshi Rollercoaster ride it has been for Pakistan’s cricket team. ‘Unpredictable’ is the term locals use to define this team and no doubt they are unpredictable, from turning an easy target by taking it to 6 on 6. Exactly when everything was taking a turn so did social media posts, from bashing Sarfaraz Ahmed about his unfit body to scolding Shoaib Malik on eating burgers, now all limelight was being shifted to the similarities between the pattern of 1992’s World Cup and 2019’s. Now that Pakistan is officially disqualified from 2019 World Cup I will shed some light on how meme game took turns. Fans started to take notes of the eerie similarities between 1992 and 2019’s World Cup regarding Pakistan’s pattern of losing and wining. Within a day my Facebook feed was flooding with posts saying ‘Ye World Cup humara’   People linking the similarities in every way they could, however failing to realize cricket game is not merely about repeating past events in favor of a team. If this would have been the case, everyday would be the same as Sun rises and Moon sets in a similar pattern and anyone could have said ‘Oh the Moon also rose in the same manner as yesterday, hence this day will exactly be same like yesterday’s .’ But this is not the case, no one can stay dependent on past events. Pakistan started performing well while beating New Zealand, from 6th ranking Pakistan was now on 4th and how could fans resist from making memes. The ‘men in green’ were proud, all hail to Babar Azam’s outstanding performance. Here is a link to one such meme which made me laugh.  During the very match a comparison was also broadcasted between Pakistan’s pattern of winning and losing in 1992 and 2019, well then the picture got clearer that fans were not only noticing but well known commentators were also well aware of this spooky similarity. This too was turned into a hilarious meme.    Have you ever noticed Pakistan’s cricket fans supporting India? NO. But the entire nation was found hooting for India’s win when Pakistan’s access into Semi-Finals was dependent on their victory. I was shopping with my mother while I overheard a few shopkeepers talking ‘Dua kero India jeet jae achay margin se’ Well, this time I wasn’t shocked as we were depending on India for our ticket to semi final. Right when India’s team was not only being supported by their country but by the neighboring country too, Indian players ‘intentionally lost the match’ as said by many Pakistani cricket fans. Batsmen were seen brisk walking on the pitch while making singles and no doubt their actions were clear. Relying on a rival for a gesture which could get Pakistani team into semis was not a good option. India lost and meme generators were active again (Well.. they are never inactive)   This meme showing M.S Dhoni holding a banner saying ‘Apna game khud jeeto’  It might be funny for some and thought to provoke for many. If Pakistani players performed well in past matches then waiting for India’s win would not have been a matter of concern for Pakistani fans. One must understand, Pakistan getting into Finals should not be reliant on India’s performance or the past performances in 1992. In 1992 Imran Khan was the captain whereas in 2019 Sarfaraz Ahmed is the captain. Khan married thrice doesn’t mean that Ahmed would too similarly pattern of winning or losing could have been noticed till generating memes but not for a country’s winning or losing probability. Game is all about losing and winning, I have said this before and I will say it again ‘Tum jeeto ya haaro suno, humein tumse pyar hai’  Long way to go green shirts, I will support you but I would also like to add the fact that if Pakistan’s run rate was maintained at a better number, we might have been a part of Semis Or Finals as players and not as audience.   ",https://www.newsone.tv/wp-content/uploads/2019/07/h4.jpg,World Cup 2019,"Within a day my Facebook feed was flooding with posts saying ‘Ye World Cup humara’   People linking the similarities in every way they could, however failing to realize cricket game is not merely about repeating past events in favor of a team.",neutral
