title,news,img-url,category,summery,opinionPakistan was looted mercilessly by past govts: PM Khan,"ISLAMABAD: Prime Minister Imran Khan on Wednesday said Pakistan was looted mercilessly by the past governments due to which national exchequer was left empty. Addressing the memorandum of understanding (MoU) signing ceremony of the Naya Pakistan Housing Scheme, the Premier said the incumbent government has decided to make 5 million new homes under the scheme which is a difficult task to accomplish. PM said locally made material will be used to build new houses and the project will promote business activities in the country. He said only 0.2 per cent loans were given for building houses in the country and an ordinance for accessibility of easy loans to build homes has been passed by the cabinet, the process for which will begin shortly after approval from the courts. PM said loans will be provided to those who do not have resources to build houses and the scheme will initiate building houses for the fishermen of Gwadar in the first phase. He said the scheme will enable low-income workers and government employees to build houses for themselves. PM said the building of houses will be done through one-window operation and the scheme requires some preparation time before commencing building houses. ",https://www.newsone.tv/wp-content/uploads/2019/07/Imran-Khan-1.jpg,Pakistan,"He said only 0.2 per cent loans were given for building houses in the country and an ordinance for accessibility of easy loans to build homes has been passed by the cabinet, the process for which will begin shortly after approval from the courts.",neutral
Shahzad Akbar terms recovery of Rs2.1 BN ‘a breakthrough’ in fake accounts case,"ISLAMABAD: Special Assistant to Prime Minister (SAPM) Shahzad Akbar said on Wednesday that the first major recovery of Rs2.1 billion is a major breakthrough in the fake accounts case. In a tweet, SAPM said that the recovery took place due to the pleas bargain. The suspect confessed to his crime in relation to the issue of Omni group, he added.  He praised the role of the Joint Investigation Team (JIT) and the National Accountability Bureau (NAB) in recovering the amount. The authorities are investigating 32 people in relation to money laundering from fake accounts, including former president Asif Ali Zardari and sister Faryal Talpur. Zardari’s close aide Hussain Lawai was arrested earlier in connection with the investigation. The Federal Investigation Agency (FIA), in August 2018, arrested ex-president’s other close aide and Omni Group chairman Anwar Majeed and his son, Abdul Ghani. Over 20 ‘benami’ accounts at some private banks were opened in 2013, 2014 and 2015 from where transactions worth billions of rupees were made, according to sources. The amount, according to FIA sources, is said to be black money gathered from various kickbacks, commissions and bribes. ",https://www.newsone.tv/wp-content/uploads/2018/10/shahzad-akbar.png,Pakistan,ISLAMABAD: Special Assistant to Prime Minister (SAPM) Shahzad Akbar said on Wednesday that the first major recovery of Rs2.1 billion is a major breakthrough in the fake accounts case.,neutral
"NAB to inquire Khursheed Shah, Mehtab Abbasi","ISLAMABAD: The National Accountability Bureau (NAB) on Wednesday gave approval for inquiry against Pakistan Peoples Party’s (PPP) Syed Khursheed Shah andPakistan Muslim League-Nawaz’s (PML-N) Sardar Mehtab Abbasi. Approval for investigation against officers and workers of the information and broadcast ministry has also been given, the accountability watchdog further said. An inquiry against former federal minister Tanveer ul Hassan Gillani has been closed due to a lack of evidence. NAB chairman Justice (retd) Javed Iqbal said the institution’s aim is to have a corruption-free Pakistan. ",https://www.newsone.tv/wp-content/uploads/2019/07/Khursheed-Shah-Mehtab-Abbasi.jpg,Pakistan,An inquiry against former federal minister Tanveer ul Hassan Gillani has been closed due to a lack of evidence.,neutral
"PM Khan, UN Resident Coordinator discuss malnutrition, population","ISLAMABAD: United Nations (UN) Resident Coordinator Neil Buhne called on Prime Minister Imran Khan in Islamabad on Wednesday. Speaking to Buhne, the prime minister said the government is especially focusing on addressing the issue of malnutrition and adulteration which were adversely impacting the growth of the young population. Referring to the government’s flagship Ehsaas Programme, Premier said he appreciated the technical assistance being provided by the UN agencies.  On the issue of rising population, the premier noted that the issue of the population was connected with primary health care and primary education. “The government is according priority to these areas,” he said. PM further said the development of merged tribal areas is another key priority of the present government, adding, “we have allocated the highest ever funds for the uplift of the merged areas.” Highlighting the successes made in the billion tree Tsunami project, the premier observed that this will go a long way towards mitigating the adverse impacts of climate change in the country. Efforts being made to eliminate polio from the country were also discussed by the premier and UN resident coordinator. The UN Resident Coordinator appreciated PM Khan’s vision and the steps taken by the government in addressing the issues which remained neglected in the past. He especially commended the efforts of the government in tackling the issue of stunted growth, improving health care and the initiative of 10 billion Tree Tsunami and Ehsaas Program. Buhne also briefed the premier about the engagement of various UN agencies with relevant government departments and ministries in critical areas such as good governance, health and education, youth development, population control and addressing the issue of climate change. ",https://www.newsone.tv/wp-content/uploads/2019/07/Imran-Khan-UN.jpg,Pakistan,"Buhne also briefed the premier about the engagement of various UN agencies with relevant government departments and ministries in critical areas such as good governance, health and education, youth development, population control and addressing the issue of climate change.",neutral
If Sindh govt has to do all work then dissolve local govt: Saeed Ghani,"KARACHI: In wake of the damage caused by the heavy rains in the city, Sindh Local Government Minister Saeed Ghani said on Wednesday held the federal and local government responsible for the current situation. Addressing a press conference here at Karachi, the minister said that if every task is to be done by the provincial government then the local government should be dissolved. “We will do it,” said the agitated minister, adding that the water cannot be pumped out of the inundated areas within a day. Yusuf Goth, Saadi Town, Raees Amrohi Town, and other localities are situated on the pathways of floodwater, said Ghani. The accumulated water due to urban flooding is yet to be suctioned out, he added. Several highways are not completely blocked due to rain, Saeed Ghani said, adding that Green Line route has been cleared. The provincial minister further added, “the responsibility to clear 38 big nullahs of the city falls on the Karachi Metropolitan Corporation (KMC) and 200 smaller nullahs fall under the jurisdiction of the District Municipal Corporation (DMC).” Senator Murtaza Wahab also addressed media, saying that Mayor Karachi Waseem Akhtar is always complaining about a lack of authority. Senator asked, “why doesn’t the mayor work utilising the rights already given to him?” ",https://www.newsone.tv/wp-content/uploads/2019/07/Saeed-Ghani.jpg,Pakistan,"KARACHI: In wake of the damage caused by the heavy rains in the city, Sindh Local Government Minister Saeed Ghani said on Wednesday held the federal and local government responsible for the current situation.",neutral
"Hamza bin Laden, son of Al-Qaeda founder, is dead: US official","The United States believes that Hamza bin Laden, a son of slain Al Qaeda leader Osama bin Laden and himself a notable figure in the militant group, is dead, a US official said on Wednesday. The US official, who spoke on condition of anonymity, provided no further details, including when Hamza died or where. President Donald Trump earlier on Wednesday declined to comment afterNBC Newsfirst reported the US assessment. Asked if he had intelligence that bin Laden’s son had been killed, Trump told reporters: “I don’t want to comment on it.” Separately, the White House declined to comment on whether any announcement was imminent. Hamza, believed to be about 30 years old, was at his father’s side in Afghanistan before the September 11, 2001, attacks on the United States and spent time with him in Pakistan after the US-led invasion of Afghanistan pushed much of Al Qaeda’s senior leadership there, according to the Brookings Institution. Osama bin Laden was killed by US special forces who raided his compound in Pakistan in 2011. Hamza was thought to be under house arrest in Iran at the time, and documents recovered from the compound indicated that aides had been trying to reunite him with his father. The New York Timesreported that the United States had a role in the operation that led to Hamza’s death, which it said took place in the past two years.Reuterscould not immediately verify those details. Still, the US government’s conclusion appears to be a recent one. In February, the State Department said it wasofferinga reward of up to $1 million for information leading “to the identification or location in any country” of Hamza, calling him a key Al Qaeda leader. Introduced by Al Qaeda’s chief Ayman al-Zawahiri in an audio message in 2015, Hamza provided a younger voice for the group whose ageing leaders have struggled to inspire militants around the world galvanised by Islamic State, according to analysts. Hamza called for acts of terrorism in Western capitals and threatened to take revenge against the United States for his father’s killing, the US State Department said in 2017 when it designated him as a global terrorist. He also threatened to target Americans abroad and urged tribal groups in Saudi Arabia to unite with Yemen’s Al Qaeda in the Arabian Peninsula to fight against Saudi Arabia, it said. In March, Saudi Arabiaannouncedit had stripped Hamza bin Laden of his citizenship, saying the decision was made by a royal order in November 2018. Reuters ",https://www.newsone.tv/wp-content/uploads/2019/08/Hamza-bin-Laden.jpg,World,"Hamza, believed to be about 30 years old, was at his father’s side in Afghanistan before the September 11, 2001, attacks on the United States and spent time with him in Pakistan after the US-led invasion of Afghanistan pushed much of Al Qaeda’s senior leadership there, according to the Brookings Institution.",neutral
"Hamza bin Laden, son of Al-Qaeda founder, is dead: US official","The United States believes that Hamza bin Laden, a son of slain Al Qaeda leader Osama bin Laden and himself a notable figure in the militant group, is dead, a US official said on Wednesday. The US official, who spoke on condition of anonymity, provided no further details, including when Hamza died or where. President Donald Trump earlier on Wednesday declined to comment afterNBC Newsfirst reported the US assessment. Asked if he had intelligence that bin Laden’s son had been killed, Trump told reporters: “I don’t want to comment on it.” Separately, the White House declined to comment on whether any announcement was imminent. Hamza, believed to be about 30 years old, was at his father’s side in Afghanistan before the September 11, 2001, attacks on the United States and spent time with him in Pakistan after the US-led invasion of Afghanistan pushed much of Al Qaeda’s senior leadership there, according to the Brookings Institution. Osama bin Laden was killed by US special forces who raided his compound in Pakistan in 2011. Hamza was thought to be under house arrest in Iran at the time, and documents recovered from the compound indicated that aides had been trying to reunite him with his father. The New York Timesreported that the United States had a role in the operation that led to Hamza’s death, which it said took place in the past two years.Reuterscould not immediately verify those details. Still, the US government’s conclusion appears to be a recent one. In February, the State Department said it wasofferinga reward of up to $1 million for information leading “to the identification or location in any country” of Hamza, calling him a key Al Qaeda leader. Introduced by Al Qaeda’s chief Ayman al-Zawahiri in an audio message in 2015, Hamza provided a younger voice for the group whose ageing leaders have struggled to inspire militants around the world galvanised by Islamic State, according to analysts. Hamza called for acts of terrorism in Western capitals and threatened to take revenge against the United States for his father’s killing, the US State Department said in 2017 when it designated him as a global terrorist. He also threatened to target Americans abroad and urged tribal groups in Saudi Arabia to unite with Yemen’s Al Qaeda in the Arabian Peninsula to fight against Saudi Arabia, it said. In March, Saudi Arabiaannouncedit had stripped Hamza bin Laden of his citizenship, saying the decision was made by a royal order in November 2018. Reuters ",https://www.newsone.tv/wp-content/uploads/2019/08/Hamza-bin-Laden.jpg,World,"Hamza, believed to be about 30 years old, was at his father’s side in Afghanistan before the September 11, 2001, attacks on the United States and spent time with him in Pakistan after the US-led invasion of Afghanistan pushed much of Al Qaeda’s senior leadership there, according to the Brookings Institution.",neutral
US puts sanctions on Iranian FM Javad Zarif,"The United States has imposed sanctions on Iranian Foreign Minister Mohammad Javad Zarif, the latest move by Washington in its “maximum pressure” campaign against Tehran. The Treasury Department said on Wednesday that it was imposing sanctions on Zarif for acting on behalf of Iranian Supreme Leader Ayatollah Ali Khamenei. “Javad Zarif implements the reckless agenda of Iran’s Supreme Leader, and is the regime’s primary spokesperson around the world,” Treasury Secretary Steven Mnuchin said in a statement. Zarif brushed off the sanctions on Twitter, saying the US move indicated Washington saw him as a “threat”. “It has no effect on me or my family, as I have no property or interest outside of Iran,” he said. Fears of a direct US-Iranian conflict have risen since May with several suspected attacks on oil tankers in the Gulf, Iran’s downing of a US surveillance drone, and a plan for US air raids on Iran last month that Trump called off at the last minute. ",https://www.newsone.tv/wp-content/uploads/2019/08/javad-zarif.jpg,World,"The United States has imposed sanctions on Iranian Foreign Minister Mohammad Javad Zarif, the latest move by Washington in its “maximum pressure” campaign against Tehran.",neutral
Afghanistan highway blast kills at least 34 on bus,"KABUL: An explosion on Wednesday hit a bus traveling on a highway between two key cities in western Afghanistan, killing at least 34 passengers, including children, and injuring 17, officials said. Security has been deteriorating across Afghanistan, with the Taliban and Daesh fighters mounting near-daily attacks on Afghan forces, government employees and civilians. The blast on the highway linking the provincial capitals of Herat and Kandahar took place in the Ab Khorma area of Farah province, said provincial police spokesman Mohibullah Mohib. “The bomb was freshly planted by the Taliban insurgents to target Afghan and foreign security forces,” he said. Taliban officials were not immediately available to comment on the statement and there was no immediate claim of responsibility for the attack. Government and aid officials say the numbers of those being killed and maimed is rising because of explosives newly planted by the Taliban, who now control more territory than at any point since their ouster nearly 18 years ago. The attack came one day after the United Nations said civilians are being killed and wounded at a “shocking” level in Afghanistan’s war, despite a push to end the nearly 18-year-old conflict. Casualties have dropped 27 per cent in the first half of 2019 compared to the same period last year, which was a record, but nonetheless, 1,366 civilians were killed and another 2,446 injured. The UN branded efforts to reduce the violence “insufficient”. It also said that US and pro-government forces caused more civilian deaths than the Taliban and other insurgent groups for the second quarter running. Child casualties represented almost one-third of the overall total of civilian casualties. Wednesday’s blast comes ahead of presidential elections next month, when US officials and Taliban representatives are also due to resume talks to agree a timetable for the withdrawal of foreign forces in exchange for security guarantees. AFP/REUTERS. ",https://www.newsone.tv/wp-content/uploads/2019/07/Afghanistan-Bus-Blast.jpg,World,It also said that US and pro-government forces caused more civilian deaths than the Taliban and other insurgent groups for the second quarter running.,neutral
52 killed in Brazil prison riot,"RIO DE JANEIRO: At least 52 inmates were killed in a prison riot in northern Brazil on Monday as rival gang factions fought each other, an official said. Sixteen of the dead were decapitated in the second major eruption of violence to rock the country’s severely overpopulated and deadly prison system in as many months. Fighting broke out in the Altamira Regional Recovery Centre at around 7am, an official from the Para state government’s penitentiary department said. Two guards were taken hostage during the hours-long clashes, which were brought under control at around midday. They were eventually freed. Brazilian TV stations showed footage of thick black smoke rising from the prison compound and people sitting on the roof of a building. Other images showed flames inside a building that almost reached the ceiling and people, apparently prisoners, sitting on the ground outside. “It is likely that many detainees died from asphyxiation (from smoke),” the government official said, adding the death toll could rise. Around 300 prisoners were being held at the jail, the official said, which reportedly has a capacity for 200. An outbreak of violence in the same prison in September 2018 left at least seven inmates dead, local media reported previously. Guards had apparently foiled an attempted prison escape. In May this year, at least 55 prisoners were killed in several jails in the neighbouring state of Amazonas in violence also blamed on an apparent drug trafficking gang dispute. Most of the victims were killed by asphyxiation, the state government said at the time. The federal government dispatched reinforcements to boost security in the jails. Brazil has the world’s third largest prison population after the United States and China, with 726,712 inmates as of June 2016, according to official statistics. The population is roughly double the capacity of the nation’s jails, which in the same year was estimated to be 368,049 inmates. The federal government had been expected to add another 115,000 inmates by the end of 2018, Human Rights Watch said in a recent report. Around 40 percent of the prison population is made up of pretrial detainees. Along with severe overcrowding and gang violence, riots and breakout attempts in Brazil’s prisons are not uncommon. Experts have described conditions in the country’s jails as inhuman, with most inmates poor, black and with little formal education. AFP. ",https://www.newsone.tv/wp-content/uploads/2019/07/Brazil.jpg,World,"An outbreak of violence in the same prison in September 2018 left at least seven inmates dead, local media reported previously.",neutral
