title,news,img-url,category,summery,opinion
Pakistan leaps eight spots on UN happier countries index,"KARACHI: Pakistanis may indulge in numerous tribulations every day, but they cheerfully get ahead of those tribulations â at least thatâs what United Nations World Happiness Index implies. The latest rankings see Pakistan leap eight spots from 2018 to become 67th happiest nation of the world. The 2019 report âwhich outlines countriesâ progression since 2005 â also places Pakistan among the top 20 gainers ranked on the index. Adversary India was ranked among 20 biggest losers after it plummeted seven spots from previous year to 140 on the list. Just like previous year, Pakistan stayed the happiest country in South Asia, trail by Bhutan at 95. Other Asian countries on the list included: Nepal 100, Bangladesh 125, Sri Lanka 130, and Afghanistan, the least happiest Asian country, ranked 154. The top 5 spot was held by Scandinavian countries, continuing from last year, with Finland becoming the most happiest nation of the world, ranked #1, followed by Denmark and Norway. Top ten countries were Iceland, the Netherlands, Switzerland, Sweden, New Zealand, Canada and Austria  South Sudan found themselves ranked 156, declared the unhappiest country of the world where, around 60% of population is grappling with food uncertainty in a post civil war region. The survey grades 157 nations by the extent of happiness their citizens identify themselves to be and every year, happiness is appraised by the usage of different markers. The current survey centered on six variables that sustain welfare, such as income per capita, life span, social support, independence, magnanimity and corruption. While the measure of happiness has been successfully conducted in the seventh consecutive year, the project is not without its detractors as they showed uncertainty at the âquantificationâ of a feeling as intangible as happiness can be done. While some call attention to increasing suicide rates widespread in the urbanized nations with the constantly raising reliance on anti-depressants in countries such as Denmark and Iceland. Report is conceived with keeping emerging science of happiness in mind, writers of the report claim. They further added, ââ[It shows] that the quality of peopleâs lives can be coherently, reliably, and validly assessed by a variety of subjective well-being measures, collectively referred to then and in subsequent reports as happiness.â The falling altitude of happiness all across the world in spite of persisting economic development, in part elucidated by descending status amid population-dense nations such as United States, Egypt and India is also emphasized by the report. Concluding that happiness and life fulfillment in terms of sole economic prosperity is not sufficient. Pakistanâs advancement on the index  Last year, Pakistan was ranked 75, accelerated from 80 in 2018 and making a leap to 65 this year. Index indicated that residents have been reporting raising fulfillment in all six categories described to measure happiness. ",https://www.newsone.tv/wp-content/uploads/2019/03/UN-Happiness-3.jpg,Special,['MM Alam retired from PAF as an air commodore and took up residence in Karachi where he took his last breathon 18 March 2013 at the age of 73.'],positive
"Holi being celebrated across Pakistan, world today",,https://www.newsone.tv/wp-content/uploads/2018/03/Holi.jpg,Special,"['NEW YORK: A major US newspaper has placed Prime Minister Imran Khan on its starting list of world leaders to win this years Nobel Peace Prize, citing his leadership in de-escalating the recent tensions between India and Pakistan.']",neutral
Six death anniversary of 1965 war hero MM Alam being observed today,"The 1965 war heroMuhammad Mahmood Alam, popularly known as MM Alam is being remembered on his 6th death anniversary on Sunday. MM Alam is remembered for establishing a world record of downing five Indian aircrafts in less than a minute on 07 September 1965, the last four within thirty second,with total of nine aircraft downed in the war. Alam was the eldest son of 11 siblings who was born in Calcutta on July 6 1935.The family migrated from Calcutta to Eastern Bengal which became East Pakistan following the formation of Pakistan in 1947. Alam was granted commission in PAF (then RPAF) on October 2 1953. MM Alam retired from PAF as an air commodore and took up residence in Karachi where he took his last breathon 18 March 2013 at the age of 73. ",,Special,['Aurat March 2019 is scheduled to take place all across Pakistan in celebration of International Womens Day.'],positive
US newspaper places PM Imran Khan on its list for possible Nobel Peace Prize award,"NEW YORK: A major US newspaper has placed Prime Minister Imran Khan on its âstarting listâ of world leaders to win this yearâs Nobel Peace Prize, citing his leadership in de-escalating the recent tensions between India and Pakistan. Besides the Pakistani leader, The Christian Science Monitor has listed South Korean President Moon Jae-in for opening a door to North Korea and seeking a peaceful engagement aimed at de-nuclearising the Korean peninsula; Ethiopian Prime Minister Abiy Ahmed for signing a peace pact with Eritrea and freeing political prisoners, and Venezuelaâs opposition leader Juan Guaido, who became interim president with the support of the National Assembly to bring about peaceful change in the Latin American country. âPerhaps the biggest surprise in peaceful leadership â and most critical to the world â is Imran Khan,â the publication said. It added, âAfter a February 14 attack that killed at least 40 Indian soldiers in occupied Kashmir, India launched its first airstrike inside Pakistan since a 1971 war. The two nuclear-capable states were primed for all-out conflict. In a goodwill gesture, Prime Minister Imran Khan returned the Indian pilot who was shot down inside Pakistan. He also offered talks with India. âNobody wins in a war. Especially countries that have the sort of weapons that India and Pakistan possess should not even think of warâ¦,â he said, the publication added.  APP ",https://www.newsone.tv/wp-content/uploads/2019/02/PM-Imran-Khan.jpg,Special,"['In his long career as an author, teacher and political commentator, Prof Wolpert published 15 books, including four novels, but the one that made him a must read in Pakistan isJinnah of Pakistan, published in 1982.']",neutral
Krishna Kohli presides over senate session on International Womenâs Day,"ISLAMABAD: Pakistanâs first ever Thai-Hindu female Senator Krishna Kumari Kohli is set to preside todayâs Upper House senate session coinciding with the International Womenâs Day. Senator Faisal Javed Khan tweets,âChairman Senate of Pakistan decided to make our colleague Krishna Kumari Kohli aka Kishoo Bai to Chair the Senate for today on Womenâs Day.â  39-year old Kohli, a leader of Pakistan Peopleâs Party (PPP), hails from Nagarparkar, a village located in Tharparkar and is first-ever Pakistani Senator from a lower strata of Hindu community. Nagarparkar is a place where most women are unable to access lifeâs basic necessities. International Womenâs Day is annually observed on March 8 globally. Aurat March 2019 is scheduled to take place all across Pakistan in celebration of International Womenâs Day. ",https://www.newsone.tv/wp-content/uploads/2019/03/Krishna-1.jpg,Special,"['With a long, cold winter in the Canadian forecast, they decided late last year to try to extend the experience of finding one´s way through the network of paths and hedges by several months.']",negative
"Eminent author Stanley Wolpert, writer of âJinnah of Pakistanâ passes away","WASHINGTON: Author Stanley Wolpert, popular in PakisÂ­tan for his books on Quaid-i-Azam Mohammed Ali Jinnah and Zulfikar Ali Bhutto, died in California last night. He was 91. In his long career as an author, teacher and political commentator, Prof Wolpert published 15 books, including four novels, but the one that made him a must read in Pakistan isJinnah of Pakistan, published in 1982. It is among the best biographies of the Quaid. He taught at the University of California, Los Angeles, from 1959 to 2002. ",https://www.newsone.tv/wp-content/uploads/2019/03/Wolpert.jpg,Special,"['The American military began prioritising its alliance with India as its close relationship with Pakistan soured over the last two decades, the report pointed out, adding that the American officials tasked with strengthening the alliance [with India] talk about their mission with frustration: a swollen bureaucracy makes arms sales and joint training exercises cumbersome; Indian forces are vastly underfunded; and the countrys navy, army and air force tend to compete rather than work together. For Indias military, funding remains the biggest challenge, the report noted.']",negative
Canadian couple builds worldâs largest snow maze,"A-maze-ing: a snow labyrinth in the frigid, windswept prairies of Western Canada has broken the record for the worldÂ´s biggest. According to Guinness World Records, the whopping 2,789.11 square meters (30,0021.73 square feet) of terrain dwarfs the previous Canadian record holder at the Fort William Historical Park in Thunder Bay, Ontario. For years, farmers Clint and Angie Masse would ring in the fall harvest by building a corn maze on their property just outside of the small town of St Adolphe, a short drive from Winnipeg, Manitoba. With a long, cold winter in the Canadian forecast, they decided late last year to try to extend the experience of finding oneÂ´s way through the network of paths and hedges by several months. And despite temperatures plunging to a low of -40 degrees Celsius (-40 Fahrenheit) in January, people kept coming in droves. But it was no easy feat, Clint Masse told AFP. He said building the maze required weeks of planning, tens of thousands of dollars and 370 truckloads of snow to supplement the relatively thin powder on their fields. âMaking snow is really expensive,â he said, pointing to the cost of renting generators, tractors and other equipment, fuel and weeks of labor. There were design challenges too. âYouÂ´re not designing a path, what you are is designing walls and every wall has a double duty: itÂ´s got a path on this side and a path on that side,â Masse said. âI wanna say it took me a better part of a week. The corn maze I think I could do in a day and a half so itÂ´s a lot of more work to design.â The couple used commercial computer-aided design and drafting software. Inside the labyrinth, visitors walk between walls of snow that are 1.8 meters (six feet) high, and atop a layer of snow packed tightly to prevent it from melting too soon into slush under the pedestrian traffic. They are greeted by ice sculptures around several corners, and benches have been set up around campfires burning in five nooks to allow visitors to warm up before continuing on and trying to solve the puzzle. The fire pits also act as markers, which first-timers Jillian Crooks and Cassidy Wegner said were indispensable for finding their way. âIt was fun,â Crooks said. âWe just kept turning every which way. It took us a while. We didnÂ´t time it, we should have. Maybe like half an hour? Yep!â That bested the posted average of 30-45 minutes. If cold temperatures hold, the labyrinth could stay open for a few more weeks, by which time Clint Masse said he hopes to have had more than 10,000 visitors and turn a small profit. AFP. ",https://www.newsone.tv/wp-content/uploads/2019/03/Maze.jpg,Special,"['Sikh leaders addressing the rally condemned the violation of Pakistani airspace by Indian forces, saying every Sikh is a soldier of Pakistan without uniform, and the Sikh community stands with Pakistan.']",negative
Indiaâs defeat in aerial dogfight with Pakistan has left them vulnerable: NYT,"Indiaâs defeat to the Pakistan Air Force in last weekâs aerial dogfight has exposed its âvintageâ military, aNew York Times reportpublished on Sunday said. âThe aerial clash, the first by the South Asian rivals in nearly five decades, was a rare test for the Indian military â and it left observers a bit dumbfounded. While the challenges faced by the Indiaâs armed forces are no secret, its loss of a plane last week to a country whose military is about half the size and receives a quarter of the funding was still telling,â NYTâs South Asian correspondent Maria Abi-Habib wrote, referring to the shooting down of Indiaâs Soviet-supplied MiG-21 by the Pakistan Air Force in a dogfight inside Pakistani territory on Wednesday. Indiaâs armed forces are in alarming shape, with 68 percent of the armyâs equipment so old it is officially considered âvintageâ. If intense warfare broke out tomorrow, India could supply its troops with only 10 days of ammunition, according to government estimates, the report said. âOur troops lack modern equipment, but they have to conduct 21st-century military operations,â Gaurav Gogoi, an Indian lawmaker and member of the Parliamentary Standing Committee on Defence, was quoted as saying by the newspaper. The American military began prioritising its alliance with India as its close relationship with Pakistan soured over the last two decades, the report pointed out, adding that the âAmerican officials tasked with strengthening the alliance [with India] talk about their mission with frustration: a swollen bureaucracy makes arms sales and joint training exercises cumbersome; Indian forces are vastly underfunded; and the countryâs navy, army and air force tend to compete rather than work together.â For Indiaâs military, funding remains the biggest challenge, the report noted. âIn 2018, India announced a military budget of some $45 billion. By comparison, Chinaâs military budget that year was $175 billion. Last month, Delhi announced another $45 billion budget. âIt is not just a question of how much India spends on its military, but how it spends it. The majority of the money goes to salaries for its 1.2 million active duty troops, as well as pensions. Only $14 billion will be used to buy new hardware. âCutting troop levels so that the military can spend the money on buying modern equipment is not so simple. Indiaâs military has long been a source of jobs for a country struggling with chronic underemployment. That is likely to be a big issue in elections scheduled for later this spring,â the newspaper pointed out. âGovernment officials in New Delhi say they are struggling to improve the lives of their citizens in the most basic of ways â dealing with high illiteracy rates and poor sanitation infrastructure, as just two examples â making it hard to funnel more money toward the military at a time when China is making incursions into Indiaâs backyard by land and seaâ¦ âAs the worldâs conflicts are increasingly fought with state-of-the-art weaponry rather than the large invading armies of the past, India is falling behind. Despite being the fifth-largest military spender, only about a quarter of its military budget this year will purchase new equipment,â the report said. Although the purchase of military hardware is a slow-moving process in most countries, in India it moves even more sluggishly amid a swollen bureaucracy, it noted, adding that there are also concerns about corruption. âModi is currently being grilled by the opposition over a murky $8.9 billion deal to buy 36 Rafale fighter planes from France. His political opponents have cast the agreement as corrupt in an effort to discredit him ahead of elections,â the article stated. The purchase will help India replace its aging fleet of MiG-21s and other jets. And on Saturday, the prime minister tried to turn the tables on the opposition, saying India would have fared better in its skirmish with Pakistan last week if it had had the Rafale jets, it added. âThe country has felt the shortage of Rafale,â Modi was quoted as saying, as he admitted Pakistan Air Forceâs superiority in air warfare. ",https://www.newsone.tv/wp-content/uploads/2019/03/PAF.jpg,Special,"['PARIS: The world´s largest bee  a giant insect roughly the size of a human thumb  has been rediscovered in a remote part of Indonesia in its first sighting in nearly 40 years, researchers said Thursday.']",neutral
Pakistani Sikhs come out in support of Pakistan against Indian adventurism,"TAXILA: Sikhs attended a rally on Thursday outside Gurdwara Punja Sahib in Hassanabdal protesting Indian intrusion at the Line of Control and to express solidarity with the armed forces whilst celebrating Pakistanâs act of self defense and dignified stance for peace and reconciliation. Sikh leaders addressing the rally condemned the violation of Pakistani airspace by Indian forces, saying every Sikh is a soldier of Pakistan without uniform, and the Sikh community stands with Pakistan. They added that Pakistan could not be coerced into submission. Participants chanted slogans in support of Pakistan and the military against India. They claimed that the Sikh community living across the country, particularly in the tribal districts, were ready to fight alongside Pakistan to defend the country where their religious sites are located. They added that overseas Sikhs would stand by Pakistanâs side as well in the face of Indian aggression. Sardar Rawinder Singh said Sikhs living across the country, particularly in the tribal districts, were in solidarity with the nation and the armed forces. He said, implicating Pakistan in the Pulwama attack was a lie and an electioneering tactic by Indian Prime Minister Narendra Modi. Sikh community elder Sardar Gullbeer Singh Garnanthi said: âSikhs have many sacred places in Pakistan, including Sri Nankana Sahib, Sri Kartarpur Sahib, Sri Panja Sahib, and Sikhs around the globe consider Pakistan their second home and stand with the Pakistani armed forces against any aggression by the Indian forces.â Another community leader, Sardar Saat Naam Singh, said Pakistan was the land where the founder of the Sikhism, Sri Guru Nanak Dev Ji, was born and breathed his last, therefore Sikhs would stand with Pakistan if it comes to choosing between the two neighboring countries. ",https://www.newsone.tv/wp-content/uploads/2019/03/Sikhs.jpg,Special,"['The 104-page report titled, Violent Cow Protection in India: Vigilante Groups Attack Minorities, states that between May 2015 and December 2018, at least 44 people  including 36 Muslims  were killed in attacks across 12 Indian states.']",positive
Vatican Treasurer Pell found guilty of abusing two choir boys 22 years ago,,https://www.newsone.tv/wp-content/uploads/2019/02/Pell.jpg,Special,"['Australia continued a string of hottest ever months in March, the government said Monday, as global warming emerges as the hot button issue in national elections just weeks away.']",negative
âFlying bulldogâ: worldâs largest bee refound,"PARIS: The worldÂ´s largest bee â a giant insect roughly the size of a human thumb â has been rediscovered in a remote part of Indonesia in its first sighting in nearly 40 years, researchers said Thursday. Despite its conspicuous size, no one had observed WallaceÂ´s giant bee â discovered in the 19th century by British naturalist Alfred Russel Wallace and nicknamed the âflying bulldogâ â in the wild since 1981, the Global Wildlife Conservation said. âTo actually see how beautiful and big the species is in life, to hear the sound of its giant wingsâ¦ was just incredible,â said Clay Bolt, a specialist bee photographer who snapped the enormous insect. âMy dream is now to elevate this bee to a symbol of conservation in this part of Indonesia, a point of pride for the locals there.â The bee (full name Megachile pluto), which lives in the Indonesian island region of North Moluccas, makes its nest in termite mounds, using its large fang-like mandibles to collect sticky resin to protect its home from the termites. The IUCN Red List of Threatened Species lists the bee as âvulnerableâ, meaning that while its numbers are relatively solid, the remoteness of its population makes it hard to study. Several previous expeditions to the region where the bee lives failed to spot it. Indonesia is home to an abundant variety of flora and fauna but there are fears for some animal and insect communities as forests being cut down for agriculture threaten many speciesÂ´ natural habitat. âI hope this rediscovery will spark future research that will give us a deeper understanding of the life history of this very unique bee and inform any future efforts to protect it from extinction,â said Eli Wyman, an entomologist at Princeton University who accompanied Bolt on the trip. AFP. ",https://www.newsone.tv/wp-content/uploads/2019/02/Bee.jpg,Special,"['Australia continued a string of hottest ever months in March, the government said Monday, as global warming emerges as the hot button issue in national elections just weeks away.']",positive
Australia sees record temperatures for fourth month in a row,"Australia continued a string of âhottest everâ months in March, the government said Monday, as global warming emerges as the hot button issue in national elections just weeks away. The Bureau of Meteorology (BOM) said the country had experienced the warmest March on record, with mean maximum and minimum temperatures above average for nearly all of the vast continent nation. BOM said the national mean temperature was 2.13 degrees centigrade (3.83 degrees Fahrenheit) above the long-term average for the month of March. It was the fourth month in a row of record heat in the country, and January was AustraliaÂ´s hottest month ever, with mean temperatures across the continent exceeding 30 degrees Celsius for the first time. There was some relief for regions suffering from prolonged drought, however, as two tropical cyclones that struck northern and western Australia in March bought badly needed rains. âUnfortunately, the rain needed to reduce significant rainfall deficiencies in drought-affected areas is substantial and will require above average rainfall over a prolonged period to completely remove deficits at longer timescales,â BOM said. Meteorologists say weather patterns over the Indian and Pacific oceans have contributed to the higher temperatures, but that long-term climate change trends were also involved. The problem of climate change has emerged as a key issue in national elections due to be held by mid-May. The conservative coalition government of Prime Minister Scott Morrison has been reluctant to back steep reductions in greenhouse gas emissions blamed for contributing to global warming for fear this would hurt the countryÂ´s huge coal industry and undermine economic growth. The main opposition Labor Party, which leads the conservatives in opinion polls, on Monday unveiled a raft of proposals to cut greenhouse gas emissions, including through promotion of renewable energy sources and electric motor vehicles. AFP. ",https://www.newsone.tv/wp-content/uploads/2018/08/Australia.png,Lifestyle,"['Baylis said another possibility was Alice, a name that was among those speculated when Prince William and his wife Kate were expecting their third child last year.']",positive
