title,news,img-url,category,summery,opinion
Quetta storms into the finale with a sensational 10 run triumph,"KARACHI: A fierce Shane Watson brought his team a stormy acceleration towards the HBL PSL season 4 finale for the third time in PSL history for the Gladiators on Wednesday. After contributing a confident spell of 71 runs off 43 balls, Watson sealed off the last over with one victory defining wicket of Kieron A Pollard, 44 and then the run out of Darren Sammy 46 by skipper Sarfraz Ahmed effectively knocked out Peshawar Zalmi with a 176 run haul. Quetta Gladiators scored a hefty total of 186 against Peshawar Zalmi as Watsonâs half century and Ahsan Ali with 46 formed an 111 run partnership before a fiery Wahab Riaz smashed the wicket of Watson. It was up to Dwayne Bravo to end the innings with two fours to give a charming finishing touch to the innings. Sameen Gul, KA Pollard, TS Mills and Hasan Ali all got one wicket each. Umar Akmal scored a quick 22 while the captain Sarfraz Ahmed was only able to contribute 12 runs to the total. The collision of Zalmi and Gladiators is sure to stop heartbeats of fans as always.But it wonât be a dead end for the Zalmi â there will be another chance for them to make it to the final when they play against the winner of tomorrowâs Eliminator 1 between Islamabad United and Karachi Kings on Friday. But Quetta vs Peshawar matches are always more than just winning or losing. Itâs a battle of strengths, weaknesses and egos. The two nemesis have faced off multiples times in the playoffs, and each match has been nothing less than a thriller. ",https://www.newsone.tv/wp-content/uploads/2019/03/psl-3.jpg,PSL 2019,"['After contributing a confident spell of 71 runs off 43 balls, Watson sealed off the last over with one victory defining wicket of Kieron A Pollard, 44 and then the run out of Darren Sammy 46 by skipper Sarfraz Ahmed effectively knocked out Peshawar Zalmi with a 176 run haul.']",neutral
Peshawar to chase Quettaâs hefty total of 186 as Watson shines,"KARACHI: Quetta Gladiators scored a hefty total of 186 against Peshawar Zalmi as the opener Shane Watson contributes a confident spell of 71 runs in the final qualifier on Wednesday. Tymal Mills dismissed opener Ahmad Shahzad while a fierce Wahab Riaz bolted Watsonending his 111 run partnership with Ahsan Ali. Taking two wickets, Riaz put Quettaâs run making spell on hold for good. It was up to Dwayne Bravo to end the innings with two fours to give a charming finishing touch to the innings. Sameen Gul, KA Pollard, TS Mills and Hasan Ali all got one wicket each. Umar Akmal scored a quick 22 while the captain Sarfraz Ahmed was only able to contribute 12 runs to the total. Veteran batsman Misbah Ul Haq is part of the Zalmi lineup today while Ahsan Ali secured a spot on the Gladiatorâs line up replacing Anwar Ali. The collision of Zalmi and Gladiator is sure to stop heartbeats of fans today. The winner of this match will accelerate straight towards the final. But it wonât be a dead end for the loser team â there will be another chance to make it to the final when the loser of todayâs Qualifier plays against the winner of tomorrowâs Eliminator 1 on Friday. But Quetta vs Peshawar matches are always more than just winning or losing. Itâs a battle of strengths, weaknesses and egos. The two nemesis have faced off multiples times in the playoffs, and each match has been nothing less than a thriller. ",https://www.newsone.tv/wp-content/uploads/2019/03/PSL2.jpg,PSL 2019,"['Taking two wickets, Riaz put Quettas run making spell on hold for good.']",positive
Quetta and Peshawar Zalmi to clash today for the slot at PSL final,"KARACHI:  Itâs Quetta Gladiators vs Peshawar Zalmi today, and one of them is going straight into the final of the tournament on Sunday, March 17. But it wonât be all over for the losing side â there will be another chance to make it to the final when the loser of todayâs Qualifier plays against the winner of tomorrowâs Eliminator 1 on Friday. But Quetta vs Peshawar matches are always more than just winning or losing. Itâs a battle of strengths, weaknesses and egos. The two nemesis have faced off multiples times in the playoffs, and each match has been nothing less than a thriller.  ",https://www.newsone.tv/wp-content/uploads/2018/03/Quetta-vs-Peshawar-1.jpg,PSL 2019,"['The two nemesis have faced off multiples times in the playoffs, and each match has been nothing less than a thriller.']",positive
Peshawar Zalmi smashes Karachi Kings with a 61 run victory,"KARACHI: Peshawar Zalmi defeats Karachi Kings as keeper Kamran Akmalâs glorious 86 runs from 48 balls along with Imam Ul Haqâs 59 off 40 balls crunched an impressive and solid total of 203 which Karachi Kings were unable to chase. Hassan Ali took three victory defining wickets as Kings got reduced to 104 in 16.2 overs. While both Sameen Gul and Wahab Riaz got two wickets. Colin Ingram took on Zalmi with a strong spell of 71 runs off 37 balls with seven fours and four sixes. Kingsâ captain Imad Waseem scored 30 with facing 25 balls before getting dismissed by Hassan Ali. Aamer Yamin was replaced by Mohammad Aamir who secured 3 wickets of 24 runs. Colin Munro dismissed two batsmen while Usman Shinwari dismissed one. Due to Karachiâs victorious turn against pinnacle Quetta last night, todayâs game affected neither Karachi or Quetta at the points table as both teams have already ascended towards playoffs. However, had Karachi defeated Peshawar today, it would had a chance to secure the third spot on the point table but only if Kings achieved the target within nine overs or had they claim victory by a margin of 85 runs. Supporters of Peshawar in Karachi were thrilled to see the charming skipper Darren Sammy and his team back in action a year after Zalmiâs loss to Islamabad United in the final of HBL PSL season 3. Todayâs game has set up playoff fixtures. Playoffs March 13: Qualifier | Quetta vs Peshawar, March 14: Eliminator 1 | Islamabad vs Karachi, March 15: Eliminator 2: Loser Q vs Winner E1 Squads Karachi Kings  Imad Wasim (c), Colin Munro, Babar Azam, Mohammad Amir, Colin Ingram, Usman Shinwari, Mohammad Rizwan, Ravi Bopara, Sikandar Raza, Awais Zia, Usama Mir, Aaron Summers, Sohail Khan, Iftekhar Ahmed, Ali Imran, Abrar Ahmed, Aamir Yamin, Ben Dunk, Liam Livingstone, Jahid Ali, Umer Khan Peshawar Zalmi  Darren Sammy (c), Wahab Riaz, Hasan Ali, Imam-ul-Haq, Kieron Pollard, Kamran Akmal, Misbah ul Haq, Liam Dawson, Dawid Malan, Umar Amin, Umaid Asif, Khalid Usman, Wayne Madsen, Sohaib Maqsood, Jamal Anwar, Sameen Gul, Nabi Gul, Andre Fletcher, Chris Jordan, Ibtesam Sheikh, Samiullah, Tymal Mills ",https://www.newsone.tv/wp-content/uploads/2019/03/Peshawar-Zalmi-PSL.jpg,PSL 2019,['Hassan Ali took three victory defining wickets as Kings got reduced to 104 in 16.2 overs.'],negative
Multan Sultans defeats Lahore Qalandar by 7 wickets,"KARACHI: On Monday, Lahore Qalandars were defeated by seven wickets as the Multan Sultans after winning the toss, chose to field first  and successfully chased Qalandarâs set target of 140-8 at the National Stadium Karachi. The row of Qalandarâs continuous defeat continued in Pakistan Super League (PSL) season 4 as they found themselves placed at the last spot on points table.  Both teams were unable to qualify for the playoffs. Sultans chased the target with rather ease as Shan Masood contributed a strong sum of 48 runs with mere 25 balls along with Johnson Charles who added victorious 41 runs to finish the game. Skipper Fakhar Zaman scored a confident 53 from 36 balls, while David Wiese scored 30 from 22 balls. Three batsmen were dismissed by Mohammad Abbas for 22 runs while Shahid Afridi got two wickets for 18 runs. Sundayâs game resulted in a surprising one run victory of Karachi Kings against Quetta Gladiators due to which Lahore Qalandars were barred from escalating towards playoffs. For the fourth consecutive time, the Qalandars were robbed of their chance at the playoffs. Multan Sultan, on the other hand, has also been evicted for the second time. Even with the inclusion of master players such as AB De Villiers, Qalandars have only won three games out of ten to date. While the Sultans, also despite of comprising of veteran players such as Shahid Afridi and Shoaib Malik, managed to win only three games out of ten. Quetta Gladiators with 14 points, Peshawar Zalmi with 12, Islamabad United and Karachi Kings both with 10 points have qualified for the playoffs. Fakhar Zaman (c), Yasir Shah, Anton Devcich, Rahat Ali, Sandeep Lamichhane, Shaheen Afridi, Agha Salman, Sohail Akhtar, Hassan Khan, Haris Sohail, Mohammad Imran, Umair Masood, Gauhar Ali, Aizaz Cheema, Haris Rauf, Hardus Viljoen, David Wiese, Saad Ali, Asela Gunaratne, Riki Wessels Multan Sultans Shoaib Malik (c), Andre Russell, Shahid Afridi, Junaid Khan, Mohammad Irfan, James Vince, Shan Masood, Qais Ahmed, Nicolas Pooran, Mohammad Abbas, Irfan Khan, Umar Siddiq, Laurie Evans, Nauman Ali, Mohammad Illyas, M Junaid, Daniel Christian, Tom Moores, Ali Shafiq, Shakil Ansar, Hammad Azam, Chris Green ",https://www.newsone.tv/wp-content/uploads/2019/03/PSL-Multan-Sultan-Shahid-Afridi.jpg,PSL 2019,"['While the Sultans, also despite of comprising of veteran players such as Shahid Afridi and Shoaib Malik, managed to win only three games out of ten.']",neutral
World Cup 2019: PCB announces name of players for fitness test,"LAHORE: Pakistan Cricket Board (PCB) on Thursday announced names of national players to undergo fitness test ahead of the 2019 ICC World Cup at England and Wales. According to a notification, fitness test will be conducted on April 15, 16 at the National Cricket Academy after which passing players will be inducted in the final squad for the cricketâs most awaited mega event. National team will depart for England on April 23 and will play a 5 match one day international series with the host prior to the WC. Players undergoing the test include Sarfraz Ahmed, Abid Ali, Asif Ali, Babar Azam, Faheem Ashraf, Fakhar Zaman, Haris Sohail, Hasan Ali, Imad Wasim, Imam Ul Haq, Junaid Khan, Mohammad Abbas, Mohammad Amir, Mohammad Hafeez, Mohammad Hasnain, Mohammad Nawaz, Mohmmad Rizwan, Shadab Khan, Shaheen Afridi, Shan Masood, Shoaib Malik, Usman Shinwari and Yasir Shah. ",https://www.newsone.tv/wp-content/uploads/2019/04/Pak-team.jpg,Sports,"['We didnt have our best team against Australia, Arthur said while addressing a press conference in Lahore He added that no compromises will be made on players fitness with the World Cup right around the corner.']",positive
World Cup 2019: PCB announces name of players for fitness test,"LAHORE: Pakistan Cricket Board (PCB) on Thursday announced names of national players to undergo fitness test ahead of the 2019 ICC World Cup at England and Wales. According to a notification, fitness test will be conducted on April 15, 16 at the National Cricket Academy after which passing players will be inducted in the final squad for the cricketâs most awaited mega event. National team will depart for England on April 23 and will play a 5 match one day international series with the host prior to the WC. Players undergoing the test include Sarfraz Ahmed, Abid Ali, Asif Ali, Babar Azam, Faheem Ashraf, Fakhar Zaman, Haris Sohail, Hasan Ali, Imad Wasim, Imam Ul Haq, Junaid Khan, Mohammad Abbas, Mohammad Amir, Mohammad Hafeez, Mohammad Hasnain, Mohammad Nawaz, Mohmmad Rizwan, Shadab Khan, Shaheen Afridi, Shan Masood, Shoaib Malik, Usman Shinwari and Yasir Shah. ",https://www.newsone.tv/wp-content/uploads/2019/04/Pak-team.jpg,Sports,"['We didnt have our best team against Australia, Arthur said while addressing a press conference in Lahore He added that no compromises will be made on players fitness with the World Cup right around the corner.']",positive
Aussies defeating Green Shirts 5-0: Coach says âincredibly hardâ,"LAHORE: On Tuesday, Pakistanâs cricket coach Micky Arthur said  that the 5-0 white wash against Australia was âincredibly hardâ, but credited the poor performance to the lack of key players in the squad. âWe hate losing as a team â itâs not part of our vocabulary. Losing 5-0 was incredibly hard. We didnât have our best team against Australia,â Arthur said while addressing a press conference in Lahore He added that no compromises will be made on playersâ fitness with the World Cup right around the corner. âThere will be no compromise on playersâ fitness. We will conduct fitness tests on April 14. We will [then] sit down with the selection committee and make decisions about the World Cup squad.â He said that five centuries in the series and Hasnainâs debut were the a major positive outcome from the games played against Australia. Arthur further said that Sarfaraz is the managementâs first pick as a wicket keeper and new-comer Asif Ali will be focusing on taking the sixth spot im the batting lineup. ",https://www.newsone.tv/wp-content/uploads/2018/03/Mickey-Arthur.jpg,Sports,"['I will have to take baby steps going back onto the clay, I have played so little in the last few years so I don´t know what to expect but what this win does is takes even more pressure off me, Federer said.']",positive
Federer sweeps past Isner in Miami final for 101st title,"MIAMI: Roger Federer lifted the 101st title of his remarkable career on Sunday in dominating style, beating ATP Miami Open defending champion John Isner 6-1, 6-4. Federer, who has skipped the whole clay court season for the past two years, declared the triumph over the big-serving American in just 63 minutes was an ideal performance from which to launch a French Open bid. âI will have to take baby steps going back onto the clay, I have played so little in the last few years so I donÂ´t know what to expect but what this win does is takes even more pressure off me,â Federer said. âAlready just how IÂ´ve been playing and moving here makes me believe just going on vacation now, a bit of a break, and then preparation, you physically I should be fine, but again, weÂ´ll see how the body is going to react. âI am excited. ItÂ´s a good challenge,â added Federer of trying to dethrone Rafael Nadal at Roland Garros when the second Grand Slam of the season begins on May 26. Federer has been in brilliant form in South Florida, recovering superbly from losing the final in Indian Wells earlier this month to emphatically beat Isner, who was badly struggling with a foot problem at the end of the title match at Hard Rock Stadium. Federer will not appear at the next Masters event in Monte Carlo but is slated to play in Madrid at the beginning of May. âMadrid will be Â´letÂ´s see what happensÂ´ and then obviously I want to be ready for Paris and I hope all that hard work is going to pay off for the grass and hard court season,â he said. Against Isner, Federer seized control immediately as a break in the very first game sapped IsnerÂ´s confidence and allowed Federer to aggressively gain control of a match which he never looked like losing, especially after the AmericanÂ´s foot problem worsened. Isner was struggling badly and was heard telling the trainer during a medical timeout that he feared he had broken his foot. âSomewhere during the first set I started feeling pain on top of my foot and it didnÂ´t go away and it just got worse,â Isner said. IsnerÂ´s spirit was crushed after he dropped the first set in only 23 minutes. âItÂ´s a terrible feeling, because youÂ´re on an island out there. You have no teammates to hide behind and going up against the greatest player ever, you know, playing in this incredible atmosphere, and my footÂ´s killing me. âI have never had a broken foot, but thatÂ´s what I would imagine it would feel like. âNot that I would have won the match but I could have made for a more interesting match and one that was a little more fun.â This was FedererÂ´s 154th tour final and his 50th ATP Masters showpiece appearance. HeÂ´s in the twilight of his stellar career but has no plans to hang up his racket just yet. âIn terms of goals, itÂ´s about trying to win titles and trying to manage life so I stay injury-free,â the former world number one said. âSome days you just donÂ´t feel so well but this is a good phase, a good stretch for me right now. I really feel super healthy. ThatÂ´s why I have been able to play every day for the last four weeks. ThatÂ´s something that maybe hasnÂ´t always been the case for the last few years. âSo you appreciate these moments.â IsnerÂ´s booming serve failed to fire and there was to be no repeat of their last meeting at the Paris Masters 2015 when Federer was defeated in a third round encounter. To give the Swiss eight break chances in the first set spoke volumes about the sudden ineffectiveness of the Isner service game â he took only 50% of points on his first serve during the opener. With Isner hurting, Federer, who finished with a perfect 100% of points won on his first serve, wasted no time in the second set wrapping up his 28th Masters title. AFP. ",https://www.newsone.tv/wp-content/uploads/2018/08/Roger-Federer.jpg,Sports,['Skipper Aaron Finch was left unable to score big by Mohammad Hasnain as five wickets of Australia fall consecutively.'],positive
"Australia whitewashes Pakistan, wins fifth ODI by 20 runs","DUBAI: Australia on Sunday defeated Pakistan by 20 runs in the fifth one day international thus whitewashing the series by 5-0 at the Dubai International Cricket Stadium. Jason Behrendorff dismissed three Pakistani batsmen, restricting Pakistan to 307-7. Haris Sohail scored 130 off 129 balls while Shan Masood and Skipper Imad Wasim scored half centuries. Umar Akmal scored 43 off 44 balls. Kane Richardson, Nathan Lyon, Glenn Maxwell and Adam Zampa each got one wicket each. Usman Khawaja came two runs short to century while Maxwell scored 70 off 33 deliveries. Skipper Aaron Finch scored 53 while Shaun Marsh played an impressive 61 runs innings off 68 balls, leading to a total of 327-07. Usman Shinwari remained the leading wicket taker of the day with 4 dismissals followed by Junaid Khan with 3 dismissals. Other Pakistani bowlers were unable to take wickets. Australia defeated Pakistan by 6 runs in the fourth one day international at the Dubai International Stadium as Nathan Coulter-Nile and Marcus Stoinis clinch the victory with 03 and 02 important wickets. Debutant Abid Ali made his maiden century with 112 off 119 balls, he was well âassisted by Mohammad Rizwan who scored his second ODI century. Kane Richardson, Nathan Lyon and Adam Zampa took one wicket each. Skipper Aaron Finch was left unable to score big by Mohammad Hasnain as five wickets of Australia fall consecutively. Finally, Glenn Maxwell and Alex Carey picked the momentum to score 98 and 55 respectively to bring the total to 277. Usman Khawaja contributed 62 runs in the total. Hasnain, Skipper Imad Wasim and Spinner Yasir Shah dismissed two batsmen each. The Shoaib Malik-led XI showed some improvements with the ball, however, it was their batting that let them down on Wednesday as they suffered a series defeat. On the bowling front, Mohammad Amirâs form has come under heavy scrutiny and he found himself out of the team for the second and third ODI. He will be hoping for a recall in the fourth ODI to solidify his place in the squad ahead of the World Cup in England and Wales. On the other hand, Australia who made it six consecutive ODI wins will be banking on their bowlers to continue with their winning momentum. Australian captain Aaron Finch fell just short in his bid to make a hat-trick of hundreds but his knock of 90 set his sideâs victory as Australia made 266/6 before Pakistan were bowled out for just 186. Star of the third ODI, Pat Cummins who tore through the Pakistani batting order after being rested for the first two games, will be rested again for the remaining two games. Cummins will reportedly be sent home from Australiaâs ODI tour of the UAE early. Squads: Pakistan: Shan Masood, Abid Ali, Haris Sohail, Saad Ali, Umar Akmal, Imad Wasim (c), Mohammad Rizwan (wk), Yasir Shah, Usman Shinwari, Junaid Khan, Mohammad Abbas Australia: Aaron Finch (c), Usman Khawaja, Shaun Marsh, Peter Handscomb, Glenn Maxwell, Marcus Stoinis, Alex Carey (wk), Nathan Lyon, Adam Zampa, Kane Richardson, Jason Behrendorff ",https://www.newsone.tv/wp-content/uploads/2019/03/PakVsAus-1.jpg,Sports,['Skipper Aaron Finch was left unable to score big by Mohammad Hasnain as five wickets of Australia fall consecutively.'],negative
"Khawaja, Maxwell bring Australia a massive 327 in final ODI","DUBAI: Usman Khawaja and Glenn Maxwell bring Australia a massive total of 327 runs with seven wickets down against Pakistan as Aussies seek to whitewash Green Shirts at the Dubai International Stadium. Khawajaâs came two runs short to century while Maxwell scored 70 off 33 deliveries. Skipper Aaron Finch scored 53 while Shaun Marsh played an impressive 61 runs innings off 68 balls. Usman Shinwari remained the leading wicket taker of the day with 4 dismissals followed by Junaid Khan with 3 dismissals. Other Pakistani bowlers were unable to take wickets. Australia defeated Pakistan by 6 runs in the fourth one day international at the Dubai International Stadium as Nathan Coulter-Nile and Marcus Stoinis clinch the victory with 03 and 02 important wickets. Debutant Abid Ali made his maiden century with 112 off 119 balls, he was well âassisted by Mohammad Rizwan who scored his second ODI century. Kane Richardson, Nathan Lyon and Adam Zampa took one wicket each. Skipper Aaron Finch was left unable to score big by Mohammad Hasnain as five wickets of Australia fall consecutively. Finally, Glenn Maxwell and Alex Carey picked the momentum to score 98 and 55 respectively to bring the total to 277. Usman Khawaja contributed 62 runs in the total. Hasnain, Skipper Imad Wasim and Spinner Yasir Shah dismissed two batsmen each. The Shoaib Malik-led XI showed some improvements with the ball, however, it was their batting that let them down on Wednesday as they suffered a series defeat. On the bowling front, Mohammad Amirâs form has come under heavy scrutiny and he found himself out of the team for the second and third ODI. He will be hoping for a recall in the fourth ODI to solidify his place in the squad ahead of the World Cup in England and Wales. On the other hand, Australia who made it six consecutive ODI wins will be banking on their bowlers to continue with their winning momentum. Australian captain Aaron Finch fell just short in his bid to make a hat-trick of hundreds but his knock of 90 set his sideâs victory as Australia made 266/6 before Pakistan were bowled out for just 186. Star of the third ODI, Pat Cummins who tore through the Pakistani batting order after being rested for the first two games, will be rested again for the remaining two games. Cummins will reportedly be sent home from Australiaâs ODI tour of the UAE early. Squads: Pakistan: Shan Masood, Abid Ali, Haris Sohail, Saad Ali, Umar Akmal, Imad Wasim (c), Mohammad Rizwan (wk), Yasir Shah, Usman Shinwari, Junaid Khan, Mohammad Abbas Australia: Aaron Finch (c), Usman Khawaja, Shaun Marsh, Peter Handscomb, Glenn Maxwell, Marcus Stoinis, Alex Carey (wk), Nathan Lyon, Adam Zampa, Kane Richardson, Jason Behrendorff ",https://www.newsone.tv/wp-content/uploads/2019/03/PAKvAUS2.jpg,Sports,['Skipper Aaron Finch was left unable to score big by Mohammad Hasnain as five wickets of Australia fall consecutively.'],negative
