title,news,img-url,category,summery,opinion
âSimpsonsâ producer pulls episode featuring Michael Jackson,"An old episode of âThe Simpsonsâ featuring the voice of Michael Jackson is being pulled from all future broadcasts, the showâs producer told a newspaper, following a documentary about alleged child abuse by the late pop star. âIt feels clearly the only choice to make,â James L. Brooks was quoted as telling the Wall Street Journal. The long-running cartoon show featured Jackson in 1991, during its third series, in a episode called âStark Raving Dadâ. He voiced a character in a psychiatric ward who believed he was the pop star. Media representatives for âThe Simpsonsâ were not immediately available for further comment. In the documentary, âLeaving Neverlandâ, two adult men say they were befriended by Jackson and abused by him from the ages of 7 and 10 in the early 1990s. It prompted a mixture of horror and disbelief when it ran on U.S. cable channel HBO on Sunday and Monday. Some radio stations in Canada and the Netherlands stopped playing Jacksonâs music. Jacksonâs family called the documentary and news coverage of the accusations a âpublic lynchingâ and said he was â100 percent innocent.â His estate filed a lawsuit against HBO in February, saying the program breached an agreement that the cable channel would not disparage Jackson. The âThrillerâ singer, who died in 2009, was acquitted in 2005 of charges of molesting a 13-year-old boy, unrelated to the documentary, at his Neverland ranch in California. In 1994, he settled a sexual abuse lawsuit concerning another 13-year-old boy. Reuters. ",https://www.newsone.tv/wp-content/uploads/2019/03/Michael-Jackson-Simpsons.jpg,Entertainment,"['Ill be 40 in July and I still like to surf. Perhaps his best-known role was in the television action-adventure series Airwolf, which lasted for several seasons after launching in 1984.']",negative
"Actor Jan-Michael Vincent, known for âAirwolf,â dies at 73","Actor Jan-Michael Vincent, the âAirwolfâ television star whose sleek good looks belied a troubled personal life, has died. He was 73. A death certificate shows that Vincent died of cardiac arrest on Feb. 10, 2019, in an Asheville, North Carolina, hospital. The certificate signed by a doctor says he died of natural causes and no autopsy was performed. It wasnât clear why it took several weeks for news of the death to surface before it was first reported Friday by TMZ. Messages left at phone listings for Vincent and his wife werenât immediately returned Friday. Born in 1945 in Denver, Colorado, Vincent starred in such films as 1972â²s âThe Mechanicâ and 1978â²s âHooper,â in which he played a stuntman opposite Burt Reynolds. Off-screen, his handsomeness earned him a spot on a cosmetic surgeonâs âTen Best Nosesâ list in the late 1970s. He also starred in the 1983 television mini-series âWinds of Warâ as the love interest of a character played by Ali MacGraw, âpiling up enormous ratings,â according to a contemporary Associated Press account. He earned a Golden Globe nomination. In a 1984 AP interview, Vincent described his passion for being on the water. He said he spent three months after wrapping up âWinds of Warâ sailing the Caribbean. He also said he was a longtime surfer. âI was a traveling surfer for years. â¦ Iâve been all over the world surfing,â he said. âIâll be 40 in July and I still like to surf.â Perhaps his best-known role was in the television action-adventure series âAirwolf,â which lasted for several seasons after launching in 1984. Vincent played pilot Stringfellow Hawke, a rugged pilot who could pull off aerobatic crime-fighting maneuvers in an advanced helicopter â but also play the cello. In the AP interview, he described trying to find the right way to loosen the character up. âThe character is stiff,â he says, âbut as weâve gone along weâve been able to loosen him some. Now youâll sometimes see him crack a smile and say something funny. Even Clint Eastwood is mellowing, although Iâll never be Burt Reynolds.â However, his surfer-like demeanor was overshadowed at times by his troubled personal life. He pleaded guilty in 1997 to a drunken driving accident that left him with a broken neck and was sentenced to a rehab program. He was also charged in 1980s barroom brawls, receiving probation in one and an acquittal in another. In a separate case, he was acquitted in 1986 of hitting a woman. He was sentenced to 60 days in jail in 2000 in Orange County, California, after he admitted to violating his probation by appearing drunk in public and assaulting his then-girlfriend. AP. ",https://www.newsone.tv/wp-content/uploads/2019/03/Jan-Michael-Vincent.jpg,Entertainment,"['They said in a statement that the Nobel Prize winning novelist, who died in 2014, had been reluctant to sell the rights to the books for years because he believed that it could not be made under the time constraints of a feature film, or that producing it in a language other than Spanish would not do it justice. However, given what has been called a new golden age of television and the acceptance by worldwide audiences of programs in foreign languages, the time could not be better to bring an adaptation to the extraordinary global viewership that Netflix provides. The announcement follows Netflixs acclaimed black and white Mexican movieRoma, filmed in Spanish and indigenous Mixtec, which won three Oscars last month.']",neutral
âOne Hundred Years of Solitudeâ coming to Netflix,"LOS ANGELES: The groundbreaking novelOne Hundred Years of Solitudeby Gabriel Garcia Marquez is coming to the screen for the first time in a Spanish language series for Netflix, the streaming service said on Wednesday. The multi-generational family tale, published in 1967, is widely considered one of the most influential novels of the 20th century and an early example of the magical realism style embraced by other Latin American authors. Garcia Marquezâs two sons will serve as executive producers on the television series, which will be filmed mainly in the authorâs native Colombia. They said in a statement that the Nobel Prize winning novelist, who died in 2014, had been reluctant to sell the rights to the books for years âbecause he believed that it could not be made under the time constraints of a feature film, or that producing it in a language other than Spanish would not do it justice.â However, given what has been called a new golden age of television âand the acceptance by worldwide audiences of programs in foreign languages, the time could not be better to bring an adaptation to the extraordinary global viewership that Netflix provides.â The announcement follows Netflixâs acclaimed black and white Mexican movieRoma, filmed in Spanish and indigenous Mixtec, which won three Oscars last month. Netflix in February announced it was expanding its presence in Mexico, opening an office in Mexico City and furthering its development of movie and television projects in Spanish. Reuters. ",https://www.newsone.tv/wp-content/uploads/2019/03/Marquez.jpg,Entertainment,"['Im looking forward to seeing this one. The teaser also offers glimpses of other major characters on the show, including Jon Snow and Daenerys Targaryen preparing battle at the Starks stronghold.']",positive
Winter is upon us: âGame of Thronesâ season 8 trailer out now,"After what seemed like an eternity, HBO finally dropped the trailer for the eighth and final season ofGame of Throneson Monday night, and boy oh boy it was worth the wait. Released with a simple message on their Twitter account, âthe trailer is here,â the two-minute trailer opens with Arya Stark breathing heavy in darkness, speaking of the oncoming threat from the White Walkers and the army of the dead. âI know death. Heâs got many faces,â Arya says. âIâm looking forward to seeing this one.â The teaser also offers glimpses of other major characters on the show, including Jon Snow and Daenerys Targaryen preparing battle at the Starkâs stronghold. The trailer shows Jon brooding and talking about âour enemy,â while Sansa Stark acts steely and determined. Tyrion Lannister looks stressed and concerned, while his sister Cersei drinks wine and schemes. Also, Tormund is alive!  Not only is Tormund around to battle the White Walkers, but Gendry is back with his hammer. The seventh season of Game of Thrones ended with the revelation that the White Walkers now have their own dragon, which is sure to wreak havoc on the people of Winterfell. Itâs a fight that Jon tried to warn Cersei about during last season, but she made it abundantly clear that she wasnât interested in helping him defend the kingdom if he wasnât ready to bow down to her as Queen.  Game of Thrones season eight returns on April 14. Check out the trailer below.   ",https://www.newsone.tv/wp-content/uploads/2018/12/GoT.jpg,Entertainment,['Web Desk:Federal Minister for Information Fawad Chuadhry on Tuesday announced that the Cinema Exhibitors Association has decided to boycott Indian content in Pakistan.'],positive
"Pakistan bans Indian movies, other content amid rising tensions",Web Desk:Federal Minister for Information Fawad Chuadhry on Tuesday announced that the Cinema Exhibitors Association has decided to boycott Indian content in Pakistan.  Fawad also said that he has instructed the Pakistan Electronic Media Regulatory Association (Pemra) to act against advertisements made in India. Earlier addressing a press conference Director General Inter-Services Public Relations (DG ISPR) Major General Asif Ghafoor rejected the Indian claims of being present inside the Pakistani airspace for 21 minutes during their Line of Control (LoC) breach today. ,https://www.newsone.tv/wp-content/uploads/2019/02/Cinema.jpg,Entertainment,['Top acting honours were shared among four different films.'],neutral
Oscar winners 2019: The complete list,"Here are the winners in key categories at the 91st Academy Awards, which were handed out on Sunday in Hollywood. âGreen Bookâ took home the best picture Oscar, while Alfonso CuaronÂ´s âRomaâ won for best director, best foreign film and best cinematography. Top acting honours were shared among four different films. Best picture: âGreen Bookâ Best director: Alfonso Cuaron, âRomaâ Best actor: Rami Malek, âBohemian Rhapsodyâ Best actress: Olivia Colman, âThe Favouriteâ Best supporting actor: Mahershala Ali, âGreen Bookâ Best supporting actress: Regina King, âIf Beale Street Could Talkâ Best foreign language film: âRomaâ (Mexico) Best cinematography: Alfonso Cuaron, âRomaâ Best animated feature: âSpider-Man: Into the Spider-Verseâ Best documentary feature: âFree Soloâ Best original screenplay: âGreen Bookâ â Nick Vallelonga, Brian Currie and Peter Farrelly Best adapted screenplay: âBlacKkKlansmanâ â Spike Lee, Charlie Wachtel, David Rabinowitz and Kevin Willmott Best original score: âBlack Pantherâ â Ludwig Goransson Best original song: âShallowâ from âA Star Is Born,â Lady Gaga. Agencies ",https://www.newsone.tv/wp-content/uploads/2019/02/oscars.jpg,Entertainment,"['With eight best picture nominees, every film has passionate supporters, but no film has a consensus, Tim Gray, awards editor for showbiz trade publicationVariety, told AFP.']",positive
Oscars night is here! Hollywood ready for glitzy gala,"Hollywoodâs A-listers will hit the red carpet Sunday for the Oscars â the climax of a long, eventful awards season that could yield some big surprises. Alfonso Cuaronâs black-and-white cinematic ode to his childhood,Roma, leads with 10 nominations and is a firm favorite for the coveted best picture Academy Award. If it does win, it will be the first foreign-language film, and the first from streaming giant Netflix, to earn the honor. But civil rights dramedyGreen Bookhas overcome controversy to remain on the radar, and could benefit from the Academyâs complex preferential voting system to snatch the top prize. Hot on their heels are a variety of films, from offbeat royal rompThe Favourite(also with 10 nominations), to Spike Leeâs race dramaBlacKkKlansman, to crowd pleasers like superhero flickBlack Pantherand musical romanceA Star Is Born. Two biopics âViceabout former US vice president Dick Cheney andBohemian Rhapsodyabout the band Queenâ round out the list of contenders for best picture. The 7,900-odd voting members of the Academy of Motion Picture Arts and Sciences had bold choices in front of themâ traditional art-house Oscar bait, and big, rousing blockbusters. âWith eight best picture nominees, every film has passionate supporters, but no film has a consensus,â Tim Gray, awards editor for showbiz trade publicationVariety, told AFP. All will be revealed at the Dolby Theatre, in a ceremony beamed around the world to millions of showbiz fans, with a twistâ there will be no host for the first time in three decades. The Academy opted to take the risk after comedian Kevin Hart withdrew from the gig in the face of a firestorm over past controversial tweets that were slammed as homophobic. âThey still donât have an answer to a question thatâs been around since the first TV showing in 1953: is this a presentation of every category, or is it entertainment?â Gray said. âThey want it to be both.â The entertainment factor will be high when Queen opens the show with singer Adam Lambert fronting the iconic band. Will Glenn Close finally win? For top acting honors, Christian Baleâs transformation into Cheney forVicegave him the early lead in the Oscars race, and several statuettes. But Rami Malek won respect from his peersâ and a Golden Globe, Bafta and a Screen Actors Guild awardâ for his spellbinding turn as late Queen frontman Freddie Mercury. âIn Christian Baleâs, I see an incredible actorly thing, but with Rami Malek, you see a role that just really connected with audiences,â saidVarietyâschief film critic Peter Debruge. âI wouldnât be surprised if the newcomer disrupts in this case.â The best actress race has a clear favorite: Glenn Close, who has swept the prizes for her gripping work inThe Wifeas a woman on the edge when her author husband wins the Nobel Prize in Literature. Lady Gaga wowed fans and critics with her turn inA Star is Born, and Yalitza Aparicioâs nomination for her first acting role inRomaearned praise. But it looks to be Closeâs night. âIt is not her strongest role, but it is an opportunity for her to really own a small film, to carry it on her shoulders, and to remind the industry that here is one of our real treasures as an actress,â Debruge said. ",https://www.newsone.tv/wp-content/uploads/2019/01/Oscars.png,Entertainment,"['Meera alleged, The bank and my domestic helper were involved in stealing money from my account. The actor further said that she registered a case in the Defence police station but no action has been taken as yet.']",positive
"Meera alleges domestic help of robbery, claims bank and servant are in collusion","LAHORE:Actor Meera on Friday claimed her domestic helper stole jewellery and cash from her. âMy domestic helper, Muhammad Asghar, stole money from my bag and jewellery from my house and fled,â Meera said. âMy helper had my [debit] card and its code and withdrew Rs400,000 from the ATM,â she added. âI did not receive any message from the bank regarding withdrawal of cash,â she continued. Meera alleged, âThe bank and my domestic helper were involved in stealing money from my account.â The actor further said that she registered a case in the Defence police station but no action has been taken as yet. âI submitted a written complaint in the bank but no headway has been made.â ",https://www.newsone.tv/wp-content/uploads/2018/05/Meera.jpg,Entertainment,"['Many in the fraternity rolled their eyes on the tweet when Zoheb said that he will sue the producers for doing so, one claimed, first they want their work featured on a grand stage and when it is featured they make hue and cry over these negligible details of semantics and permissions. I was livid reading this response, I know by personal experiences and friendships with a few people close to and working in the industry how tough it is to make a living in a country like Pakistan where piracy has always been rampant, the situation on-ground making it impossible for live events to happen for the longest time depriving artists and performers to make a living, then came the highly touted multinational brands with mega corporate deals and bags of promises assuring the artist a hefty repay on their art which they are entitled to and have deserved all along in the first place.']",negative
Respect your arts and artists,"Something shouldâve been said a while ago but there is no better time than now and there is no better place than here. Why are we so persistent with belittling and putting down people who become artists in this country, why do we take them for granted? Why are the arts looked down upon and the people who partake in what I understand to be one of the most noble acts on earth are treated as outsiders and black sheepâs? Why is the âIndustryâ so reluctant in owning up to and standing up for their due rights? Or, Why is the âindustryâ hell bent on destroying whatever they had or have? When will the âKill your darlingsâ mentality of this desensitized nation which has been raised believing that Bollywood and India are the be all and end all to what is known and revered as art in the subcontinent? When will our own icons and legends be given the hard earned and much deserved respect in their own homeland? Why is this so difficult a task? I can rant on this for hours, the downfall of the POP juggernaut which was the Pakistan music scene in the 80âs â 90âs and early 2000âs and why and what happened and how us the nation of Pakistan and the artists themselves played a part in killing the âmagicâ. To sum up the collective human psyche and more importantly to accurately encompass the Pakistani mentality towards arts, a Fyodor Dostoevsky quote comes to mind. âMen reject their prophets and slay them, but they love their martyrs and honor those that they have slain.â But, this is not about arts, itâs about respect. How dare people take people who have been entertaining and performing for decades in this country taken for granted for this long? Why are we so thick skinned when it comes to doing things by the book, when will this moral corruption and degeneration cease? Not too soon it seems, What is fast becoming Pakistanâs crown jewel with regards to optics and portrayal of the country as a peace loving and harmonious state, the Pakistan Super League has played a pivotal role. All my respects and praise for the monumental efforts that made the PSL a monumental smash success and I pray that the trend continues for as long as can be but the opening ceremony left a very unsavory taste in the mouth when a remix of an old and ever popular tune made famous by the legendary pop-duo of Nazia and Zoheb Hassan hit the speakers and shortly after the ceremony, Zoheb Hassan rightly tweeted out how his intellectual property was taken (stolen) without his prior consent by the event and itâs producers. 
Many in the fraternity rolled their eyes on the tweet when Zoheb said that he will sue the producers for doing so, one claimed, âfirst they want their work featured on a grand stage and when it is featured they make hue and cry over these negligible details of semantics and permissions.â I was livid reading this response, I know by personal experiences and friendships with a few people close to and working in the industry how tough it is to make a living in a country like Pakistan where piracy has always been rampant, the situation on-ground making it impossible for live events to happen for the longest time depriving artists and performers to make a living, then came the highly touted multinational brands with mega corporate deals and bags of promises assuring the artist a hefty repay on their art which they are entitled to and have deserved all along in the first place. They were promised royalties, and big paychecks but what an artist has always ever been demanding is common human decency. It is criminal to ask an artist to do something for free by baiting him with words like exposure and outreach, the artists themselves must also stand up against such nefarious and thankless people and activities. Everyone has mouths to feed and bills to pay and even if the artist is financially secure even then it is criminal under law to use something which is their intellectual property without permission. This needs to be sorted for good. Another song taken but falling short of following lawful procedure has been from a famous reality tv/music show and people involved in making of the original have expressed their displeasure.  People need to get their act together, give people their due right and stop this exploitation and careless attitude. Even if the country has gone to the dogâs and law abidance have been reduced to a mockery, one must not lose common human decency. ",https://www.newsone.tv/wp-content/uploads/2019/02/PSL-1.jpg,Entertainment,"['LOS ANGELES: British rock band Queen will perform live at Sundays Oscars ceremony, organizers said on Monday, following the blockbuster success of best picture nomineeBohemian Rhapsody.']",positive
Facebook launches WhatsApp Business for iPhones,"Facebook Inc on Thursday launched a business version of its WhatsApp messaging app for Apple Incâs iOS, more than a year after the service was rolled out for Android users. WhatsApp Business will be available for free downloads from the App Store in Brazil, Germany, Indonesia, India, Mexico, the UK and the United States starting Thursday and will be rolled out around the world in the coming weeks, WhatsApp said here in a blog post. The app, which allows small businesses to communicate with customers through the platform, currently has over 5 million users. As part of its move to make money from WhatsApp, the company had said in August that it would start charging businesses for sending marketing and customer service messages at a fixed rate for confirmed delivery, ranging from 0.5 cents to 9 cents per message depending on the country. Facebook has encouraged messaging conversations between businesses and consumers since at least 2016 but has not disclosed its revenue from the efforts. Chief Executive Officer Mark Zuckerberg has increasingly shifted the companyâs focus to messaging and private chats and last month said Facebook would encrypt conversations on more of its messaging services, while making them compatible across platforms. Facebook is one of the biggest global players in private messaging, with its WhatsApp, Messenger and Instagram services, each having more than 1 billion users. However, only WhatsApp currently encrypts conversations. REUTERS. ",https://www.newsone.tv/wp-content/uploads/2016/08/Facebook-WhatsApp.jpg,Technology ,"['The new news feed feature will show users the data that connect them to a particular type of post, Hegeman said, for example that they are friends with the poster and theyve liked their posts more than others, theyve frequently commented on that type of post before, or that the post is popular with users with the same interests.']",positive
