title,news,img-url,category,summery,opinion
PM Imran meets COAS,"ISLAMABAD: Prime Minister Imran Khan on Tuesday met Army Chief General Qamar Javed Bajwa at the Prime Minister Office (PMO). PM Khan and the Chief of Army Staff (COAS) exchanged viewpoints on national security. Earlier today, COAS met with Oman Air Commander Air-Vice Marshall Matar Bin Ali Bin Matar Al Obaidani at the General Headquarters. According to the Inter-Services Public Relations (ISPR), Chief of Army Staff (COAS) and the Air-Vice Marshall discussed mutual professional interests. ISPR said Air-Vice Marshall praised Pakistan Armyâs efforts for maintaining regional peace and stability. ",https://www.newsone.tv/wp-content/uploads/2019/04/PM-Imran-and-Qamar-Bajwa.jpg,Pakistan,"['ISLAMABAD: On Wednesday, Prime Minister Imran Khan has said Pakistan offers best tourism attractions in the world ranging from beach, mountain, and desert tourism.']",neutral
PM Imran meets COAS,"ISLAMABAD: Prime Minister Imran Khan on Tuesday met Army Chief General Qamar Javed Bajwa at the Prime Minister Office (PMO). PM Khan and the Chief of Army Staff (COAS) exchanged viewpoints on national security. Earlier today, COAS met with Oman Air Commander Air-Vice Marshall Matar Bin Ali Bin Matar Al Obaidani at the General Headquarters. According to the Inter-Services Public Relations (ISPR), Chief of Army Staff (COAS) and the Air-Vice Marshall discussed mutual professional interests. ISPR said Air-Vice Marshall praised Pakistan Armyâs efforts for maintaining regional peace and stability. ",https://www.newsone.tv/wp-content/uploads/2019/04/PM-Imran-and-Qamar-Bajwa.jpg,Pakistan,"['ISLAMABAD: On Wednesday, Prime Minister Imran Khan has said Pakistan offers best tourism attractions in the world ranging from beach, mountain, and desert tourism.']",positive
Will not let Pakistan become one unit country: Bilawal,"GARHI KHUDA BAKSH: Pakistan Peopleâs Party (PPP) Chairperson Bilawal Bhutto Zardari said on Thursday will not let Pakistan became one unit country and still stood by Shaheed Zulfiqar Ali Bhuttoâs ideology which remains unchanged. Speaking to a gathering commemorating former President Shaheed Zulfiqar Ali Bhuttoâs 40th death anniversary at Garhi Khuda Bakhsh, Bilawal said April 4 marks a painful chapter of history as creator of the constitution was murdered on this day 40 years ago. Bilawal said SZAB was punished for strengthening countryâs defence and the revolution that came during SZABâs rule is our heritage. âDo not disturb 18th amendment or else will kick the government out,â said Bilwal, âif try to attack constitution you will end up like dictators. Recognize their faces they are enemy of your rights,â said Bilawal, taking jibe at the Pakistan Tehreek-e-Insaf (PTI) government and the Prime Minister Imran Khan. Bilawal said those who do not learn from history, history teaches them a lesson. He said those dramatizing New Pakistan should understand the basics of old Pakistan first. âThe selected Prime Minister wanted to destroy constitution of SZAB,â Bilawal said. Bilawal said in benami accounts case there are only false claims and tales. Bilawal said cannot be scared by the tactics of National Accountability Bureau (NAB). âThis is not accountability, its only character assassination and political revenge,â said Bilawal, âwe know they want resources of Sindh, not the province.â Bilawal said will continue struggle against all conspiracies and promised to never let down the public. Addressing the gathering, PPP Co-Chairperson Asif Ali Zardari said SZABâs demise seems like yesterday and people from distant places used to come to listen to his speeches. Zardari said at first doubted that the government wanted to eliminate 18th amendment and for the same reason cases have been filed against him. He said current rulers have no sympathy for the poor people and they will take Pakistan 100 years back. Zardari vowed to soon announce initiation of the government kick-out campaign, saying now itâs time to head to Islamabad and eradicate the government, adding that cannot give the government any more time as it is ruining the country. Addressing the gathering, Sindh Chief Minister Murad Ali said Shaheed Zulfiqar Ali Bhutto gave constitution to this nation and his principles and ideologies are still alive. CM said Bilawal and Asif Zardari will bring Shaheed Benazir Bhuttoâs mission forward and Sindh, as a province can serve the whole country. CM said the government is unqualified and wanted to take away Sindh hospitals by compulsion. ",https://www.newsone.tv/wp-content/uploads/2019/04/Bilawal-Bhutto.jpg,Pakistan,"['However, an official of the PR associated with the Train Examination Department in Sukkur said that train operations to will only normalise in 48 to 72 hours.']",positive
PM Imran lays foundation of Federal Urdu University Hyderabad from Islamabad,"ISLAMABAD: Prime Minister Imran Khan on Thursday laid foundation stone of Federal Urdu University in Hyderabad. Invitation cards were distributed to the members of Pakistan Tehreek-e-Insaf (PTI) and Muttahida Qaumi Movement-Pakistanâs (MQM-P) Karachi leadership. Addressing the ceremony, PM Khan said he is glad to lay foundation of the university and no nation can progress without education. PM said investing on people is key to nationâs prosperity. PM said real protection of nation and country is possible only with help of education and only by giving education to the youth, who comprise of 60% of the population, Pakistan will rise to the top. PM said paying special attention to justice and education sectors and announced to establish Al Qadir University in Suhawoh, Jehlum which will research on science and Sufism. PM said by the grace of God MQM-P and PTI will contest in elections together as ideologies of both parties are alike. The project will be completed within 3 years with estimated cost of over two billion rupees. ",https://www.newsone.tv/wp-content/uploads/2019/03/pm-imran-3.png,Pakistan,"['KARACHI: On Wednesday, the Sindh High Court (SHC) upheld acquittal of eight accused in a case pertaining to laundering of billions of dollars.']",neutral
"NAB handcuffing suspects un-Islamic, rules CII","ISLAMABAD: On Thursday, the Council of Islamic Ideology (CII) declared National Accountability Bureauâs handcuffing of suspects against Shariah and the law. CII chief Qibla Ayaz said insulting a suspect in the media before conviction is against Islam and human dignity. He said a committee to analyzse the NAB ordinance has been formed under the supervision of Justice (retd) Raza Khan. âThe committee would review as to which NAB laws are in violation of the Islamic law,â Ayaz said.  ",https://www.newsone.tv/wp-content/uploads/2019/04/cii.png,Pakistan,['Army Staff (COAS) General Qamar Javed Bajwa gave the approval at an army promotion board meeting held at GHQ.'],positive
Zardariâs alleged Apartment Case: IHC Chief Justice says political cases to be taken to parliament,"ISLAMABAD: On Thursday, the Islamabad High Court (IHC)  issued a pre-admission notice to former president and Pakistan Peoples Party (PPP) President Asif Ali Zardari in a disqualification reference.  IHC Chief Justice Athar Minallah while hearing a petition filed by Pakistan Tehreek-e-Insaaf (PTI) leaders Usman Dar and Khurram Sher Zaman seeking Zardariâs disqualification, remarked that these kinds of matters should be taken to the Parliament which is a proper forum for these kinds of pleas. âThere are 18,000 cases pending in the court. Political fights should be fought in the Parliament,â he said. The court then deferred the hearing and issued a pre-admission notice and sought a reply from Zardari within two weeks. On January 21, PTIâs Zaman had filed a reference seeking the disqualification of the former president for allegedly concealing his New York apartment in his tax returns. The PTI leaders in the petition had stated that Zardari is not Sadiq or Ameen as he did not disclose his assets and should be disqualified under Article 62(1)(f). ",https://www.newsone.tv/wp-content/uploads/2016/07/IHC.jpg,Pakistan,['The Foreign Office further said such test should be a matter of grave concern for the international community not only in terms of generation of space debris but also because of its ramifications for long term sustainability of peaceful space activities.'],positive
PM Imran makes into 9th popular leader list on Twitter,"One more achievement for Prime Minister Imran Khan as he emerged on the ninth spot for the most popular world leader with over 9.4 million followers on micro-blogging website Twitter. US President Donald Trump is the most popular with 59.5 million followers followed by Indian premier Narendra Modi and Pope Francis, according to the Spectator Index  Turkish President Recep Erdogan is on fourth position with 13.6 followers followed by Indian External Affairs Minister Sushma Swaraj, Indonesian President Joko Widodo and Jordanâs Queen Rania. The Crown Prince of Dubai, Sheikh Hamdan bin Mohammed bin Rashid Al Maktoum, precedes Imran Khan on eight position. Saudi Arabiaâs Crown Prince Mohammed bin Salman follows the premier on the list which ranks British Prime Minister Theresa May and French President Emmanuel Macron on 11th and 12th positions respectively. ",https://www.newsone.tv/wp-content/uploads/2019/04/pm-imran.png,Pakistan,"['The adoption of the resolution today is a strong manifestation of our shared commitment to stand united against racial and religious hatred. By the terms of Tuesdays resolution, titled Combating terrorism and other acts of violence based on religion or belief, the assembly condemned in the strongest terms the heinous, cowardly terrorist attack aimed at Muslim praying in two mosques in Christchurch, and expressed its deepest condolences to the families of the victims and to the government and the people of New Zealand.']",positive
COAS meets Oman Air Commander,"RAWALPINDI: Army Chief General Qamar Javed Bajwa on Thursday met with Oman Air Commander Air-Vice Marshall Matar Bin Ali Bin Matar Al Obaidani at the General Headquarters. According to the Inter-Services Public Relations (ISPR), Chief of Army Staff (COAS) and the Air-Vice Marshall discussed mutual professional interests. ISPR said Air-Vice Marshall praised Pakistan Armyâs efforts for maintaining regional peace and stability. ",https://www.newsone.tv/wp-content/uploads/2019/04/COAS.jpg,Pakistan,"['According to the Inter-Services Public Relations (ISPR), India on Tuesday resorted to unprovoked firing at Rakh Chakri area of the Rawalkot sector due to which three Pakistani soldiers embraced martyrdom and one was injured.']",positive
"Mega Money Laundering Case: Accountability Court fixes hearing, summons suspects on April 19th","ISLAMABAD: On Thursday,  an accountability court on Thursday fixed for hearing the first National Accountability Bureau (NAB) reference pertaining to the fake bank accounts and mega money laundering case. Accountability court Judge Muhammad Bashir has issued summons to all suspects, including former Karachi administrator Muhammad Hussain Syed, and directed them to appear on April 19. Former president Asif Ali Zardariâs close aide Younas Kudwavi, four former and four current employees of the Karachi Metropolitan Corporation (KMC) are among those summoned. NAB executive board approves first reference in fake accounts case NAB Chairman Justice (retd) Javed Iqbal chaired the executive board meeting which granted approval for the filing of six corruption references, including one pertaining to the fake bank account case. Money laundering case
The Federal Investigation Agency (FIA) was investing 32 people, including former president Asif Ali Zardari, his sister Faryal Talpur, Omni Group chairman Anwar Majeed, in relation to money laundering through fictitious bank accounts. Zardariâs close aide Hussain Lawai was arrested in July last year in connection with the probe. The former presidentâs other close aide and Omni Group chairman Anwar Majeed and his son, Abdul Ghani, were arrested by FIA in August 2018. The Supreme Court in September 2018 had taken notice and constituted a joint investigation team to probe the matter. The JIT had filed its report and also recommended a directive for NAB to conduct a thorough inquiry. ",https://www.newsone.tv/wp-content/uploads/2019/04/h-12.png,Pakistan,"['In a telephonic conversation with his American counterpart Mike Pompeo, two-way relationship and continuing facilitation of Pakistan for Afghan peace process were highlighted by FM Qureshi who said intra-Afghan dialogues were vital aspect of the reconciliation procedure.']",negative
Joint Collaboration: Pakistan Navy confiscates around 1000kg of hashish near Ormara,"Pakistan Navy has confiscated around 1000kg of hashish worth over 2.5 billion rupees near Ormara in the open sea. The operation was conducted in collaboration with anti-narcotics force, according to Pakistanâs Army.  The seized contraband has been handed over to anti-narcotics force.   ",https://www.newsone.tv/wp-content/uploads/2019/04/hashish.png,Pakistan,"['Presiding 220th Core Commander Conference at the General Headquarters, the Chief of Army Staff (COAS) said the nation is moving forward on the path of progress after eliminating terrorism and fruits of social and economical progress are now evident.']",positive
Asad Umar fears Country may face bankruptcy owing to increase of basic debts,"ISLAMABAD: On Wednesday, Asad Umarâ the finance minister apprised that basic debts have reached alarmingly on such a high level that the country is near bankruptcy. Speaking in a special question and answer session on social media, he said:  âYou are going to the IMF with these massive debts in toe for a bailout. We have had to fill the big gap,â adding, âif you look at the numbers from PMLN time, there was double-digit inflation during PMLN time which we have thankfully not hit as yet.â The finance minister claimed that unlike in the past, the inflation has not hit double-digit. âIf you look at the past, inflation affected all stratas of society equally. In fact the poor had higher levels of inflation affecting them. In our tenure this has seen a different trend with the poor feeling relatively less inflation as compared to higher income groups,â he claimed. Umar admitted that the economy has slowed down which has resulted in low employment rate. âYouâre saying all my policies are like Ishaq Dar, Ishaq dar says Iâve destroyed the economy! During his time, for the first time in Pakistanâs history our exports didnât grow,â he said, âDollar has climbed because of past economic policies that have led to such huge losses for us as a country. âItâs a basic demand and supply situation.â ",https://www.newsone.tv/wp-content/uploads/2019/04/Asad-Umar.jpg,Pakistan,"['Addressing a press conference after the cabinet meeting, the Info Minister said, we saw the attitude that [India] maintained against Pakistani citizens, actors, artists and cricketers. Referencing to the wearing of military caps by the Indian players prior to a recent match against Australia, he said that act was the limit for Pakistan.']",positive
Pakistan offers best tourism attractions in world: PM Imran,"ISLAMABAD: On Wednesday, Prime Minister Imran Khan has said Pakistan offers best tourism attractions in the world ranging from beach, mountain, and desert tourism. Addressing a tourism summit in Islamabad this evening, he said Pakistan has virgin coastal belt in Balochistan, but it is unfortunate that our elite prefers to visit Europe and western countries instead of exploring our own tourist spots. The Prime Minister said Allah has bestowed us with diverse kind of mountain scenery from Suleman, Karakoram and Himalaya heights. He said these mountain ranges have their own diverse features abundant with great vegetation, wildlife and bird life, which have no match in any part of the world. Imran Khan said Gilgit-Baltistan had immense potential for tourism and with the improved law and order there a large number of people have visited the area. He said there are dozens of beautiful areas in Pakistan like Nathia Galli, but they need to be developed. Imran Khan said Pakistani tourists need to be given awareness about the scenic beauty of the country. ",https://www.newsone.tv/wp-content/uploads/2019/04/pm-imran-khan.png,Pakistan,"['Bilawal took to Twitter and said, The federal government keeps showing record low tax collection and Prime Minister Imran Khan blames 18th amendment for federal government money problems. Sindh is the only government preforming on expanding tax base.']",negative
Derailment of bogies near Rahim Yar Khan: Trains continue to face countrywide delays,"In a bizarre situation for Pakistan Railway, all trains travelling between Karachi, Lahore, Rawalpindi, Islamabad, Peshawar and Quetta continue to face delays for another 48 to 72 hours due to repair work on 1,525 feet of train track. The repair was necessitated after 13 bogies of the PKA-34 freight train were derailed near Rahim Yar Khan on Monday night. The derailment of the freight train not only caused millions of rupees in losses to Pakistan Railways (PR), it also hit its train operations badly. According to a spokesperson for PRâs headquarters, train operations were fully restored on Tuesday after the field teams cleared both sides of the track in afternoon. However, an official of the PR associated with the Train Examination Department in Sukkur said that train operations to will only normalise in 48 to 72 hours. The official further said that two rescue cranes from Rohri and Samasata reached the site of the disruption on Monday night and relief operations were started at 9.30 pm. The relief operation â including laying of new track â was completed on Tuesday at 10pm. As a result of the incident, Pakistan Railways (PR) authorities have suspended three officials. Qasim Zahoor, the deputy divisional superintendent for Sukkur, has been suspended over unauthorised absence from his job since last Friday and the inefficiency shown by his team while conducting relief operations. Sohail Zia, the permanent way inspector in Khanpur, and Amjad Shahzad, the head train examiner in Khanewal, have both been suspended for negligence. ",https://www.newsone.tv/wp-content/uploads/2019/04/h-9.png,Pakistan,"['The appointments should have been made within 45 days of their retirements from Sindh and Balochistan according to Article 215 (4) inserted in the Constitution through the 22nd Amendment that reads, Vacancy in the office of the commissioner or a member shall be filled within 45 days. PM Khan and Sharif were required to recommend three names for representation of each province in the ECP.']",negative
Khanani and Kalia: SHC upheld acquittal of eight accused in famous money laundering case,"KARACHI: On Wednesday, the Sindh High Court (SHC) upheld acquittal of eight accused in a case pertaining to laundering of billions of dollars. A two-judge bench gave this verdict on an appeal by the Federal Investigation Agency against the acquittal of the accused in the Khanani and Kalia money laundering case by a banking court in 2011. A special banking court in 2011 had exonerated four currency changers and as many bank officials from all charges of opening fake bank accounts for the purpose of money laundering. The accused currency dealers, Abdul Munaf Kalia, his brother Hanif Kalia, and Javed Khanani, had been accused of opening fake bank accounts with the help of bankers â Masood Abbas, Syed Wajahat Ali, Tasleem Ahmed and Arif-ur-Rehman. They allegedly used the bank accounts for unlawful transfer of billions of dollars abroad. Judge Mir Mohammad Sheikh of the Special Banking Court had ruled that the prosecution failed to provide evidence to prove its case against the accused persons beyond shadow of doubt. The seven accused were out on bail while suspect Javed Khanani had allegedly committed suicide. ",https://www.newsone.tv/wp-content/uploads/2019/04/h-7.png,Pakistan,"['All suspects named in the references are considered to be close aides of Zardari, however, the former president himself has not been name as a direct suspect in the references. A NAB executive board meeting is currently being chaired by the chairman of the accountability board, Justice (retd) Javed Iqbal, and a decision on whether to file the references in the accountability court is expected to be taken.']",positive
40 Pakistanâs Army brigadiers promoted to major-general: ISPR,"RAWALPINDI: According to Inter Service Public Relations (ISPR), on Wednesday 40 brigadiers of the Pakistan Army were promoted to the rank of major general.
 Army Staff (COAS) General Qamar Javed Bajwa gave the approval at an army promotion board meeting held at GHQ. Those promoted to the rank of major general include 11 brigadiers from the Pakistan Army Medical Corps. According to ISPR, the promoted officers include Zafar Iqbal Marwat, Shakirullah Khattak, Muhammad Owais Dastagir, Aamir Naveed, Muhammad Ijaz Mirza, Tabassum Habib, Muhammad Shujah Anwar, Dilawal Khan, Sarfaraz Ahmed, Asif Mehmoof Goraya, Kamal Asfar, Muhammad Ali Khan, Kashif Azad, Majid Jahangir, Azahr Waqas, Akif Iqbal, Omer Ahmed Bukhari, Muhammad Ahsan Khattak, Inayat Hussain, Adil Yamin, Muhammad Hasan Khattak, Muhammad Aamir Najam, Muahamma Aqeel, Kamran Satti, Syed Imdad Hussain Shah, Kashif Zafar, Khurram Anwar Qadri, and Ahmed Sharif Chaudhry. The medical corps officers promoted include Muhammad Aleem, Ahsan Altaf, Syed Nusrat Raza, Kamarat Hussain Shah Bukhari, Farooq Syed, Kudratullah Malik, Amir Akram, Shahid Hameed Chaudhry, Muhammad Qasim Butt, Farhan Tayab and Muhammad Afsheen Iqbal.     ",https://www.newsone.tv/wp-content/uploads/2019/04/ISPR.jpg,Pakistan,"['An additional district and sessions court in Lahore on March 20 had sentenced Czech model Tereza Hluskova to eight years and eight months in jail and fined her Rs113,000 after she was arrested last year on charges of carrying eight and a half kilogrammes of heroin from Lahores Allama Iqbal International Airport.']",neutral
Concerned over Indiaâs satellite destruction: FO,"ISLAMABAD: In a a statement by the foreign office, Pakistan has expressed deep concern after India shot down a low-orbiting satellite in a missile test last week in its bid to prove it was among the worldâs advanced space powers.  âPakistan has noted with deep concern the assessment of relevant organisations and international experts on the threats resulting from space debris generated by the recently conducted Anti-Satellite weapon (ASAT) test by India,â the statement expressed. âThe reports that some of the space debris created by this test has been pushed above the apogee of the International Space Station (ISS) increasing the risk of collision are deeply worrying,â it added. The Foreign Office further said such test should be a matter of grave concern for the international community not only in terms of generation of space debris but also because of its ramifications for long term sustainability of peaceful space activities. âIt would also be amiss to ignore the military dimension of such actions and its implications on the global and regional peace, stability and security,â it stated. âPakistan remains a strong proponent of non-militarisation of outer space. We will continue to work with like-minded countries to address gaps in the international legal regime governing the exploration and use of outer space with a view to ensuring that no one threatens peaceful activities and applications of space technologies for socio-economic development. In the absence of strong legal instruments, other states could also follow suit by demonstrating such capabilities,â says foreign offce.  ",https://www.newsone.tv/wp-content/uploads/2019/04/space.png,Pakistan,"['ISLAMABAD: On Tuesday early morning, three soldiers of the Pakistan Army were martyred and one wounded as Indian forces resorted to unprovoked firing  at Rawalakot Sectors Rakhchakri area, said the militarys media wing, Inter-Services Public Relations (ISPR).']",negative
