title,news,img-url,category,summery,opinionNewly appointed Foreign Secretary calls on FM Qureshi,"
ISLAMABAD (Web desk) - Newly appointed Foreign Secretary Sohail Mehmood called on Foreign Minister Shah Mehmood Qureshi in Islamabad on Wednesday and discussed different contours of the foreign policy.
The Foreign Minister congratulated Sohail Mehmood on assuming the charge of the foreign secretary.
Shah Mehmood Qureshi said that Sohail Mehmood is a seasoned and experienced diplomat, and he has a long experience of serving at important positions including as the high commissioner to India.
Sohail Mehmood in his remarks said that he will make utmost efforts to perform his duties to the best of his capabilities.
Sohail Mehmood replaced Tehmina Janjua who retired a day ago.",https://img.dunyanews.tv/news/2019/April/04-17-19/news_big_images/487418_30881723.jpg,pakistan,"Shah Mehmood Qureshi said that Sohail Mehmood is a seasoned and experienced diplomat, and he has a long experience of serving at important positions including as the high commissioner to India.",neutral
Prices of basic kitchen items surged in seven months ,"
LAHORE (Dunya News) – Following a recent hike in petroleum prices, rates of basic kitchen items besides mutton, beef and chicken have skyrocketed in the last seven months.
Prices of pulses have increased with a range of Rs4-39 per kilo, whereas the concerned authorities have claimed that faster rupee depreciation and rise in energy prices has resulted in increased prices of essential kitchen items.
After September 2018, the district administration of Lahore has issued official rates of food items now.
The prices of per kilo food items have increased the most in April, including lentils-washed (from Rs100 to 139), lentils-unwashed (from Rs100 to 128), gram pulse-washed (from Rs115 to 134), gram pulse-unwashed (from Rs95 to 119), pulse Masoor (from Rs76 to 94), pulse Chana (from Rs96 to 104), thick black chickpeas (from Rs100 to 104), thin black chickpeas (from Rs90 to 98), and sugar (from Rs55 to 60).
According to a report released by the World Bank on April 10, inflation is expected to increase in Pakistan during the next fiscal year and it could go above 10 percent.
According to the data released two days ago, inflation skyrocketed to a five-year high of 9.41 percent in March year-over-year. The facts came to surface when the State Bank of Pakistan raised its key interest rate by 50 basis points to 10.75 percent to contain further inflation.
In April 2014, inflation was recorded at 9.1 percent.
According to statistics, inflation rose by 6.7 percent from July till March in the current fiscal year, while inflation rose by 1.42 percent in March compared to February.
Statistics further determined that rate of tomato increased by 315 percent, green pepper by 151 percent, peas by 54 percent and cucumber by 45 percent in March 2019 as compared to rate of these essential commodities in March 2018.
 ",,pakistan,"According to a report released by the World Bank on April 10, inflation is expected to increase in Pakistan during the next fiscal year and it could go above 10 percent.",neutral
"20 bank accounts involved in money laundering, benami transactions freezed","
KARACHI (Dunya News) – A court in Karachi on Wednesday ordered to freeze 20 bank accounts, on a request by the Federal Bureau of Revenue (FBR), for allegedly illicit transfer of foreign exchange, money laundering and benami transactions.
The court made the decision in light of apprehensions by the FIA that the funds available in the accounts might be transferred or withdrawn. The court was told that the accounts were used to transact billions of rupees within and outside the country.
Four members of a same family in Karachi, including Pervez Ali, his daughters Sara and Anum, and son Jibran, had allegedly transferred more than $400,000 abroad. A case has been lodged against them.
In the application, the investigating officer (IO) said that the family had opened eleven bank accounts in 2016 for the purpose of money laundering. He added that they had transferred a total of $494,500 so far.
According to the IO, one of the suspects, Zor Talib Khan, who is the proprietor of Salar Enterprise and Salar Mining, had opened six benami accounts from 2012 to 2017.
An account of another suspect, a resident of Nusrat Bhutto Colony, Muhammad Ibrahim, was found to have transacted a total of Rs454 million from July 1, 2015 until June 30, 2018.
Additionally, eight benami accounts, which were used for transactions of over Rs8 billion, are also included in the accounts.
Four traders were accused of tax theft of over Rs1.26bn over the course of five years.
The investigation officer told the court that benami accounts were used for the business of paint shops, transporters, oil and spare parts.",https://img.dunyanews.tv/news/2019/April/04-17-19/news_big_images/487401_62558616.jpg,pakistan,"In the application, the investigating officer (IO) said that the family had opened eleven bank accounts in 2016 for the purpose of money laundering.",neutral
PM Imran reviews implementation of Ehsas Program ,"
ISLAMABAD (Dunya News) – Prime Minister Imran Khan on Wednesday has reviewed progress on implementation of ""Ehsas"" Program in Islamabad.

During the meeting, the premier said that Pakistan Tehreek-e-Insaf (PTI) government’s flagship program ""Ehsas"" is aimed at addressing the issue of poverty alleviation in a comprehensive manner.
PM said the government wants to ensure complete transparency in all programs, including Bait-ul-Maal so that the element of discretion could be eliminated.
He reviewed timelines for implementation of various policy actions of ""Ehsas"" program, including Tahaffuz, Kifalat, Housing for orphans and destitute, nutrition, district development portals, and employment. ",https://img.dunyanews.tv/news/2019/April/04-17-19/news_big_images/487400_24706950.jpg,pakistan,"During the meeting, the premier said that Pakistan Tehreek-e-Insaf (PTI) government’s flagship program ""Ehsas"" is aimed at addressing the issue of poverty alleviation in a comprehensive manner.",neutral
"China home to 20 million Muslims, over 35,000 mosques guarantees normal religious practices: Spokesperson","
BEIJING (APP) - China Wednesday said it guaranteed normal religious practices and respect the customs of religious believers and asked the western media to abide by journalistic ethics while reporting about vocational training institutions in Xinjiang.
“First of all, I want to correct you again. I don’t know what the ‘re-education camp’ you are talking about,” Chinese foreign ministry’s spokesperson Lu Kang said during his routine briefing while responding to a reporter who claimed that re-education camp in Xinjiang were linked to demolitions of Muslims mosques across China.
“We have said many times that the vocational skills education and training institutions established in Xinjiang have a very clear purpose,” he added.
The spokesperson informed that like other countries in the world, the Chinese government was taking preventive measures based on the need to fight terrorism and de-extremism.
“Such measures may be different in different countries, but the objectives are the same,” he added.
Lu Kang said, “As for your reference to the existence of anti-Islamism in China, I can tell you responsibly that there is no such situation.”
He said China implemented the policy of freedom of religious belief, adding, “Like other countries, we manage religious affairs in accordance with the law, resolutely oppose and combat religious extremism, and at the same time guarantee the normal religious needs of religious believers and respect the customs of religious believers.”
The spokesperson said China had more than 20 million Muslims and more than 35,000 mosques. The majority of religious believers could freely engage in religious activities in accordance with the law.
“I hope that the relevant media should not be keen on some untrue words, let alone concoct false news, but should abide by the journalistic professional ethics,” he added.
Two separate groups of Beijing-based diplomats and journalized had visited vocational training centers in Kashgar and Hotian in Xinjiang Uygur autonomous region.
They were briefed that vocational education centers had proved effective in eliminating religious extremism in the region.
They were told that these centers were not concentration or re-education camps as portrayed in some media reports rather they were like boarding schools where trainees enjoy free food and accommodations, learn languages, study laws and acquire skills. ",https://img.dunyanews.tv/news/2019/April/04-17-19/news_big_images/487483_14698602.jpg,world,"Lu Kang said, “As for your reference to the existence of anti-Islamism in China, I can tell you responsibly that there is no such situation.”
He said China implemented the policy of freedom of religious belief, adding, “Like other countries, we manage religious affairs in accordance with the law, resolutely oppose and combat religious extremism, and at the same time guarantee the normal religious needs of religious believers and respect the customs of religious believers.”
The spokesperson said China had more than 20 million Muslims and more than 35,000 mosques.",neutral
New Zealand disarms police as terror threat level lowered,"
WELLINGTON (AFP) - New Zealand police on Wednesday ended the routine arming of frontline officers as the terrorism threat level was lowered a month after the Christchurch mosques massacre.
Police and security agencies reduced the threat level from high to medium, meaning authorities judge that another attack, violent criminal behaviour, or violent protest remains ""feasible"" rather than ""very likely"".
The level is still higher than it was before the March 15 attacks, when the threat was deemed to be ""low"".
Prime Minister Jacinda Ardern said ""there is no current specific threat"", but the security agencies believed the medium level ""accurately reflects our current status"".
Frontline New Zealand police have historically not carried firearms and many people were shocked to see them heavily armed after 50 Muslims were gunned down while at Friday prayers.
Police commissioner Mike Bush said with the easing of the security threat level, the police had reassessed their position on arming frontline staff and the carrying of weapons would now be decided on a case-by-case basis.
The decision was made after ""significant consultation"" with mosques and Islamic Centres in relation to ongoing security, although Bush said he would not release details.
""There was never any intention for the routine carriage of firearms to continue indefinitely,"" Bush said.
""Generally this means frontline staff will transition back to our normal approach regarding carriage and access to firearms.
The police also released a timeline of the mosque attacks, showing it took 18 minutes from the time of the first emergency call to the apprehension of the alleged shooter.
A 28-year-old Australian, Brenton Tarrant, a self-avowed white supremacist, faces 50 murder charges and 39 of attempted murder over the attack.  ",https://img.dunyanews.tv/news/2019/April/04-17-19/news_big_images/487361_61603379.jpg,world,"Police and security agencies reduced the threat level from high to medium, meaning authorities judge that another attack, violent criminal behaviour, or violent protest remains ""feasible"" rather than ""very likely"".",neutral
Valley of the dolls: scarecrows outnumber people in Japan village,"
NAGORO (AFP) - In the tiny village of Nagoro, deep in the mountains of western Japan, the wind howls down a deserted street with not a living soul to be seen.
But yet the street appears busy, dotted with life-sized dolls that outnumber humans 10 to one, the product of a one-woman bid to counter the emptiness and loneliness felt in Nagoro, like many Japanese villages decimated by depopulation.
Nagoro, around 550 kilometres (400 miles) southwest of Tokyo, has become known as the valley of dolls after local resident Tsukimi Ayano began placing scarecrows on the street to inject some life into her depopulated village.
""Only 27 people live in this village but the number of scarecrows is tenfold, like 270,"" the 69-year-old doll maker told AFP in an interview at her home.
It all started 16 years ago when the dexterous Ayano created a scarecrow dressed in her father’s clothes to prevent birds eating the seeds she had planted in her garden.
""A worker who saw it in the garden thought it really was my father... he said hello but it was a scarecrow. It was funny,"" recalled Ayano.
Since then, Ayano has not stopped creating the life-size dolls, made with wooden sticks, newspapers to fill the body, elastic fabrics for skin and knitting wool for hair.
The skillful craftswoman needs only three days to make an adult-sized doll that are now scattered all around the village.
The secret to breathing life into the dolls? Applying pink colour to the lips and cheeks with a make-up brush, revealed Ayano.
At the local school, she has placed 12 colourful child-sized dolls at desks, positioned as if part of a lively class poring over their books.
The school closed seven years ago as there was no one left to teach, she recalled sadly.
""Now there are no children. The youngest person here is 55 years old.""
Down the street, a ""family"" of scarecrows lounges in front of an abandoned grocery shop while a doll dressed as an old farmer window-shops next door.
Near the bus stop, a group of scarecrows gathers as another ""father"" doll pulls a cart full of ""children.""

‘It’s lonely now’ 


While never humming with people, Ayano remembers as a child that Nagoro was once a well-to-do place with some 300 residents and labourers supported by the forestry industry and dam construction work.
""People gradually left... It’s lonely now,"" she said. ""I made more dolls as I remembered the time when the village was lively.""
Nagoro’s plight is replicated all around Japan, as the world’s third-largest economy battles a declining population, low birth rate and high life expectancy.
The country is on the verge of becoming the first ""ultra-aged"" country in the world, meaning that 28 percent of people are aged 65 or above.
The latest government report shows that 27.7 percent of a population of 127 million -- one in four people -- are aged 65 or older and the figure is expected to jump to 37.7 percent in 2050.
According to experts, around 40 percent of Japan’s 1,700 municipalities are defined as ""depopulated.""

‘Extremely difficult’ 


After World War II, when forestry and agriculture were the main economic drivers, many Japanese lived in rural villages like Nagoro. But young people started to leave for Tokyo in the 1960s, said Takumi Fujinami, economist at the Japan Research Institute.
""The economy was booming in Tokyo and industrial areas at that time. They were the only places people could earn money, so a lot of young people moved there,"" he said.
Prime Minister Shinzo Abe has pledged to revive regions outside Tokyo by pumping in tens of billions of yen, but this is not enough to stop young people from leaving their hometowns to work in Tokyo, Fujinami said.
""In order to combat depopulation, we need people moving in to depopulated areas. But recovering the population is extremely difficult,"" he said.
""Instead, it’s important to increase income or improve working conditions for young people in rural areas.""
For example, companies in rural areas tend to have fewer holidays than those in Tokyo, he said.
""We need to create communities where young people can make a long-term living ,"" Fujinami said, adding that subsidising them to move in is not enough.
While there is little evidence of citizens returning to Nagoro, Ayano’s dolls have attracted flesh-and-blood people from as far afield as the US and France.
""Before I started making scarecrows, nobody stopped by. Now many people visit here,"" she said.
""I hope Nagoro will become lively again and many people come here for sightseeing.""
""I don’t know what Nagoro will look like in 10 or 20 years... but I’ll keep on making dolls."" ",https://img.dunyanews.tv/news/2019/April/04-17-19/news_big_images/487358_19452946.jpg,world,"They were the only places people could earn money, so a lot of young people moved there,"" he said.",neutral
Trump vetoes bill to end US support for Saudi-led Yemen war,"
WASHINGTON (AFP) - President Donald Trump on Tuesday vetoed a resolution from Congress directing him to end US support for the Saudi-led war in Yemen, the second such move of his presidency.
The resolution was a harsh bipartisan rebuke to Trump that took the historic step of curtailing a president s war-making powers -- a step he condemned in a statement announcing his veto.
""This resolution is an unnecessary, dangerous attempt to weaken my constitutional authorities, endangering the lives of American citizens and brave service members, both today and in the future,"" Trump said.
The veto was the second of his presidency, after he overrode a congressional resolution that aimed to reverse the border emergency he declared in order to secure more funding for his wall between the United States and Mexico in March.
Vetoing the measure is an ""effective green light for the war strategy that has created the world s worst humanitarian crisis to continue,"" said International Rescue Committee president and CEO David Miliband.
""Yemen is at a breaking point with 10 million people on the brink of famine. There are as many as 100 civilian casualties per week, and Yemenis are more likely to be killed at home than in any other structure.""
Trump argued that US support for the bloody war between the Saudi-backed Yemeni government and Iran-aligned Huthi rebels was necessary for a variety of reasons, ""first and foremost"" to ""protect the safety of the more than 80,000 Americans who reside in certain coalition countries.""
These countries ""have been subject to Huthi attacks from Yemen,"" he said, referring to drone and missile strikes the Saudi-led coalition has either claimed were intercepted or denied altogether.
The president also said the resolution would ""harm the foreign policy of the United States"" and ""harm our bilateral relationships.""
And it would ""negatively affect our ongoing efforts to prevent civilian casualties and prevent the spread of terrorist organizations such as Al-Qaeda in the Arabian Peninsula and ISIS, and embolden Iran s malign activities in Yemen,"" Trump said, referring to two Sunni Muslim militant groups and his Shiite bete noire.
The resolution, which passed the US House of Representatives earlier this month and the Senate in March, was a historic milestone, as it was the first time in history that a measure invoking the 1973 War Powers Resolution reached the president s desk.
Democrats argued that US involvement in the Yemen conflict -- through intelligence-sharing, logistical support and now-discontinued aerial refueling -- is unconstitutional without congressional authority.
Speaker of the House Nancy Pelosi -- the country s most senior Democratic politician -- took aim at Trump s veto in a series of tweets on Tuesday.
""The conflict in Yemen is a horrific humanitarian crisis that challenges the conscience of the entire world,"" Pelosi wrote. ""Yet the President has cynically chosen to contravene a bipartisan, bicameral vote of the Congress & perpetuate America s shameful involvement in this heartbreaking crisis.""
Senator Bernie Sanders, a lead author of the Yemen resolution and a Democratic 2020 presidential candidate, said that ""the people of Yemen desperately need humanitarian help, not more bombs.""
""I am disappointed, but not surprised, that Trump has rejected the bi-partisan resolution to end U.S. involvement in the horrific war in Yemen,"" Sanders tweeted.
Critics of the intervention warn that Saudi forces are likely using US weapons to commit atrocities in the four-year war.
Some 10,000 people have been killed in Yemen over the past four years, according to the World Health Organization, although rights groups say the toll could be five times higher.
Both the Saudi-led alliance and Huthi rebels have been accused of acts that could amount to war crimes, while the coalition has been blacklisted by the United Nations for killing and maiming children.
 ",https://img.dunyanews.tv/news/2019/April/04-17-19/news_big_images/487347_76017416.jpg,world,"Trump argued that US support for the bloody war between the Saudi-backed Yemeni government and Iran-aligned Huthi rebels was necessary for a variety of reasons, ""first and foremost"" to ""protect the safety of the more than 80,000 Americans who reside in certain coalition countries.""",neutral
UN in negotiations on Libya ceasefire,"
UNITED NATIONS (AFP) - United Nations Security Council diplomats began negotiations Tuesday on a British-drafted resolution that would demand an immediate ceasefire in Libya after forces loyal to commander Khalifa Haftar launched an offensive on Tripoli.
The proposed text seen by AFP warns that the offensive by Haftar s Libyan National Army (LNA) ""threatens the stability of Libya and prospects for a United Nations-facilitated political dialogue and a comprehensive political solution to the crisis.""
The council ""demands that all parties in Libya immediately de-escalate the situation, commit to a ceasefire, and engage with the United Nations to ensure a full and comprehensive cessation of hostilities throughout Libya,"" the draft says.
After Britain circulated the text late Monday, a first round of negotiations was held during which Russia raised objections to references criticizing Haftar, diplomats said.
""They were very clear. No reference anywhere,"" a council diplomat said.
Britain was hoping to bring the measure to a vote at the council before Friday, but diplomats pointed to Russia s objections as a hurdle.
At least 174 people have been killed and more than 18,000 displaced since Haftar ordered his forces to march on Tripoli on April 4, according to UN figures. A rocket attack on the city killed two people and injured four on Tuesday.
Last week, Russia blocked a draft council statement that would have called on Haftar s forces to halt their advance on Tripoli.
The proposed measure echoed a call for a ceasefire by UN Secretary-General Antonio Guterres, who was in Libya to personally advance prospects for a political solution when the offensive was launched.
Haftar, seen by his allies Egypt and the United Arab Emirates as a bulwark against Islamists, has declared he wants to seize the capital, now controlled by a UN-recognized government and an array of militias.
Haftar backs a rival administration based in eastern Libya that is refusing to recognize the authority of the Tripoli government.
The draft resolution calls on all sides in Libya ""immediately to re-commit"" to UN peace efforts and urges all member-states ""to use their influence over the parties"" to see that the resolution is respected.
Resolutions adopted by the council are legally binding.
Diplomats have long complained that foreign powers backing rival sides in Libya threatened to turn the conflict into a proxy war.
Saudi Arabia is also seen as a key Haftar supporter, while Qatar -- which has tense ties with Riyadh and Abu Dhabi -- has called for stronger enforcement of the UN arms embargo to keep weapons out of Haftar s hands.
Russia and France, two permanent council members, have praised Haftar s battlefield successes in defeating Libyan armed groups aligned with the Islamic State in the south of the country.
Haftar s offensive on the capital forced the United Nations to postpone a national conference that was to draw up a roadmap to elections, meant to turn the page on years of chaos since the 2011 ouster of Moamer Kadhafi.
Guterres has said that serious negotiations on Libya s future cannot resume without a ceasefire.
 ",https://img.dunyanews.tv/news/2019/April/04-17-19/news_big_images/487346_50695608.jpg,world,"
UNITED NATIONS (AFP) - United Nations Security Council diplomats began negotiations Tuesday on a British-drafted resolution that would demand an immediate ceasefire in Libya after forces loyal to commander Khalifa Haftar launched an offensive on Tripoli.",neutral
