title,news,img-url,category,summery,opinionHundreds of Afghan delegates to meet with Taliban in Doha,"
(AFP) – Afghanistan published Tuesday a lengthy list of delegates who will meet with the Taliban in Doha this week, including government officials, in what could become the highest-level dialogue between the sworn enemies in years.
A massive roster published by the presidential palace comprises 250 names, including President Ashraf Ghani s chief of staff, Abdul Salam Rahimi, as well as his election running mate, Amrullah Saleh, the former head of Afghan intelligence.
Other delegates named on the list come from many walks of Afghan life including youth leaders, tribal elders and -- significantly -- 52 women.
The last time the Taliban met with the Afghan government was at secretive talks in Pakistan in 2015, which were quickly derailed by the news that Afghan Taliban leader Mullah Omar had died.
The three days of talks in Qatar, scheduled to start Friday, come amid a months-long push led by Washington for peace nearly 18 years after the US invasion, and as fresh violence rips across Afghanistan.
Any contact between the Kabul government and the Taliban is seen as hugely significant, because the insurgents view Ghani as a US stooge and his government as a puppet regime, and have long refused to speak with them directly.
They have insisted that any government officials attending this week s talks will be doing so only in a ""personal capacity"".
The US, which has cited significant progress after holding direct talks with the militants in Doha several times since September, is not expected to attend.
The militants have not announced a final list of who is headed to Doha, and distanced themselves from a report that suggested their delegation might also include women.
The peace process thus far has been widely criticised for a lack of female representation, and US peace envoy Zalmay Khalilzad has pushed for greater inclusivity.
While the Taliban previously met with Afghan representatives and politicians in Moscow in February, those talks did not include members of Ghani s government.
The spokesman for former president Hamid Karzai, who was at the Moscow talks, said Karzai supported the ""intra-Afghan"" conference in Doha but would not be attending.
Kabul has also been left out of the talks with the Khalilzad and the US delegation, prompting concerns the Afghan government is being sidelined in its own peace process and underscoring the importance of this week s meetings in Doha.
This month, the United Nations said it had lifted travel bans for 11 Taliban delegates so they could attend talks.
That list includes Mullah Abdul Ghani Baradar, a co-founder of the Islamist movement and its top political leader, as well as Sher Mohammad Abbas Stanikzai, the Taliban s chief negotiator and former deputy minister of foreign affairs.
The Taliban last week announced the start of Operation Fath, this year s spring offensive, and violence has continued apace across Afghanistan despite Khalilzad calling for a ceasefire.
 ",https://img.dunyanews.tv/news/2019/April/04-16-19/news_big_images/487306_33208701.jpg,world,"
(AFP) – Afghanistan published Tuesday a lengthy list of delegates who will meet with the Taliban in Doha this week, including government officials, in what could become the highest-level dialogue between the sworn enemies in years.",neutral
Cheap tactics: BJP virals Abhinandan's fake picture during election,"
(Web Desk) – Modi’s Bharatiya Janata Party BJP losing all sense of morality and ethics has resorted to cheap gimmicks to win over voters.
In a recent trick to secure an election win, BJP has made vrial a picture on social media  of the IAF pilot Abhinandan Varthanam, who was captured in the dog fight saga over Pakistani territory by PAF, after India violated Pakistani airspace and tensions mounted between the archrivals this Feb.

The post showcases an Abhinandan twin, wearing the symbolic saffron scarf with BJP’s  symbol ‘lotus,’ implying his vote was for BJP and message on the post reads.
‘Wing Commander Abhinandan ji has openly supported the BJP and even voted to make Modi ji Prime Minister, and he says there is no better Prime Minister than Modi at present, friends make this reach Jihadis and Congressis, you never brought back a jawan alive and today Abhinandan has returned alive and voted for BJP.’
The viral picture itself gives away its falsehood and the Indians are pointing out the deception of the political party.
According to media reports, first and foremost the Indian constitution does not allow serving armed forces personnel to be a part of political campaigns.
‘Under the Air Force Rules, 1969, IAF personnel are not permitted to take part in political activities.’

On closer inspection of the viral picture, one can easily decipher that someone is impersonating Abhinandan.
Despite the doppelganger wearing the handle bar moustache, a clear clue is the mole on the IAF pilot’s chin which is missing from the fibster posing as the pilot.
Secondly, the impersonator himself has a mole under his right eye which is not present on the real Abhinandan’s face. Social media has erupted with Indian citizens themselves exposing the forgery pointing out that this picture is taken in Gujrat while Abhinandan is registered to vote from Tamil Nadu.
 ",,world,"‘Wing Commander Abhinandan ji has openly supported the BJP and even voted to make Modi ji Prime Minister, and he says there is no better Prime Minister than Modi at present, friends make this reach Jihadis and Congressis, you never brought back a jawan alive and today Abhinandan has returned alive and voted for BJP.’
The viral picture itself gives away its falsehood and the Indians are pointing out the deception of the political party.",neutral
Notre-Dame fire in Paris: what we know so far,"
PARIS (AFP) - A fire that spread from the attic of Notre-Dame cathedral on Monday has caused its spire to crash to the ground, and devastated Paris’s historical monument.
This is what we know so far about the violent blaze:

Fire in the attic 


The fire began around 6.50 pm (1650 GMT).
""I was not far away, I saw the smoke. At first I thought it was the Hotel-Dieu (hospital) but then I realised it was the cathedral. When I arrived, ash was beginning to fall,"" said Olivier De Chalus, head volunteer guide of the cathedral.
The cause of the blaze was not immediately known. It spread from the attic, and quickly across a large part of the roof.
The flames devoured the roof’s wooden frame, which is more than 100 metres in length and nicknamed ""the forest"".
An investigation was opened for accidental destruction by fire, Paris prosecutors said.
Investigators were focussed on whether the fire spread from the site of ongoing reconstruction work on the roof of the cathedral, a source close to the investigation said.
Construction workers were spoken to Monday evening by investigators, the department said.

Fire ‘under control’ 


Firefighters announced early Tuesday the fire was ""completely under control"" and ""partially extinguished"". Only ""residual fires"" were still burning.
Around 11.00 pm (2100 GMT), they announced that the structure of the cathedral had been ""saved and preserved"".
From the moment the fire was spotted, a major emergency operation was put in place to contain the blaze.
Four hundred firefighters with 18 fire hoses, some perched on cranes tens of metres off the ground, battled to contain the fire as quickly as possible.
However, using water-bombing aircraft -- as suggested by US President Donald Trump -- was not considered: ""If used, (this) could lead to the collapse of the entire structure of the cathedral,"" France’s civil security service tweeted.

Extent of damage 


At around 7.50 pm (1750 GMT), the cathedral’s spire -- one of Paris’s most famous landmarks at 93 metres high -- collapsed.
Within a few hours, a large part of the roof had been reduced to ashes.
The extent of the damage inside the cathedral was not yet known by around 11.00 pm (2100 GMT).
""The fire affected two-thirds of the roof, which has collapsed, as well as the spire,"" said Paris fire brigade chief Jean-Claude Gallet, adding that the operation was focussed on preserving the rear of the cathedral where the most valuable works are located.
The Holy Crown of Thorns and a sacred tunic worn by 13th-century French king Louis, two irreplaceable artifacts, had been rescued, the cathedral rector Patrick Chauvet said.

‘Years of work’ 

Restoring the building will take ""years of work"", said the newly elected president of the Bishops’ Conference of France, Eric de Moulins-Beaufort.
In response to ""multiple requests"" the Fondation du patrimoine, a hertitage organisation, will Tuesday launch a ""national collection"" for the reconstruction of Notre-Dame, Anne Le Breton, deputy mayor of the French capital’s 4th arrondissement, said in a statement to AFP.
Overnight the Pinault family, one of the richest in France, pledged 100 million euros ($113 million) for Notre-Dame.
French President Emmanuel Macron, who headed to the scene, said a ""national undertaking"" would be launched, and that ""far beyond our borders, we will appeal to the greatest talents... who will contribute, and we will rebuild"". ",https://img.dunyanews.tv/news/2019/April/04-16-19/news_big_images/487245_23209318.jpg,world,"""The fire affected two-thirds of the roof, which has collapsed, as well as the spire,"" said Paris fire brigade chief Jean-Claude Gallet, adding that the operation was focussed on preserving the rear of the cathedral where the most valuable works are located.",neutral
British police arrest 113 climate change activists after London roads blocked,"
LONDON (Reuters) - British police have arrested 113 people after climate change activists blocked some of London’s most famous roads including Oxford Circus, Marble Arch and Waterloo Bridge in an attempt force the government to do more to tackle climate change.

The protests, led by British climate group Extinction Rebellion, brought parts of central London to a standstill on Monday and some stayed overnight for a second day of protest on Tuesday.

Extinction Rebellion, which generated headlines with a semi-nude protest in the House of Commons earlier this month, is demanding the government declare a climate and ecological emergency and reduce greenhouse gas emissions to net zero by 2025.

“There have been 113 arrests in total, the majority of which are for breach of Section 14 Notice of the Public Order Act 1986 and obstruction of the highway,” London police said.

Tents littered the roads at Oxford Circus with some activists huddled beneath a pink boat with the words “Tell the Truth” across its side. One placard read: “Rebel for Life”.

Police said five of those arrested had been detained after the Shell building near the River Thames was targeted.

Two protesters on Monday scaled up scaffolding writing ‘Shell Knows!’ in red paint on the front of the building and three protesters glued their hands to the revolving doors at the entrance.
 ",https://img.dunyanews.tv/news/2019/April/04-16-19/news_big_images/487239_45415066.jpg,world,"
LONDON (Reuters) - British police have arrested 113 people after climate change activists blocked some of London’s most famous roads including Oxford Circus, Marble Arch and Waterloo Bridge in an attempt force the government to do more to tackle climate change.",neutral
Fire breaks out at Al-Aqsa Mosque in Jerusalem,"
JERUSALEM (Dunya News) – A fire on late Monday erupted at Islam’s third-holiest site Al-Aqsa Mosque in Jerusalem and endangered a part of the worship place that is over 2,000 years old.

“The fire broke out in the guard’s room outside the roof of the Marwani Prayer Room,” Wafa news agency said, adding, “Fire brigade of the Islamic Waqf handled the matter successfully.”

The cause of the blaze has yet to be ascertained however, director general of the Jerusalem Waqf and Al-Aqsa Mosque Affairs Department Sheikh Azzam al-Khatib said that the fire could have been erupted due to the children who were playing there. 

No interior damage nor casualties were reported from the fire., said the authorities.

Palestinian President Mahmoud Abbas condemned the fire and warned anyone against targeting the holy site, stressing the need to preserve the compound’s “great religious and humanitarian value.” ",https://img.dunyanews.tv/news/2019/April/04-16-19/news_big_images/487236_77831587.jpg,world,"“The fire broke out in the guard’s room outside the roof of the Marwani Prayer Room,” Wafa news agency said, adding, “Fire brigade of the Islamic Waqf handled the matter successfully.”

The cause of the blaze has yet to be ascertained however, director general of the Jerusalem Waqf and Al-Aqsa Mosque Affairs Department Sheikh Azzam al-Khatib said that the fire could have been erupted due to the children who were playing there.",neutral
"Notre-Dame fire under control, Macron vows to rebuild","
PARIS (AFP) - A raging fire that tore through Notre-Dame Cathedral in central Paris was under control early Tuesday after the blaze brought its towering spire and roof crashing to the ground, wiping out centuries of priceless heritage central to French culture and history.
French President Emmanuel Macron vowed to rebuild the cathedral described as the soul of the nation and expressed relief that ""the worst had been avoided"" in a blaze that had at one point threatened the entire edifice.
Thousands of Parisians and tourists watched in horror from nearby streets cordoned off by the police as flames engulfed the building and officials tried to save as much as they could of the cathedral’s countless treasures, built up over centuries.
The inferno destroyed the roof of the 850-year-old UNESCO world heritage landmark, whose spectacular Gothic spire collapsed as orange flames and clouds of grey smoke billowed into the early evening sky.
Around 400 firefighters battled into the night to control the flames, declaring in the early hours of Tuesday that it was partially extinguished but completely under control, around nine hours after it broke out.
Paris fire brigade chief Jean-Claude Gallet said ""we can consider that the main structure of Notre-Dame has been saved and preserved"" as well as the two bell towers.
But ""the whole of the roof has been devastated... a part of the vault has collapsed, the spire is no more"", fire brigade spokesman Lieutenant-Colonel Gabriel Plus said.
Laurent Nunez, state secretary at the interior ministry, told reporters early Tuesday that with the immediate ""danger of the fire over,"" the focus would be on assessing the damage to the building’s structure.
Nunez said officials would meet shortly to see if the building was stable enough to allow fire services to go inside.

‘France is Notre Dame’ 


""Notre-Dame survived all the wars, all the bombardments. We never thought it could burn. I feel incredibly sad and empty,"" Stephane Seigneurie, a consultant who joined other shocked onlookers in a solemn rendition of ""Ave Maria"" as they watched the fire from a nearby bridge.
Gasps and cries of ""Oh my god"" erupted around an hour after the fire first broke out when the top portion of the church’s spire came crashing down.
""We have been dealt a knockout blow,"" a stricken-looking Paris Archbishop Michel Aupetit told reporters.
The cause of the blaze was not immediately clear, but the cathedral had been undergoing intense restoration work which the fire service said could be linked to the blaze.
French prosecutors said it was being currently being treated as an accident.
Historians expressed dismay at the collapse of a building that has been a symbol of France for almost a millennium.
""If Paris is the Eiffel Tower then France is Notre Dame. It’s the entire culture, entire history of France incarnated in this monument,"" Bernard Lecomte, a writer and specialist in religious history told BFM TV.
Deputy Paris mayor Emmanuel Gregoire told the channel that workers were scrambling ""to save all the artworks that can be saved.""
Officials later said teams had managed to salvage an unknown quantity of the cultural treasures.

‘Emotion of a nation’ 


Macron cancelled a planned national policy speech on recent ""Yellow Vest"" protests and instead headed to the scene, where he vowed the cathedral would be reborn.
""We will rebuild Notre-Dame because it is what the French expect,"" he said, describing Notre Dame as ""the epicentre of our life"" and the cathedral of ""all the French"", whether religious or not.
France’s billionaire Pinault dynasty immediately pledged 100 million euros for the reconstruction effort.
German Chancellor Angela Merkel called Notre-Dame cathedral a ""symbol of European culture"" as the blaze raged.
The Vatican on Monday expressed its ""incredulity"" and ""sadness"" over the fire.

‘Water bombers not used’ 


One firefighter was injured in the blaze, the fire brigade said, revising an earlier assessment that the individual was in a serious condition.
US President Donald Trump in a tweet said it was ""horrible"" to watch the fire but caused controversy by offering advice on how to put it out.
""Perhaps flying water tankers could be used to put it out. Must act quickly!"" he said.
But France’s civil security service, which oversees crisis management in the country, tweeted back at Trump that the use of water-bombing aircraft was not being considered.
""If used, (this) could lead to the collapse of the entire structure of the cathedral,"" it said.

‘Will never be the same’ 


The cathedral is located at the very centre of the French capital and its construction was completed in the mid-12th century after some 200 years of work.
During the French Revolution in the 18th century, the cathedral was vandalised in widespread anti-clerical violence: its spire was dismantled, its treasures plundered and its large statues at the grand entrance doors destroyed.
It would go on to feature as a central character in a Victor Hugo novel published in 1831, ""The Hunchback of Notre-Dame"" and shortly afterwards a restoration project lasting two decades got under way, led by architect Eugene Viollet-le-Duc.
The building survived the devastation of two global conflicts in the 20th century and famously rang its bells on August 24, 1944, the day of the Liberation of Paris from German occupation at the end of the World War II.
""Paris is disfigured. The city will never be like it was before,"" said Philippe, a communications worker in his mid-30s.
Jacky Lafortune, a 72-year-old artist and self-described atheist stood forlornly on the banks of the River Seine staring at the burning cathedral.
Comparing the mood in the French capital to the aftermath of a terror attack he said: ""But this stirs much deeper emotions because Notre-Dame is linked to the very foundations of our culture."" ",,world,"French President Emmanuel Macron vowed to rebuild the cathedral described as the soul of the nation and expressed relief that ""the worst had been avoided"" in a blaze that had at one point threatened the entire edifice.",neutral
Saudi Crown Prince meets commander of U.S. Central Command - report,"
CAIRO (Reuters) - Saudi Crown Prince Mohammed bin Salman met U.S. Central Command commander General Kenneth McKenzie in the capital Riyadh to discuss cooperation between the two countries, especially in the military arena, Saudi Press Agency said late on Monday.

They reviewed bilateral relations between the two countries and latest developments in the region, SPA said. ",https://img.dunyanews.tv/news/2019/April/04-16-19/news_big_images/487188_21441940.jpg,world,"They reviewed bilateral relations between the two countries and latest developments in the region, SPA said.",neutral
Yemen parties agree details of pullback plan: UN envoy,"
UNITED NATIONS (AFP) - Yemen s government and Huthi rebels have accepted a detailed plan for a much-delayed pullback from the flashpoint city of Hodeida, the UN envoy said Monday, but no timetable was announced for the withdrawals.
The redeployment of forces was agreed in December under a ceasefire deal reached in Sweden that offered the best hope in years of moving toward an end to the war that has pushed Yemen to the brink of famine.
UN envoy Martin Griffiths told the Security Council that ""both parties have now accepted a detailed redeployment plan"" for the first stage of the pullback from Hodeida.
Griffiths said he received assurances from Huthi leader Abdul Malik al Huthi when they met in Sanaa last week that his forces would support the Hodeida agreement, but the envoy sounded a note of caution after so many delays.
""Let us be clear that when -- and I hope it is when and not if -- these redeployments happen, they will be the first voluntary withdrawal of forces in this long conflict,"" he said by videoconference from Amman.
The United Nations announced a deal on the two-stage pullback from Hodeida city and its ports in February, but the redeployment failed to materialize on the ground and the peace effort has since stalled.
The United States put the onus on the Huthis to unblock the process and begin redeployments as agreed in the plan.
""The Yemeni government has demonstarted a clear commitment to the United Nations led process,"" acting US Ambassador Jonathan Cohen told the Security Council.
""It is time for the Huthis to also show the international community that they too are serious about the UN process and the agreements that they themselves reached in Stockholm,"" he said.
The United States, which has supported the Saudi-led coalition backing the government in Yemen s war, also accused the Huthis of blocking access to a food storage site that contains enough grain to feed 3.7 million people for a month.
The Red Sea Mills ""remain closed and the food stocks within may be rotten,"" said Cohen.  ""At this point only the Huthis are blocking access to the Mills and they alone will be to blame if the food spoils.""
The Red Sea port of Hodeida is the entry point for the bulk of imported goods and relief aid to Yemen.
The detailed plan on the pullback was negotiated by Danish General Michael Lollesgaard who heads a UN monitoring mission.
Following the deal on the first stage, Lollesgaard will now focus on the second phase and seek to resolve disputes over the deployment of local forces in areas from where there has been a pullback.
Griffiths said he was laying the groundwork for broader serious negotiations on ending the war in Yemen but added: ""We all need to see tangible progress in Hodeida before moving to focus on the political solution.""
The coalition intervened in Yemen in March 2015 to push back an advance by Huthi rebels who continue to hold the capital Sanaa, and restore Hadi to power.
The conflict has unleashed the world s worst humanitarian conflict, according to the United Nations, with millions facing famine.
 ",https://img.dunyanews.tv/news/2019/April/04-16-19/news_big_images/487171_34300077.jpg,world,The redeployment of forces was agreed in December under a ceasefire deal reached in Sweden that offered the best hope in years of moving toward an end to the war that has pushed Yemen to the brink of famine.,neutral
